place,info,태그
구니서당,김굉필의 후손들이 세운 서원,경상권 경상남도문화재자료 관광지 구니서당 역사 역사공부 역사관광지            
통영문화원,고유의 특색있는 향토 전통문화를 계승하는 기관,가곡교실 문화교육 문화시설 문화학교강좌 복합문화공간 열린문화공간   
광제서원,선현들의 학문과 덕행을 추모하던 서원,경상권 경상남도문화재자료 관광지 서원 역사 역사공부 역사관광지             
현대백화점 압구정본점,서울의 대표적인 쇼핑 명소,강남백화점 강남쇼핑 백화점 서울가볼만한곳 서울쇼핑 쇼핑 현대백화점 
대구 남구문화원,대구 남구의 문화를 선도하고 있는 문화 공간,남구문화원 대구 대구남구민문화유적답사 대구청소년역사체험하기 대덕문화의전당   
충주 강천리 석조여래입상,잡초가 많은 수풀 속에 방치되어 있던 석불 입상,관광지 역사 역사공부 역사관광지 역사를품은곳 역사문화재 역사속          
벌랏한지마을,한지에 대해 배울 수 있는 농촌체험마을,관광지 농촌체험 농촌체험마을 농촌체험여행 농촌체험학습 아이와함께         
완담서원,삼수 정귀령을 기리기 위한 곳,관광지 역사 역사관광지 역사를품은곳 역사문화재 역사속 역사속으로       
현대백화점 무역센터점,쇼핑과 문화를 함께 즐기기 좋은 곳,강남쇼핑 백화점 서울가볼만한곳 서울쇼핑 쇼핑 현대백화점 현대백화점무역센터점
한벽당,아름답고 조화로운 풍경 속 한벽당,관광지 역사 역사공부 역사관광지 역사를품은곳 역사문화재 역사속       
덕산서원(고성),선조들을 기리기 위해 조성된 서원,고성관광지 고성덕산서원 관광지 덕산서원고성 역사 역사공부 역사관광지          
평창문화원,지역 문화의 계승과 창조를 일구는 곳,강원도 무장애 문화교육 문화시설 문화예술 문화원 문화프로그램 
유금사(영덕),칠보산 기슭에 위치한 고찰,관광지 불교 불교문화 사찰 사찰여행 역사 연중무휴 영덕유금사      
청주문화원,청주의 역사와 전통문화를 보존하고 계승하는 곳,교육프로그램 남녀노소 문화공간 문화시설 전통문화 청원문화원 체험프로그램  
충주 단호사 삼층석탑,작지만 안정감 있고 격식 있는 석탑,관광지 역사 역사공부 역사를품은곳 역사문화재 역사속 역사속으로        
시립목동청소년센터,꿈과 희망을 키우는 목동청소년수련관,교육프로그램 레포츠 목동청소년수련관 서울 양천구 청소년수련원
충주 숭선사지 당간지주,불화를 그린 깃발을 꽂은 장대를 지지하는 구조물,관광지 숭선사지당간지주 역사 역사관광지 역사문화재 역사속 역사속으로         
"덕양장 (3, 8일)",가축 시장하면 덕양장,가족여행 덕양장 사계절 쇼핑 시장맛집 아이와함께 월간_사진_제보_이벤트     
"서시장 (4, 9일)",고객과 상인이 더불어 공존하는 즐거운 시장,가족여행 골목형시장 돌산대교 사계절 서시장 쇼핑 시장맛집 아이와함께      
경주 신무왕릉,신라 45대 신무왕의 능,경상권 관광지 사적 역사 역사공부 역사관광지 역사를품은곳 역사문화재       
아지청소년야영장,힐링 캠핑여행,레포츠 영주 영주야영장 영주캠핑 캠핑
대구미술관,"대구와 세계, 현재와 미래를 품는 대구미술관",BTS bts여행 bts투어 RM 가볼래터 경상권 대구미술관 데이트코스          
도동서원(고창),애국충절의 혼이 가득한 서원,고창군향토문화유산 고창여행 관광지 문화재 서원 역사 역사관광          
분강서원,조선 중기 문신 농암 이현보 선생을 추모하는 공간,관광지 역사 역사공부 역사관광지 역사를품은곳 역사문화재 역사속       
압구정 로데오거리,한국의 유행 1번지,가족과함께 강남구 강남시티투어 관광지 산책하기좋은곳 쇼핑거리 수도권       
사직공원(서울),조선시대 사직단이 있는 곳,관광지 교과서속여행 사직공원(서울) 산책길 산책하기 산책하기좋은곳       
병풍산,병풍을 두른듯 하늘 높이 솟은 산줄기,관광지 담양산행체험 담양여행 자연 자연관광지 전라남도여행 트레킹
부산광역시교육청학생인성교육원,체험으로 깨닫게 만드는 교육원,교육여행 교육원 교육프로그램 레포츠 부산금정구 청소년 청소년수련원   
오봉산 석굴암,천년고찰 양주 오봉산 석굴암,관광지 불교 불교문화 사찰 사찰여행 역사 월간_사진_제보_이벤트   
구포 축산물도매시장,역사와 전통이 있는 축산물 전문 도매시장,경상권 구포도매시장 구포축산물도매시장 구포축산물시장 도매시장 쇼핑   
강서청소년회관,청소년이 함께 즐기며 배우는 학습의 마당,강서청소년회관 레포츠 청소년시설 청소년아지트 청소년회관
명동,"쇼핑의 중심지, 서울 대표 관광명소 명동",15_16한국관광100선 17_18한국관광100선 19_20한국관광100선 관광지              
완도 청해포구촬영장,생생한 드라마 속 역사적 현장,관광지 드라마 촬영지 드라마세트장 사진여행 사진찍기 사진찍기좋은곳       
"완도장 (5, 10일)",따뜻한 정이 넘치는 완도장,가족과함께 사계절 쇼핑 아이와함께 완도장 월간_사진_제보_이벤트    
울산해양박물관,희귀 산호와 패류를 전시하는 해양생태박물관,가족여행 경상권 문화시설 박물관 산업관광 생태관광지 아이와함께   
울산 농수산물도매시장,"싱싱한 채소와 과일, 수산부류를 만날 수 있는 곳",가족여행 경상권 기차여행 나들이 나홀로여행 먹거리 쇼핑 시장맛집      
코리아크래프트브류어리,한국 맥주의 철학을 담은 수제맥주,관광지 남녀노소 미식여행 생맥주 수제맥주 이색체험 이색카페 주류      
남양주시립박물관,남양주 선조들의 자취를 담은 곳,가족과함께 남녀노소 남양주문화재 남양주박물관 남양주시립박물관 남양주역사박물관          
오미요리연구소,전통시장에서 배우는 쿠킹클래스,관광지 남녀노소 연인과함께 요리공방 요리체험 전통요리 체험 체험프로그램  
"임실장 / 임실시장 (1, 6일)",넉넉한 시골인심을 만날 수 있는 시장,가족여행 기차여행 나들이 나홀로여행 먹거리 쇼핑 시장맛집 아이와함께         
신수도,일주도로를 따라 걸으며 즐기는 아름다운 섬,2020_휴가철찾아가고싶은_33섬 2022찾아가고싶은섬 2022찾아가고싶은섬_봄섬                    
충북문화관,도심에서 만나는 고즈넉한 문화공간,공연&전시 문화관광해설사 문화시설 문화행사 복합문화공간 열린문화공간        
소안도,"해방의 땅, 항일운동의 성지로 불리는 섬",2021_휴가철찾아가고싶은_33섬 경치여행 경치좋은곳 관광지 바다경치       
가리왕산,자연경관과 생태환경이 뛰어난 한국의 100대 명산,경치좋은곳 관광지 자연 자연관광지 자연속으로 자연여행 자연좋은곳     
부산 감천문화마을,생활과 예술이 공존하는 부산의 역사를 간직한 곳,15_16한국관광100선 17_18한국관광100선 19_20한국관광100선 2024_여행가는달과함께하는_발도장여행지                        
"남리장 (3, 8일)",해남군 황산면에서 즐기는 시골장,가족여행 남리장 사계절 쇼핑 시장맛집 아이와함께 월간_사진_제보_이벤트     
비금도,천일염과 시금치와 명사십리의 섬,관광지 섬여행 신안여행 일몰명소 자연 전라남도여행 해안도로
"십일시장 (4, 10일)",정겨운 마음이 오가는 십일시장,가족여행 사계절 쇼핑 시장맛집 십일시장 아이와함께 월간_사진_제보_이벤트     
오류,,
주렁주렁 경주점,동물을 만나는 가장 새로운 방법,가족체험여행 관광지 생태관광 실내관광지 아이와함께 이색체험 체험학습
성남프라자,울산 최고의 혼수 용품 시장,남녀노소 생활잡화 쇼핑 쇼핑시설 식품잡화 울산 울산가볼만한곳         
한국문인인장박물관,문인들의 인장(印章)을 모아 전시한 박물관,가족과함께 근대문화유산 기획전시 남녀노소 문화시설 박물관 아이와함께        
인천광역시 미추홀구 청소년수련관,미래 역량을 갖춘 청소년을 목표로 청소년이 주도하는 수련관,교육프로그램 레포츠 인천미추홀구 청소년수련관
포천 산사원,항아리와 인생샷 한 컷,관광지 박물관 산사원 산업관광 산업관광지 수도권 연인과함께 이색체험          
인도미술박물관,다양성과 조화의 나라 인도를 배우는 공간,강원권 문화공간 문화시설 문화예술공간 박물관 복합문화공간 아이와함께      
용담댐 물 문화관,물의 소중함과 중요성을 배워보자 !,관광지 물문화관 산업관광 산업관광지 신재생에너지 아이와함께 연인과함께        
춘향허브마을,향기로운 허브향이 가득한 마을,가족체험 관광지 농촌마을 농촌체험 농촌체험마을 아이와함께 자연마을       
최영장군묘,청렴결백했던 고려 말기의 명장 최영 장군의 묘,경기도기념물 관광지 수도권 역사 역사공부 역사관광지 역사를품은곳         
미륵대흥사(단양),신라 때 창건된 역사 깊은 사찰,관광지 미륵대흥사 불교 불교문화 사찰 사찰여행 역사 자연환경      
선국사(남원),동학농민군의 은신처가 되었던 호국 도량,관광지 교룡산성 남원여행 문화재 불교 불교문화 사찰 사찰여행         
"능주전통시장 (5, 10일)",현지의 각종 특산물을 만나볼 수 있는 시장,가족여행 능주장 능주전통시장 사계절 쇼핑 시장맛집 아이와함께     
울산대공원,자연과 엔터테인먼트가 조화를 이루는 녹색문화공간,2024_여행가는달과함께하는_발도장여행지 가족과함께 가족나들이 관광지             
삼매봉도서관,한라산 조망이 가능한 문화와 소통의 복합공간,공공시설 도서관 독서 독서여행 문화공간 문화시설 복합문화공간        
조천읍도서관,도민의 독서생활화를 위해 노력하고 있는 곳,교육프로그램 남녀노소 도서관 독서 독서여행 문화공간 문화시설       
영인석불,아산 지역에서 가장 아름다운 석불입상,관광지 불상 아산석불 역사 역사공부 역사관광지 역사를품은곳 역사문화재           
면천낚시터,풍부한 수자원과 잔잔한 저수지의 풍경이 아름다운 곳,당진낚시터 당진저수지 레포츠 민물낚시 자연속으로 자연여행 자연좋은곳    
"무극장 / 무극시장 (5, 10일)","마음 따뜻한 시장, 무극시장",가족여행 무극시장 무극장 사계절 쇼핑 시장맛집 아이와함께 재래시장    
원주한지테마파크,오색영롱한 260여 색의 화려한 색 한지,2020_산업관광지_13선 강원권 강원도_여행지_추천 관광지 문화관광해설사               
서흥김씨삼강정문,삼강을 지킨 서흥김씨 집안의 행적을 기록한 정문들,관광지 역사 역사공부 역사관광지 역사를품은곳 역사문화재 역사속         
농민문학기념관,농촌 현실과 농민의 애환을 형상하는 농민문학,가족과함께 기념관 남녀노소 농민 농민문학 농민문학기념관 문학        
덕포해수욕장,해양 레저를 즐길 수 있는 조용한 해변,거제가볼만한곳 거제덕포레저 거제아이와가볼만한해수욕장 거제해수욕장           
신평양조장 백련 양조문화원,"양조산업의 과거와 현재, 그리고 미래를 경험하는 특별한 한국식 브루어리 투어",2020_산업관광지_13선 가족여행 관광지 당진신평양조장 백련양조문화원            
광양만권 경제자유구역 홍보관,신산업 문화관광이 어우러진 역동적인 국제무역도시,2차전지 GFEZ 경제자유구역 관광지 광양 광양경제청 광양만권 광양만권경제자유구역                      
[남해 바래길] 고사리밭길,해안선을 따라 이어지는 아름다운 고사리밭길,고사리밭길 남해 바래길 남해바래길 남해트레킹 남해트레킹코스 레포츠    
구성폭포,아홉 가지 소리를 내는 아름다운 폭포,경치여행 경치좋은곳 관광지 자연 자연속으로 자연여행 자연좋은곳   
장좌마을,"장보고의 청해진, 감태의 마을",관광지 숙박 완도마을 완도여행 자연 전라남도여행 힐링여행
박인환문학관,한국 모더니즘의 대표 시인 박인환의 삶과 문학세계,가족과함께 강원권 기념관 문학 문학관 문학기행 문화시설 박인환시인       
삼진어묵 체험·역사과학관,직접 어묵을 만들며 부산어묵의 역사를 배울 수 있는 곳,가볼래터 가족과함께 경상권 관광지 산업관광 산업관광지 삼진어묵         
무주덕유산리조트 썰매장,설원에서 즐기는 동심의 세계,덕유산 덕유산국립공원 레포츠 무주덕유산 무주덕유산리조트 무주리조트  
상주동학교당,동학운동의 성지이자 전국 유일의 동학운동 유물 전시장,경상권 경상북도민속문화재 관광지 동학교당 상주동학교당 역사 역사공부        
신흥계곡,대둔산 자락에 숨은 계곡,계곡 관광지 물놀이 여름피서지 완주여행 자연 피서지
왕산해수욕장,해변 풍경과 낙조가 아름다운 해수욕장,2024_여행가는달과함께하는_발도장여행지 가족과함께 관광지 남녀노소                  
월강서원,조선후기 선현을 추모하기 위해 창건한 서원,관광지 역사 역사공부 역사관광지 역사를품은곳 역사문화재 역사속    
바하마수상레포츠,오랜 전통과 신뢰를 바탕으로 한 품격있는 바하마수상레포츠,경치좋은곳 레저스포츠 레포츠 수상레저 수상레포츠 수상스키 수상스포츠   
국립현대미술관 서울,동시대 현대미술을 중점적으로 다루는 미술관,광화문미술관 국립현대미술관서울관 기념품판매 문화공간 문화시설 문화예술활동            
양평 구 구둔역,레트로 감성 가득한 별자리의 성지,건축학개론촬영지 관광지 구둔역 근대건축물 뉴트로_감성여행 데이트명소                 
등선폭포(삼악산),자연의 웅장한 신비,관광지 자연
지산컨트리클럽,자연의 정취와 함께하는 곳,골프 레포츠 용인 용인골프장 지산컨트리클럽
H1 컨트리클럽,자연 속 즐거움이 가득한 곳,H1컨트리클럽 경기권 골프장 레포츠 에이치원클럽 이천
기백산 용추계곡과 용추폭포,맑은 계곡과 울창한 원시림이 있는 계곡과 웅장한 폭포,경남용추계곡 경남용추폭포 경상권 관광지 기백산 기백산용추폭포 여름피서지        
목동아이스링크(실내),국제규격을 갖춘 서울의 대표적인 실내 아이스링크장,가족과함께 겨울스포츠 레포츠 복합레저스포츠 스케이트 스케이트장  
묵호항,청정 동해바다의 신선한 수산물을 맛볼 수 있는 묵호항,강원권 관광지 묵호항 문화관광해설사 바다풍경 산불피해지역 산불피해지역  
아이즈빌아울렛,다양한 브랜드 매장과 영화관을 갖춘 초대형 멀티 쇼핑 센터,부평쇼핑몰 부평아울렛 부평아이즈빌아울렛 쇼핑 인천부평아이즈빌아울렛 
대구예술발전소,예술가와 시민을 위한 아트플랫폼,경상권 기념품판매 뉴트로_감성여행 대구예술발전소 문화시설 문화행사    
죽림사(영천),유봉산에 위치한 은해사의 말사,관광지 불교 불교문화 사찰 사찰여행 역사 자연속으로 자연환경       
영월 동굴생태관,동굴에 관한 모든 것이 있는 우리나라 최초의 동굴전시관,가족과함께 강원권 문화시설 미세먼지탈출_이색동굴여행 박물관 생태관광지      
종로6가 대학천 책방거리,문화와 예술이 즐비한 곳,관광지 쇼핑 아동용전집 월간_사진_제보_이벤트 종로 종로책방거리      
띠밭넘어해변,사계절이 아름다운 신안 우이도에 자리한 해변,관광지 섬여행 신안해변 자연 자연관광지 자연여행 전라남도여행
능주향교,현재도 교육의 기능을 충실히 시행하고 있는 향교,관광지 능주향교 역사 역사공부 역사관광지 역사를품은곳 역사문화재                  
청량사(부산),금계포란형의 명당에 자리 잡은 사찰,경상권 관광지 부산청량사 불교 불교문화 사찰 사찰여행 역사 연중무휴          
금일명사십리해수욕장,해변의 해당화와 파도가 장관인 해변,관광지 여름피서지 자연 자연좋은곳 자연환경 전라권 풍경좋은곳    
한대오름,단풍이 아름다운 한라산 기슭의 오름,관광지 단풍 오름 자연 제주 제주가볼만한 제주오름 제주한대오름
태화강 국가정원,울산 태화강에 있는 6개의 주제를 가진 테마정원,2024_여행가는달과함께하는_발도장여행지 21_22한국관광100선 23_24한국관광100선                    
초도마을,수려한 자연경관으로 아름다운 마을,고성가볼만한곳 고성여행 관광지 어촌체험 자연
원주 중앙시장,시민의 정서와 애환이 깊이 어린 전통시장,가족여행 강원권 기차여행 나들이 나홀로여행 먹거리 서울근교여행          
댕이골 전통음식거리,다양한 먹거리가 가득한 곳,관광지 맛집 맛집탐방 숨은맛집 음식거리 음식거리 음식문화 음식문화거리       
첨도,온통 초록으로 뒤덮인 뾰족한 송곳 섬,고흥섬 고흥여행 관광지 낚시명소 낚시체험 섬 자연 전라남도여행
은적사(해남),해남 8경에 손꼽히는 수월도량,가족여행 관광지 불교 불교문화 사찰 사찰&산사 사찰여행 역사 은적사(해남)          
오봉저수지,어족 자원이 풍부한 곳,레포츠 오봉저수지 임실 임실저수지 저수지
삼척 도계전두시장,신선한 지역 특산품의 성지,가족여행 강원권 기차여행 나들이 나홀로여행 먹거리 삼척도계전두시장        
중원산,중원계곡과 용계계곡을 끼고 있는 경관이 수려한 산,관광지 양평 양평계곡 양평산 양평중원산 용문산 자연 중원계곡
해우재,변기모양의 박물관,가족여행 가족여행지 가족체험여행 똥도서관 문화시설 박물관 산책길           
교래 삼다수마을,마을 주민과 제주개발공사가 함께 만든 마을,관광지 농촌마을 농촌여행 농촌체험마을 농촌체험여행 농촌체험학습            
"춘천 풍물시장(2, 7일)","볼거리, 먹거리, 생동감이 넘치는 춘천 풍물시장",가족여행 강원권 기차여행 나들이 나홀로여행 먹거리 서울근교여행          
각산,바다와 섬 사천의 전망을 즐길 수 있는 명산,각산 경상권 경치좋은곳 관광지 등산객 등산여행 산책길 산책하기       
강화전적지,외세에 대항했던 강화도의 요새,가족여행 강화전적지 관광지 나들이 당일치기여행 드라이브여행 서울근교여행           
원주 남부시장,주민들이 즐겨 찾는 전통시장,가족여행 강원권 기차여행 나들이 나홀로여행 먹거리 서울근교여행         
혜국사,주흘산의 절경 속에 어우러진 사찰,관광지 불교 불교문화 사찰 사찰여행 역사 자연속으로 자연환경       
이바구공작소,초량 산복도로의 소소한 이야기를 전시하는 곳,감성사진 남녀노소 문화시설 복합문화공간 사진여행 사진찍기 사진찍기좋은곳    
백범 김구 선생 동상,김구 선생의 애국정신을 기리는 곳,3·1운동_100주년_여행지추천 가족여행 관광지 김구동상 나들이 남산공원광장             
[증도 모실길 3코스] 천일염길,"바다에서 나는 금, 소금을 따라 걷는 길",레포츠 신안군트래킹 신안증도 신안트래킹 월간_사진_제보_이벤트 자연좋은곳      
울산 들꽃학습원,우리 꽃의 아름다움을 느낄 수 있는 생태학습공간,가족여행 관광지 들꽃학습원 생태관광 아이와함께 울산들꽃학습원 울산생태체험 
국립 지리산자연휴양림,대자연의 장엄함을 간직한 지리산 자연휴양림,가족여행 걷기길 경상권 관광지 나들이 여름여행 연인과함께 자연          
영동 흥학당,많은 인재를 배출한 서당,관광지 역사 역사공부 역사관광지 역사를품은곳 역사문화재 역사속      
"진부전통시장 (3, 8일)",활기 넘치는 정겨운 전통시장,5일장 가족여행 강원권 기차여행 나들이 나홀로여행 먹거리 쇼핑          
아라리오뮤지엄 인 스페이스,현대미술에 문화적 가치를 더하다,문화공간 문화시설 문화예술 문화예술공간 미술품 복합문화공간 연인과함께       
흑산도 해상관광유람선,흑산도의 아름다운 해상관광을 볼 수 있는 곳,경치좋은곳 관광지 남녀노소 바다경치 자연관광 자연관광지 자연속으로       
신라면세점 서울점,글로벌 신라면세점의 플래그십스토어,면세쇼핑 면세점 브랜드 쇼핑 신라호텔
요산김정한문학관,요산 김정한 선생의 삶과 문학의 발자취를 느껴보는 전시공간,문화공간 교육프로그램 금정구 문학기행 문학여행 문학체험 문화시설      
오장환문학관,오장환 시인의 삶과 작품을 기리는 공간,가족과함께 문학 문학관 문화시설 보은가볼만한곳 보은여행 보은오장환문학관       
인천 현대시장,동구의 대표적인 재래시장,가족여행 나들이 나홀로여행 드라이브여행 먹거리 서울근교여행 쇼핑           
원주 도래미시장,아름다운 미래로 향해가는 원주의 제일 행복한 시장,가족여행 강원권 기차여행 나들이 나홀로여행 먹거리 서울근교여행        
고기동 오리촌,다양한 토속 음식을 맛볼 수 있는 곳,가족과함께 건강식 관광지 맛집 맛집탐방 숨은맛집 어르신여행 오리구이      
[남해 바래길] 다랭이지겟길,남해사람들의 강인한 생명력이 묻어 있는 삶의 길,남해 바래길 다랭이지겟길 레포츠 산책코스 아무것도_하지않을_자유_비움여행 
춘천 서부시장,조선 시대 춘천 읍내 장을 계승한 전통시장,가족여행 강원권 기차여행 나들이 나홀로여행 먹거리 서울근교여행        
[대구올레 팔공산 3코스] 부인사 도보길,대구에서 느리게 걷는 여행,대구올레 대구올레길 둘레길 레포츠 월간_사진_제보_이벤트 팔공산
구시포마을,길고 넓은 백사장과 울창한 송림이 아름다운 마을,고창군 관광지 바다 백사장 숙박 자연
[대구올레 팔공산 6코스] 단산지 가는 길,평온한 호수와 부드러운 흙길을 걸으며 휴식하기 좋은 코스,경치여행 경치좋은곳 레포츠 산책하기좋은곳 월간_사진_제보_이벤트       
송정공원,역사를 배울 수 있는 공원,가족과함께 관광지 박용철 시인 산책길 산책하기 산책하기좋은곳 송정공원         
직연폭포,힘차게 쏟아지는 물줄기가 절경인 폭포,강원권 관광지 자연 직연폭포 폭포
명봉도서관,학문의 개발을 통해 풍부한 지식을 심어주는 도서관,남녀노소 독서여행 독서회 문화시설 복합문화공간 열린문화공간 자료실      
인천 종합어시장,서해에서 잡은 싱싱한 수산물이 가득한 어시장,가족여행 나들이 나홀로여행 드라이브여행 서울근교여행 쇼핑 수도권     
소리도 등대,남해 바다의 길잡이인 무인 등대,관광지 남해바다 등대 섬여행 여수여행 자연
장기려기념 더 나눔센터,한국의 슈바이처로 불리며 평생을 헌신한 장기려 박사,2024_여행가는달과함께하는_발도장여행지 가족과함께 문화공간 문화시설         
거문도 신선바위,아름다운 경치에 반해 신선이 내려와 풍류를 즐겼던 곳,경치여행 경치좋은곳 관광지 자연 자연발생 자연속으로 자연여행   
호안다구박물관,차에 대한 모든 것이 있는 다구(茶具) 전문 박물관,강원권 문화시설 미식여행 박물관 역사공부 역사속 역사속으로 역사이야기       
화원 오시아노 관광단지,남도의 아름다운 자연 속에서 갖는 최고의 휴식,2022_추석_당일치기_여행 가족여행 관광지 연인과함께 영화&드라마촬영지                      
국립대구과학관,과학 기술문화 확산과 대중화를 위해 노력하는 체험형 과학관,4D영상과학관 경상권 과학공원 과학관 과학놀이터 교과서속여행 교육여행              
