place,info,태그
하동공설시장,소설 토지의 모티브가 되기도 한 하동 읍내 장터,관광형시장 쇼핑 토지장터 평사리최참판시장 하동관광형시장 하동전통시장
서해5도수산물복합문화센터,서해5도 어민이 제철 수산물을 직접 판매하는 곳,검암역수산물센터 상차림회 서해5도수산물복합문화센터 쇼핑 아라꿈도서관   
알부스갤러리,국내 최초의 일러스트레이션 전문 갤러리,BTS bts여행 bts투어 RM 갤러리데이트 문화시설 아이와함께가볼만한곳     
인천개항장 근대건축전시관,서구 근대 건축물을 감상하다,동인천관광 동인천여행 문화시설 인천가볼만한곳 인천개항장 인천개항장근대건축전시관  
청마가옥,칵테일 클래스가 있는 부산의 이색 공간,데이트코스 분위기맛집 쇼핑 체험 친구와함께
해양테마체험관 (당진),해양안전 및 다양한 해양 생물들을 생동감 있게 체험할 수 있는 곳,관광지 당진가볼만한곳 당진가족여행 당진체험학습 삽교호함상공원 충남여행  
대천항유람선,신비한 대자연을 온몸으로 느끼는 여행,관광지 대천크루즈 대천항유람선 보령여행 서해바다여행 서해유람선  
인구항,낭만이 가득한 서퍼들의 천국,관광지 양양관광 양양명소 양양여행 작은항구 죽도정
명장섬해수욕장 (장고도),신비의 바닷길이 열리는 곳,관광지 보령가볼만한곳 보령섬여행 보령여행 보령해수욕장 신비의바닷길 
단관공원,도심 속 시민들을 위한 휴식 공간,관광지 무공탑 원주공원 원주관광 원주명소 치악의웅지
블루프린트북,음악과 책과 커피 향이 있는 감성 책방,공주가볼만한곳 데이트코스 동네책방 쇼핑 실내여행지 심야책방 책방
스페이스K 서울,새로운 시각예술의 흐름을 소개하는 예술나눔의 공간,SpaceK 강서구갤러리 갤러리데이트 마곡가볼만한곳 마곡갤러리 마곡데이트코스    
신평화패션타운,서울 중구 동대문 평화시장 길 건너편에 위치한 5층 규모의 패션타운,동대문시장 동대문의류상가 쇼핑 신평화시장 신평화패션타운 의류도매시장 
동화상가,의류 부자재 전문상가,동화상가 쇼핑 의류부자재 의류부자재시장 의류부자재전문상가
서산B지구방조제,멋진 풍경을 즐기며 드라이브하기 좋은 곳,관광지 서산AB방조제 서산B지구방조제 서산가볼만한곳 서산낚시 서산바다여행  
금강2경 도보여행길,"시원하게 달리기도, 쉬엄쉬엄 걷기도 좋은 코스",걷기좋은길 관광지 금강2경 레포츠 서천걷기여행 서천도보여행 서천여행  
금강하구 철새도래지 (서천),철새들의 낙원,관광지 금강하구철새도래지 서천가볼만한곳 서천군조류생태전시관 서천금강철새길   
후진항,양양의 사진 명소인 빨간등대,관광지 비치마켓 양양관광 양양명소 양양여행 작은항구
엄둔계곡,맑고 깨끗한 계곡에서 힐링하다,강원도관광 계곡 계곡피서 관광지 여름계곡 영월관광 월간_사진_제보_이벤트
해피주,동물들에게 먹이를 줄 수 있는 실내 동물원,관광지 동물먹이주기 동물을만나다 동물체험 아이들과가볼만한곳 원주동물원  
마량포구,일출을 감상할 수 있는 마량포구,관광지 마량포구 마량포해돋이마을 서천여행 서천일출 서천해돋이 일출감상  
장항항,꼴뚜기와 갑오징어가 유명한 서천의 항구,관광지 꼴갑축제 서천가볼만한곳 서천여행 서천항구 장항항 장항항꼴깝축제
남평화상가,서울 중구 장충단로에 위치한 가방 및 의류 전문 도매상가,가방전문시장 남평화상가 남평화시장 도매시장 동대문남평화 쇼핑 패션남평화
청평화패션몰,건물형 의류 도매상가로 유명한 곳,동대문청평화시장 쇼핑 의류도매시장 청평화시장 청평화패션몰
문암항,"길게 뻗은 방파제 끝, 빨간 등대가 있는 항구",강원도낚시여행 강원여행 고성가볼만한곳 고성바다여행 고성배낚시 관광지  
씨스카이월드 짚라인,체험여행 떠나기 좋은 곳,레포츠 씨스카이월드 인천레포츠 인천여행 인천짚라인 장성호수변길  
백도항/문암1리항,작은 배들이 옹기종기 모인 아늑한 항구,강원여행 고성가볼만한곳 고성바다여행 관광지 낚시여행 백도항 백도해수욕장 
삼국지벽화거리,벽화로 즐기는 삼국지 명장면,관광지 동인천가볼만한곳 동인천여행 삼국지벽화거리 인천관광 인천나들이  
광명항,잔잔한 어촌의 정겨움을 느낄 수 있는 곳,관광지 선인장마을 손바닥선인장 올레14코스 월령포구 제주노클링명소    
응봉,수려한 경관으로 유명한 곳,고성8경 고성관광 고성여행 관광지 동해여행 동해일출감상 별빛따라밤밤곡곡 
화진포소나무숲산림욕장,피톤치드 가득한 힐링 숲길,강원도산림욕 강원도힐링여행 강원여행 고성가볼만한곳 고성소나무숲   
풀등모래섬,아름다운 대이작도의 신비한 모래섬,DMZ DMZ여행 관광지 옹진바다여행 인천가볼만한곳 인천바다여행    
진리도우선착장,멋진 자연 경관이 있는 곳,관광지 덕적도 덕적바다역 옹진여행 인천가볼만한곳 인천섬여행 인천여행 
자월도선착장,자월도의 가장 큰 출입 항구로 철부선과 쾌속선이 드나드는 곳,관광지 달바위선착장 섬캉스 옹진바다여행 인천가볼만한곳 인천여행  
충신시장,50여 년 역사의 골목시장,대학로부근전통시장 쇼핑 월간_사진_제보_이벤트 재래시장 전통시장   
어류정항,새우젓이 유명한 소규모 어촌 항구,DMZ DMZ여행 강화도항구 강화석모도항구 강화차박캠핑 강화캠핑   
영흥수협회센터,해산물을 편하게 살 수 있는 곳,쇼핑 수산시장 영흥도횟집 영흥수협수산물직판장 옹진가볼만한곳 옹진여행  
치악산둘레길 2코스,계곡을 따라 떠나는 숲속 여행,걷기여행 레포츠 원주관광 월간_사진_제보_이벤트 치악산 치악산둘레길 
아리랑박물관,국내 유일의 아리랑 전문 박물관,문화시설 박물관 아리랑 아리랑센터 정선관광 정선여행
영암어촌계 체험장,오감만족 즐기는 여행,갯벌체험 관광지 섬여행 영흥도 옹진바다여행 인천가볼만한곳 인천가족여행 
대이작도선착장,아름다운 바다와 섬의 풍경을 감상할 수 있는 곳,관광지 대이작도 대이작도선착장 섬마을선생 옹진바다여행 인천가볼만한곳  
오류,,
계남해변,물결이 잔잔한 계남해변,DMZ DMZ여행 계남마을 계남해변 관광지 섬마을선생 옹진바다여행  
삼신할미약수터,역사와 문화의 만남,DMZ DMZ여행 관광지 대이작도 바다여행 삼신할미약수터 섬캉스   
서포리웰빙삼림욕산책로,100년 넘은 소나무 숲속 나무 데크,덕적도 레포츠 삼림욕 서포리웰빙삼림욕산책로 옹진바다여행 인천가볼만한곳  
섬마을선생촬영지,자연을 만끽하며 여행할 수 있는 드라마촬영지,DMZ DMZ여행 계남분교 관광지 대이작도 섬마을선생 섬마을선생촬영지   
괴산 트리하우스 가든,유럽 감성이 가득한 치유정원,가볼래터 가족과함께 공원 관광지 괴산가볼만한곳 괴산카페 여행구독    
대관령 소나무숲길,산·하늘·바다를 향해 삶의 여유를 찾아 떠나는 곳,금강송정 레포츠 생강나무군락지 소나무숲길 솔고개입구 야생화단지  
탄금호 일렉트릭,국내 최초의 친환경 전기 유람선,가볼래터 관광지 아이와함께 여행구독 유람선 이색체험 탄금호 탄금호일렉트릭유람선
하이원리조트 알파인코스터,오르락 내리락 아찔한 산악 코스터,겨울레포츠 관광지 레포츠 스피드즐기기 아이와가기좋은 알파인코스터   
딴산,인공폭포의 시원한 물줄기를 볼 수 있는 노지 캠핑 명소,가족여행 관광지 낚시 물놀이 인공폭포 캠핑하기좋은 화천명소
서오지리 연꽃단지,희귀동식물 천국,강원도관광 관광지 생태공원 연꽃공원 연꽃단지 화천관광
송대소주상절리 (한탄강 유네스코 세계지질공원),한탄강과 주상절리의 신비로운 풍경,관광지 주상절리 철원가볼만한곳 철원관광지 한탄강 한탄강명소
파라다이스시티 원더박스,다채로운 놀이와 체험의 장,가볼래터 관광지 놀이공원 아이와함께 어린이 어린이익스트림 여행구독    
예천 삼강문화단지,새로운 가족형 문화체험 관광지구,경북권 관광지 문화 삼강 삼강문화단지 예천
감귤박물관,감귤의 세계를 보고 느끼다,가볼래터 문화시설 여행구독
산방산유채꽃밭,싱그러운 유채꽃과 제주의 신비로운 화산이 어우러진 인생샷 명소,관광지
신세계수상레져,서울에서 가까운 수상스키장,남양주 남양주물놀이 남양주수상스키 남양주여행 남양주웨이크보드 남양주웨이크서핑   
용주사(양산),천정산 기슭에 위치한 용주사,관광지 암자기행 양산가볼만한곳 양산가볼만한절 양산시사찰 양산용주사   
통도사자장암,삼국시대 신라의 자장율사가 창건한 암자,관광지 대한불교조계종 양산가볼만한곳 양산관광명소 양산여행 통도사자장암
계양산장미원,여유 있게 산책하면서 마음껏 꽃밭을 감상할 수 있는 장미 공원,계양산장미꽃밭 계양산장미원 관광지 인천가볼만한곳 장미 장미꽃명소  
신거북시장,인천 서구 가좌동에 있는 전통시장,거북시장 쇼핑 신거북시장 인천전통시장 재래시장 전통시장
극락암(양산),한강 이남의 제일가는 호국 선원,관광지 극락암 극락영지 암자기행 양산가볼만한곳 양산관광명소 양산여행   
명동공원 / 명동근린공원,사계절마다 다른 매력을 느낄 수 있는 공원,관광지 명동공원 명동근린공원 양산가볼만한곳 양산공원족구장 양산명동공원   
수질정화공원,"화려하지는 않지만, 시민들이 편하게 쉬어갈 수 있는 공원",관광지 수질정화공원 양산가볼만한곳 양산가족공원 양산관광명소 양산수질정화공원  
뚝섬 윈드서핑장,도심 속에서 즐기는 수상스포츠,SUP 뚝섬서핑장 뚝섬윈드서핑장 레포츠 바나나보트 서울윈드서핑     
양산워터파크,심신을 치유하는 공간,가족공원 관광지 분수공원 양산가볼만한곳 양산관광명소 양산명승지    
서울시립 난지미술창작스튜디오,유휴시설을 개조하여 만든 젊은 예술가들의 공간,난지공공스튜디오 난지미술창작스튜디오 난지스튜디오 난지한강공원 난지한강공원미술관        
신석체육공원,인천 시민의 여가생활을 위한 공간,관광지 석남동벚꽃명소 석남동벚꽃산책 석남동인조잔디축구장 신석체육공원 
한탄강 물윗길,한탄강의 주상절리를 물 위에서 감상할 수 있는 트래킹 코스,2022 2022한국관광의별 2023_설날_핫플 2024_여행가는달과함께하는_발도장여행지             
모담공원,숲길 따라 산책하기 좋은 가족공원,경기도 공원 관광지 김포 김포가볼만한곳 김포공원 주말나들이
스페이스워크,관객이 하나의 풍경이 되는 국내 최대 규모 체험형 조형물,2023 2023한국관광의별 2024_여행가는달과함께하는_발도장여행지 23_24한국관광100선                   
황산문화체육공원,양산시 물금읍 낙동강변에 대규모로 조성된 공원,관광지 미니기차 양산가볼만한곳 양산관광명소 양산시캠핑장 양산여행  
수암사(의령),자연환경 속에 둘러싸인 아름다운 사찰,관광지 사찰 수암사 의령가볼만한곳 의령여행 자연경관 힐링할수있는곳
의령곤충생태학습관,곤충과 함께 미래의 꿈을 키우고 동심의 세계로 돌아가 뛰어놀 수 있는 곳,경남가볼만한곳 곤충박물관 문화시설 아이와가볼만한곳 의령곤충생태학습관 
호국의병의숲친수공원,다양한 식물과 꽃이 가득한 인생샷 명소,관광지 댑싸리 수변생태공원 의령가볼만한곳 의령관광명소 의령명소  
한국영상자료원,영상자료로 과거와 미래를 잇는 공간,문화시설 서울문화시설 영상자료 영화박물관 영화자료 영화포스터 영화필름보관소   
KBS온,국내 최초의 방송 전시관,KBS견학홀전시장 문화시설 방송국견학 방송국체험학습 아이와함께가볼만한곳  
대림어린이공원,도심 속 아이들이 뛰어놀기 좋은 공원,관광지 대림동놀이터 대림어린이공원 어린이공원 주차장있는공원
JCC아트센터,음악 공연 및 다양한 전시를 경험할 수 있는 곳,JCC 문화시설 서울아름다운건축물 아이와함께가볼만한곳 안도다다오건축물        
PKM갤러리,한국 최초로 프리즈 아트 페어에 초청된 갤러리,BTS bts여행 bts투어 PKM갤러리 RM 문화시설 삼청동갤러리 종로화랑 
그라운드서울,갤러리와 기획전시공간을 결합한 신개념 복합문화공간,공연대관장소 문화시설 복합문화공간 북촌전시 아라아트센터 인사동가볼만한곳      
안국선원(서울),현대적 시설을 갖추고 있는 도심 속 사찰,관광지 도심속사찰 서울시사찰 서울안국선원 안국선문화원 안국선원 
전태일기념관,노동운동가 전태일을 기념하다,기념관 노동역사 노동인권 문화시설 박물관 전태일 청년노동운동가
한국미술관,한국 미술의 다양한 전시를 위한 문화공간,대형전시관 문화시설 서예교육 인사동전시관 한국미술관 한국미술전시관
섬진강자전거길인증센터,자전거 ‘국토종주인증제’ 스탬프 획득을 위한 곳,국토종주스탬프 국토종주인증제 레포츠 섬진강자전거길 섬진강자전거길인증센터   
괴곡동 느티나무,대전 괴곡동에 있는 마을의 오랜 수호목,갑천누리길 관광지 괴곡동느티나무 대전여행 대전자전거길 대전천연기념물
기동 삼거리 벽화,동백나무 파마머리 벽화로 유명한 거리,관광지 기동삼거리 기동삼거리벽화 동백파마머리 신안벽화 암태도벽화
함평양서파충류생태공원,양서·파충류를 주제로 살아 숨 쉬는 생태체험관,문화시설 양서파충류생태공원 자연생태공원 전시관관람 함평가볼만한곳   
유구벽화거리,눈길을 사로잡는 벽화가 가득한 곳,공주가볼만한곳 공주벽화거리 공주여행 관광지 산책하기좋은곳 유구벽화거리 
경천저수지,"제방 아래 아름다운 물결, 경천저수지",경천저수지 경천저수지낚시 경천저수지배스 관광지 완주경천저수지 완주여행   
옥천전통문화체험관,옥천의 전통문화를 몸소 체험할 수 있는 곳,가족과함께 숙박 아이와함께 옥천군 옥천디지털관광주민증 이색체험       
에프마켓남부낚시,낚시인들의 성지,고수낚시 낚시용품 낚시용품전문점 서울남부낚시 쇼핑 에프마켓 에프마켓남부낚시  
도곡시장,도심 속 도로를 따라 형성된 시장,강남3대전통시장 도곡시장 쇼핑 역삼동시장 월간_사진_제보_이벤트   
오류,,
청해수산,대규모의 수산물 전국 유통점,쇼핑 수산물도매 인천수산물도매시장 인천활어회 청해수산 해산물도매  
마송중앙공원,자연과 여유가 가득한 김포 근린공원,경기도 공원 관광지 김포 김포가볼만한곳 김포공원 김포에서가볼만한곳
추곡낚시터,1급수의 계곡물을 이용하는 청정지역 낚시터,경기도광주낚시터 너른광주낚시터 도척낚시터 도척면낚시터 레포츠 추곡낚시터
고분다리전통시장,사람 냄새 물씬 나는 정겨운 시장,강동시장 고분다리전통시장 벽화시장 쇼핑 시장벽화 월간_사진_제보_이벤트    
대진항 (삼척),조용하게 힐링을 할 수 있는 항구,관광지 동해관광 동해낚시 동해여행 삼척관광 삼척바다
임경대,한 폭의 그림 같은 풍광이 펼쳐지는 양산의 명소,경남권 경상남도_여행지_추천 관광지 양산가볼만한곳 양산팔경 엽기적인그녀 
실미유원지,대무의도 실미도 해수욕장에 있는 유원지,가볼래터 레포츠 실미도 실미유원지 여행구독 영화실미도 유원지   
청초호 호수공원,심신을 치유하는 공간,관광지 속초관광 속초여행 청초호 호수공원 호수관광
오류,,
유진참치,싱싱한 해산물을 저렴하게 구매할 수 있는 수산물 마트,계양구수산물마트 계양구수산물전문점 쇼핑 유진참치 인천수산물마트 
아가페정원,사계절 아름다운 자연과 싱그러운 풍경이 인상적인 정원,2024_여행가는달과함께하는_발도장여행지 가볼래터 감성사진 경치좋은곳           
천덕제(동항저수지),안성시에 위치한 아담한 소류지,경기저수지 관광지 안성동항저수지 안성저수지 안성천덕제 양성면저수지
김대기가옥,시골 고향집처럼 초가집이 정겨운 김대기 가옥,관광지 숙박 역사 역사공부 역사문화 역사속 역사여행 역사탐방    
투데이패션몰,산본의 중심 상가,경기 군포 군포시 상가 쇼핑 투데이 투데이패션몰
선물가게 바나나,제주의 다양한 기념품을 판매하는 소품샵,쇼핑
와글아이,온 가족이 즐겁고 재미있는 경험을 할 수 있는 공간,관광지 와글아이 와글아이일산 와글아이차병원 일산와글아이 일산키즈카페
예술공간 이아,다채로운 전시가 있는 공간,당일치기여행 데이트코스 문화시설 복합문화공간 실내데이트 전시
스노우맨 아트샵,아기자기한 남이섬 눈사람 친구들과 함께,기념품샵 남이섬 소품샵 쇼핑 춘천데이트 춘천여행
토지금고시장,집 앞 배달 서비스를 제공하고 있는 편리한 시장,미추홀구재래시장 미추홀구전통시장 쇼핑 용현동전통시장 재래시장 전통시장 
가좌시장,사람과 사람사이 오고가는 정이 가득한 재래시장,가좌동시장 가좌시장 백종원골목식당 만스김밥 쇼핑 인천재래시장 인천전통시장  
감중공원,편안한 분위기 속 시민들의 휴식 공간,가좌동근린공원 가좌동어린이놀이터 감중공원 관광지 인천자동차단지공원
경인아라뱃길 아라타워 전망대,서해의 일몰을 감상할 수 있는 명소,경인아라뱃길전망대 관광지 서해일몰명소 아라뱃길전망대 아라타워전망대   
인천환경공단 청라생태공원,자연을 느끼며 편안한 휴식을 취할 수 있는 공원,관광지 생태공원 생태체험학습 생태체험학습지 천연잔디축구장 청라지구생태공원  
송도골프클럽,수도권의 편리한 교통이 장점인 골프장,레포츠 송도GC 송도골프장 송도골프클럽 인천9홀골프장 친환경골프장
송도 도그파크,도심 속 반려동물과 함께 다양한 체험을 즐길 수 있는 반려동물 놀이터,관광지 반려견놀이터 반려동물동반여행지 송도도그파크 송도반려견공원  
한국가스공사 가스과학관,천연가스와 에너지 체험학습 과학관,가스과학관 과학교육 문화시설 아이와함께가볼만한곳 어린이교육체험관     
북성포구,인천 바다와 일몰이 아름다운 북성포구,관광지 다만악에서구하소서촬영지 북성포구 서해낙조 서해야경 서해야경조망지 
월미산유리전망대,월미산 108m 정상에 위치한 전망시설,관광지 월미달빛마루 월미사 월미산유리전망대 유리전망대 전망
석정힐 CC,관리가 잘 된 골프장,가족형골프장 고창석정힐cc 레포츠 석정힐1박2일 석정힐골프패키지   
공룡테마공원 (다이노 키즈월드),다양한 체험시설이 있는 테마파크,가족테마공원 공룡테마공원 관광지 아이랑가볼만한곳 익산가볼만한곳   
오류,,
노을해안로,멋진 노을을 바라보며 힐링하다,관광지 노을해안로 돌고래 제주가볼만한곳 제주노을 제주여행 제주해안도로 
해맞이해안로,바다에서 일출을 마주하는 길,관광지 성산일출봉 올레코스 제주도드라이브하기좋은곳 제주도바다뷰     
인천로봇랜드,다양한 로봇을 체험할 수 있는 곳,관광지 로봇 로봇체험 인천로봇랜드 인천로봇랜드 체험시설 체험
인천어린이천문대,어린이들을 별과 우주의 세계로 초대하는 곳,관광지 관측 어린이천문대 어린이체험교실 우주 우주의신비 은하수  
베어즈베스트청라GC,전 세계 최고의 코스만 모은 꿈의 필드,골프 골프장 레포츠 베어즈베스트청라GC 청라GC 필드
아라빛섬,인공으로 만들어진 작은 섬,관광지 산책 아라빛섬 인공섬 일몰 정서진
아라김포여객터미널,우수한 접근성을 가지고 있는 여객 터미널,관광지 김포관광지 김포명소 김포시 아라김포여객터미널 아라마리나   
코코넛박스,"서울의 핫플, 홍대에 위치한 대형 베이커리 카페",가볼래터 관광지 서울 여행구독 이색체험 이색카페 전시관
돌고래수상리조트,북한강 자락의 시원한 전경을 만끽하며 수상 레저 즐기기,레포츠 리버뷰 복합수상레저 북한강 브런치 전객실 카페
360도 컨트리클럽,창조적이며 아름다운 골프 코스,360도CC 레포츠 산악지형골프플럽 여주골프클럽 여주라운딩 힐링
소사종합시장,쇼핑하기 편리한 전통시장,대보시장 부천 부천시장 부천아이와가볼만한곳 부천재래시장 소사종합시장 
신흥시장,부천의 상설 재래시장,골목형시장 부천시장 부천신흥시장 부천여행 부천재래시장 쇼핑 신흥시장
조강저수지,편안하고 아늑한 분위기를 자아내는 곳,관광지 김포 김포가볼만한곳 김포관광지 조강랜드 조강저수지 조강포
무릉도원수목원,아름다운 이상 세계 속 수목원,관광지 무릉도원수목원 부천가볼만한 곳 부천나들이 부천식물원 부천자연생태공원 
거북섬,거북이 모양의 해양레저 복합단지 인공섬,관광지 서울근교 서핑 시흥MTV 여름휴가 여행 워터파크 웨이브파크
세천유원지,"산책하기 좋은 대전의 자연 명소, 세천유원지",관광지 대전데이트코스 대전산책 대전여행 대전투어 대전힐링여행
두창저수지,사계절 도시 어부들의 사랑을 받는 낚시터,관광지 두창낚시터 두창호수 드라이브코스 산책하기좋은 차박하기좋은곳 
목동종합운동장,시민들의 휴식공간,레포츠 목동경기장 목동빙상장 목동실내사격장 목동야구장 목동운동장  
불교총지종,대승불교의 정신을 일상에서 실천하는 생활불교 총지종,관광지 도심속사찰 불교총지종 사찰 생활불교 서원당 템플
클럽케이서울,경험하는 모든 것들에 가치를 더하다,강남스크린골프 강남피트니스센터 강남황토방 문화시설 선릉사우나 선릉찜질방  
짱구네유채꽃밭,유채꽃을 즐길 수 있는 포토 스폿,관광지 유채꽃 유채꽃관광지 유채꽃단지 유채꽃명소 유채꽃밭 제주도  
한양파인CC,북한산 모습을 다양하게 조망할 수 있는 도심 속 골프장,고양시실외골프연습장 고양시퍼블릭골프장 레포츠 서울근교골프장 인도어골프장  
보원장탄온천,모세혈관이 확장되기 때문에 혈액순환에 좋은 탄산천,관광지 구리시대중목욕탕 보원장탄산천 보원탄산온천 천연알칼리온천 
은산어울림생태박물관,파충류를 알게 되는 생태박물관,문화시설 생태막물관 아이들생태교육 양서류박물관 양서파충류박물관 
조암시장,전통 5일장의 푸근한 인심이 가득한 곳,5일장 남양들녘 매향리평화공원 삼괴장터 쇼핑 조암시장 화성재래시장
큰재봉공원,넓게 트인 산책로와 편의 시설을 잘 갖춘 공원,관광지 반려견산책 아이와가볼만한곳 운동하기좋은 큰재봉공원
윤동주문학관,윤동주의 발자취와 세상을 향한 그의 시선,대한민국 공공건축상 문학기념관 문학전시관 문화시설 민족시인 별헤는밤     
오류,,
궁항리조트,객실에서 보는 바다뷰가 멋진 곳,1박2일부안여행 관광지 궁항리조트 궁항숙박 궁항풀빌라 변산숙소     
역삼동성당,"새로운 시대, 새로운 복음화",강남가톨릭문화원 관광지 성당결혼식 성당예식 역삼동성당
상상낚시터,초보자도 부담 없이 즐길 수 있는 낚시터!,거제가볼만한곳 거제낚시여행 거제낚시터 거제여행 레포츠 상상낚시터   
천안시 농수산물 도매시장(천안 농수산물 도매시장),판매자와 소비자 모두가 행복해지는 공영도매시장,쇼핑 천안먹거리 천안볼거리 천안산책 천안시장 천안여행
