place,info,태그
나리분지,화산활동으로 형성된 울릉도의 유일한 평지,경상권 관광지 둘레길 문화재 울릉도 울릉도여행 자연 자연속으로     
스카이로드,대전 쇼핑과 문화의 중심지,2024_여행가는달과함께하는_발도장여행지 관광지 남녀노소 문화공간           
도림사(광주),광주 지역 한말 유학자의 활동과 그들을 기리는 사당,관광지 광주도림사 광주사당 역사 역사공부 역사관광지 역사를품은곳         
비룡폭포,승천하는 용의 형상을 닮은 폭포,강원권 경치좋은곳 관광지 비룡폭포 사진찍기좋은곳 자연 자연속으로     
관룡사,관룡산에 있는 신라시대 8대 사찰,가족여행 경남관룡사 경상권 관광지 관룡사 불교 불교사찰 사찰           
스포원파크재난안전체험관,재난에 대비할 수 있는 안전 체험관,겨울방학가볼만한곳 경상권 관광지 생활안전체험 아이와함께 여름방학가볼만한곳      
미천서원,안창마을 서원으로 떠나는 역사 여행,관광지 역사 역사공부 역사관광지 역사를품은곳 역사문화재 역사속          
쌍암공원,"호수와 여유, 그리고 쉼이 있는 공간",가족과함께 걷기길 관광지 데이트코스 반려견동반 산책길 산책하기        
갈천서당,조선시대 지방 사립 교육기관,갈천서당 거창갈천서당 경남갈천서당 경상권 경상남도유형문화재 관광지             
오봉산,섬진강 옥정호와 울창한 숲이 장관인 산,경치여행 경치좋은곳 관광지 등산 옥정호 완주여행 임실여행 자연     
동화어촌체험마을,바다 내음 가득한 갯벌에서 즐기는 이색 체험,관광지 아이와함께 어촌마을 어촌체험마을 이색체험 자연마을 자연좋은곳        
소노벨 천안 오션어드벤처,아이와 같은 꿈을 꾸게 하는 소노벨 천안 오션파크,가족과함께 관광지 물놀이장 실내데이트 실내수영장 연인과함께 오션월드  
다희연,녹차가 주는 자연의 즐거움,관광지 녹차족욕 다희연 동굴카페 미세먼지탈출_이색동굴여행 산업관광             
청하향교,훌륭한 유학자를 기리는 조선시대 교육기관,가족여행 경상권 경상북도문화재 관광지 교과서속여행 문화재 아이와함께                
경주 남산동 동ㆍ서 삼층석탑,통일신라 시대의 모전석탑,경상권 경주남산동동탑 경주남산동서탑 관광지 보물 역사 역사공부           
천안 천흥사지 당간지주·오층석탑,천안 역사문화 탐방,관광지 불교 불교사찰 사찰 사찰여행 석탑 역사 역사공부 역사관광지         
갈계숲,맑은 시냇물과 울창한 수목이 아름다운 풍치를 이루는 숲,갈계숲 거제갈계숲 거제거창갈계숲 거창갈계숲 거창군천연보호림 경상권         
오류,,
미륵암석불,온화한 모습의 고려시대 석불,관광지 남원여행 문화재 미륵암 불상 역사 역사공부 역사를품은곳         
용암정(거창),월성계곡 위천변에 있는 아름다운 정자,거창용암정 거창월성계곡 경남용암정 경상권 관광지 명승 역사 역사공부           
화담사,향기롭고 온화한 꽃마을에 위치한 하동 정씨 5인의 사당,관광지 광주사당 광주화담사 배롱나무명소 사당 역사 역사공부 역사관광지            
남해 항도어촌체험마을,바다와 섬이 조화를 이루어 경치가 아름다운 마을,가족과함께 가족체험 관광지 아이와함께 어촌마을 어촌체험 어촌체험마을        
겸천서원,옥천조씨의 충절을 기리는 서원,관광지 역사 역사공부 역사관광지 역사를품은곳 역사문화재 역사속        
오류,,
영빈서원,거창 출신 동래정씨 선현 6위를 모신 사당,거창영빈서원 경남영빈서원 경상권 경상남도문화재자료 관광지 역사         
양천구어린이교통안전교육장,아이들과 교통사고 예방법을 배워보자!,겨울방학가볼만한곳 관광지 교육여행 교통이론교육 교통체험교육 도심여행            
부여 신암친환경마을,포근한 골짜기에 자리한 친환경 마을,관광지 농촌마을 농촌여행 농촌체험 마을 부여마을 부여신암친환경마을           
부산광안대교,어두운 밤하늘과 밤바다를 밝히는 아름다운 야경,경상권 경치좋은곳 관광지 광안대교 데이트장소 데이트코스 부산가볼만한곳          
제주맥주,맥주 미식 문화를 창조하는 공간,2022_추석_전통주와_브루어리 관광지 남녀노소 산업관광 산업관광지         
추령천,역사 문화가 잘 보존된 섬진강 지류 하천,관광지 산책 선비의길 순창선비의길 순창여행 자연 트래킹 풍경여행
절영해안산책로,볼거리가 많은 경치 좋은 해안산책로,2024_여행가는달과함께하는_발도장여행지 걷기길 경상권 경치좋은곳                  
경주 서악동 고분군,신라 왕릉으로 추정되는 대형 고분군,경상권 경주유적지 관광지 역사 역사관광지 역사를품은곳 역사문화재 
운천사마애여래좌상,고려시대 마애불 양식을 보여주는 거대 불상,고려시대마애불 관광지 광주불상 광주운천사마애여래좌상 마애불 마애여래좌상               
화양동관광농원,빼어난 자연경관을 간직한 관광농원,가족과함께 관광농원 관광지 괴산관광농원 괴산팜스테이 괴산화양동관광농원            
삼불암,자연석에 3위의 석불을 봉안한 사찰,관광지 김제여행 불교 불교문화 사찰 사찰여행 역사 역사공부 역사를품은곳      
장흥 옥당리 효자송,오랜 역사를 가진 소나무,관광지 자연관광지 자연발생 자연속으로 자연여행 자연좋은곳 자연풍경  
북장사(상주),속리산 자락에 불교 유물이 가득한 고사찰,경상권 관광지 북장사 불교 불교문화 사찰 사찰여행 역사 역사유적지        
연풍성지,조선 후기 천주교 순교 성지,관광지 성지순례 역사 역사공부 역사관광지 역사관광지 역사를품은곳           
장암정,조선 후기 호남 지방의 생활사를 보여주는 정자,관광지 반려동물 반려동물동반여행지 역사 역사공부 역사관광지 역사를품은곳          
금강사(강진),충무공 이순신과 현무공 김억추를 기리는 사당,관광지 역사 역사공부 역사관광지 역사를품은곳 역사문화재 역사속      
거창 갈계리 임씨고가,효자로 소문난 조선시대 임훈선생의 집,갈계리임씨고가 거창임씨고가 경남갈계리임씨고가 경남임씨고가 경상권                
의안대군방석묘역,조선의 첫 세자로 비운의 삶을 살다 간 의안대군의 묘,관광지 광주의안대군방석묘역 역사 역사관광지 역사를품은곳 역사문화재        
"문태서, 박춘실 의병대장 전적비",호남의병의 주역들을 기리는 비석,관광지 역사 역사공부 역사관광지 역사를품은곳 역사문화재 역사속       
청련암(단양),단양팔경인 사인암 바로 옆에 자리한 사찰,관광지 불교 불교문화 사찰 사찰여행 역사 자연속으로 자연환경       
원주 거돈사지,조선 전기까지 유지된 사찰 거돈사의 옛 터,강원권 거돈사지 관광지 사적 역사 역사관광지 역사이야기 역사탐험
부산각서석,나라를 위하는 마음이 담긴 강건한 바위 글씨,관광지 문화유산 역사 역사공부 역사관광지 역사를품은곳 역사속      
아라가야 고분군,가야 국왕들의 묘,관광지 역사 역사공부 역사관광지 역사를품은곳 역사문화재 역사속       
고부향교,"조선전기에 창건된 교육시설, 고부향교",고부향교 관광지 문화재 역사 역사공부 역사관광지 역사를품은곳        
월명사(제천),제천 송학산에 자리한 단아하고 조용한 사찰,관광지 불교 불교문화 사찰 사찰여행 송학산 역사 월명사 자연속으로           
광진교 8번가,눈과 귀와 오감이 즐거운 다리 위의 전망쉼터,가볼래터 관광지 광진교 광진교8번가 데이트코스 문화체험 사계절               
홍산객사,조선시대 중앙관리를 접대하고 유숙한던 곳,객사 관광지 문화유산 부여 부여객사 역사 역사공부 역사관광지        
흥덕향교,조선시대 고창 흥덕면의 국립 교육기관,고창여행 관광지 문화재 역사 역사관광지 역사를품은곳 역사문화재          
만대어촌체험마을,갯벌마다 가득한 바지락을 직접 캐볼 수 있는 체험마을,가족과함께 관광지 남녀노소 어촌마을 연인과함께 이색체험 체험     
충곡서원,백제의 인물들을 추모하기 위해 세운 서원,가족과함께 관광지 논산가볼만한곳 역사 역사공부 역사관광지 역사유적지  
도계서원,정읍 도계리에 있는 이희맹을 배향하는 서원,관광지 문화재자료 서원 역사 역사공부 역사관광 역사관광지 역사를품은곳           
백마산,음성의 소금강이라고 부르는 산,관광지 등산 산 음성여행 자연 자연관광지 자연환경 트레킹
김해향교,선인들의 지혜가 담긴 공립교육기관,경상권 경상남도유형문화재 관광지 김해향교 대성동향교 역사 역사공부            
경장각,행주대첩에 앞장섰던 의병장 이신의 선생을 배향하는 재각,관광지 광산경장각 광주경장각 광주재실 석탄이신의 역사 역사공부             
목포시사,문사들이 자연과 시를 노래했던 풍류의 장소,고택 관광지 목포문인들 목포문화재 목포시사 목포여행 역사 역사공부               
금강정사,신행 공동체를 만들기 위해 개원한 사찰,관광지 불교 불교문화 사찰 사찰여행 역사 월간_사진_제보_이벤트         
최승효가옥,"독립운동가의 은신처, 다락방을 품고있는 일제강점기 한옥",관광지 광주최승효가옥 양림동역사문화마을 역사 역사공부 역사관광               
달천,부드럽고 깨끗한 물줄기를 가진 남한강의 발원지,감천 강 관광지 괴산달천 괴산여행 달래강 달천 자연 충청권 하천
증도(신안),느리게 시간이 흘러가는 휴식의 섬,2021_휴가철찾아가고싶은_33섬 가족과함께 경치여행 관광지 바다경치             
초도(여수),맑고 푸른 바다와 아름다운 자연이 일품인 섬,경치여행 경치좋은곳 관광지 바다경치 바다내음 여수여행 일출일몰명소   
박약재,진주강씨 문중에서 지은 자녀 교육용 강당,관광지 역사 역사공부 역사관광지 역사를품은곳 역사문화재 역사속       
도산서당,조선 후기 고창 지역의 교육 기관,고창군향토문화유산 고창여행 관광지 문화재 역사 역사공부 역사관광지          
도리미오름,능선을 거닐면서 한없는 안식을 얻을 수 있는 오름,관광지 돌리미오름 오름 자연 제주도리미오름 제주오름 큰돌이미오름
완도 미라리 상록수림,미라마을의 경계지이자 방풍림,관광지 미라리해수욕장 미라마을 산책하기좋은곳 완도방풍림 완도상록수림          
이양서원,청백리인 곽안방의 정신을 기리기 위해 세운 문중 서원,관광지 달성이양서원 대구이양서원 역사 역사공부 역사관광지 역사를품은곳        
봉강사,독특한 겹처마 구조의 사당,관광지 나들이 역사 역사공부 역사관광지 역사를품은곳 역사문화재         
소래습지생태공원,동식물과 함께하는 도심의 휴식 공간,2024_여행가는달과함께하는_발도장여행지 가족과함께 관광지 바다풍경           
백산 안희제 생가,독립운동가 안희제가 태어난 집,관광지 역사 역사공부 역사관광지 역사를품은곳 역사문화 역사문화재        
중앙고등학교,교육으로 나라를 세우고자 설립한 우리나라 최초의 민립학교,고려중앙학원 관광지 기호학교 문화재 사적지 서울중앙고등학교 수도권            
용문사(남해),역사와 자연이 어우러진 오래된 사찰,관광지 남해관광 남해사찰 남해용문사 불교 불교사찰 사찰 사찰여행            
북산서원,절강장씨 집성촌에 자리한 사당과 서원,경상권 관광지 군위조선시대서웡 북산서원 역사 역사관광지 역사를품은곳           
시가문화유적지,가사 문학의 산실을 따라,경치좋은곳 관광지 시가문화유적지 역사 역사유적지 자연좋은곳 전라권  
효충서원,"김복규, 김기종 부자의 정려비가 있는 서원",관광지 문화재 서원 역사 역사공부 역사관광지 역사를품은곳 역사문화재          
서빙고동 부군당,주민들이 마을의 수호와 주민의 안녕을 위해 세운 제당,관광지 서빙고부군당 서빙고신당 서빙고제당 역사 역사공부 역사관광지          
발명교육센터 창의발명체험관,다양한 발명교육의 기회를 제공하고 있는 체험관,2024_여행가는달과함께하는_발도장여행지 가족과함께 관광지 교육 교육여행          
지산재,경주 최씨의 시조 고운 최치원을 배향한 사우,관광지 광주광역시유형문화재 광주지산재 광주최치원사우 역사 역사공부           
완귀정,학문 연구과 후학 양성을 위한 곳,경상권 경상북도민속문화재 관광지 역사 역사공부 역사관광지 역사를품은곳        
소세양신도비,소세양의 생애와 업적을 기리는 비석,관광지 역사 역사공부 역사관광지 역사를품은곳 역사문화재 역사속     
광산김씨 유일재고택,광산 김씨 유일재공파의 종택,관광지 역사 역사공부 역사관광지 역사를품은곳 역사문화재 역사속       
금남로,"항쟁의 거리, 민중의 거리, 민주의 거리",관공서 관광지 관청가 광주관광 광주광역시 광주민주항쟁 광주시            
충주 제금당,조선시대 귀빈을 맞이하던 곳,관광지 역사 역사공부 역사관광지 역사를품은곳 역사문화관광 역사문화재          
오류,,
경상좌수영성지,옛날 경상도 수군의 본영지,경상권 관광지 교과서속여행 부산가볼만한곳 역사 역사공부 역사관광지    
양평 쌍겨리마을,정경이 아름다운 마을,관광지 농촌마을 농촌여행 농촌체험 자연마을 자연환경 체험 휴식공간   
섬진강 도깨비마을,끝없는 상상이 펼쳐지는 도깨비마을,관광지 문화마을 산업관광 섬진강도깨비마을 아이와함께 예술 자연마을       
함안 채미정,"어계 조려가 귀향 후 여생을 보낸 정자, 채미정",경상권 경치좋은곳 관광지 역사 역사공부 역사관광지 역사를품은곳           
한삼인 증평공장,국내산 원료로 고려인삼의 명맥을 잇는 곳,견학 관광지 산업관광 산업관광지 전통산업 체험학습 충청권 한삼인   
문수암(옥천),아름다운 모습을 감상할 수 있는 문수암,관광지 불교 불교문화 사찰 사찰여행 역사 옥천문수암 자연속으로        
이배원 가옥,함라면의 대표적인 부농이었던 이배원의 집,관광지 역사 역사공부 역사관광지 역사를품은곳 역사문화재 역사속      
제천 청풍 금남루,조선 순조 때 세운 관청의 정문,관광지 역사 역사공부 역사관광지 역사를품은곳 역사문화재 역사속       
대광해수욕장,해변승마로 유명한 우리나라에서 가장 길고 넓은 해수욕장,가족여행 관광지 바다풍경 블루플래그인증 신안섬여행 신안여행 신안청정해변             
황윤석 생가,조선후기 실학자 황윤석의 생가,고창여행 관광지 문화재 역사 역사공부 역사관광지 역사를품은곳           
도암서원,조선후기 이경광 등 3인의 선현을 추모하는 서원,관광지 서원 역사 역사공부 역사관광지 역사를품은곳 역사문화재           
이랜드크루즈(한강유람선),한강에서 떠나는 낭만여행,2024_여행가는달과함께하는_발도장여행지 관광지 도심여행 수도권 야간관광100선             
익산 왕궁리유적 [유네스코 세계유산],고대 동아시아 왕궁 구조의 모범을 보여주는 왕궁리유적,2024_여행가는달과함께하는_발도장여행지 23_24한국관광100선 겨울방학가볼만한곳                 
의성향교,전통문화체험을 통해 조상들의 지혜를 배울 수 있는 곳,가족여행 경상권 관광지 교과서속여행 문화재 아이와함께 역사 역사공부           
김제남 신도비,인조반정 후 명예를 회복한 김제남을 기리는 비석,강원권 관광지 교과서속여행 김제남신도비 역사여행 유적지
나바위 성당,우리나라 최초의 신부가 처음으로 전도하던 곳,2023_설날_소원 관광지 근대문화유산 나바위성당 역사 역사공부 역사관광지             
충주 민속공예거리,다양한 민속공예품을 관람하고 구매 할 수 있는 곳,고미술품 공예품 관광지 문화예술활동 미술작품 석공예 수공예 예술작품       
무암사,신비한 전설과 볼거리가 가득한 금수산의 사찰,관광지 불교 불교문화 불교사찰 사찰 사찰여행 역사 자연속으로       
석천암(괴산),대한민국에서 가장 작은 대웅전을 가지고 있는 사찰,관광지 괴산석천암 대웅전 불교 불교문화 사찰 사찰여행 석천암           
취묵당,백곡 김득신이 만년에 세운 독서를 즐기던 정자,관광지 괴산여행 괴산취묵당 문화재자료 역사 역사공부 역사관광지               
석성향교,석성면에 있는 조선시대 국립 지방 교육 기관,관광지 석성면 역사 역사공부 역사관광지 역사를품은곳 역사문화재          
철원향교,옛 교육 기관으로 역사적 가치가 높은 향교,가족여행 강원권 관광지 아이와함께 역사 역사공부 역사관광지 역사를품은곳           
순천향교,조선시대 지역인재 교육의 요람,관광지 역사 역사공부 역사관광지 역사를품은곳 역사문화재 역사속        
수암골 벽화마을,청주 감성여행 1번지,2024_여행가는달과함께하는_발도장여행지 가족여행 감성사진 관광지              
창평향교,담양민의 교육을 담당한 조선의 중등교육 기관,관광지 남극루 역사 역사공부 역사관광지 역사를품은곳 역사문화재          
삼장사지 삼층석탑,역사를 알 수 있는 석탑,경남삼장사지삼층석탑 경남삼층석탑 경상권 경상남도유형문화재 관광지                
남평향교,옛 나주의 인재를 교육하던 조선시대 교육기관,관광지 역사 역사공부 역사관광지 역사를품은곳 역사문화재 역사속으로     
구례향교,조선시대 구례의 유학 교육을 책임지다,관광지 구례가볼만한곳 구례여행 구례조선교육시설 구례향교 구례향교여행                  
김제향교,유교 체험 프로그램을 운영하는 향교,관광지 김제여행 문화재 역사 역사관광지 역사를품은곳 역사문화재          
금구원야외조각미술관,우리나라 최초의 조각공원,관광지 금구원야외조각미술관 남녀노소 미술관 복합문화공간 아이와함께         
근성서원,조선 개국 공신 김인찬을 추모하기 위해 창건된 서원,관광지 역사 역사공부 역사관광지 역사를품은곳 역사문화재 역사속       
대계서원,문강공 은봉 안방준을 기리는 서원,관광지 교과서속여행 문화재 서원 역사 역사공부 역사관광지 역사를품은곳        
녹동서원(영암),많은 고문서류와 목판이 보관되어 있는 서원,관광지 역사 역사공부 역사관광지 역사를품은곳 역사문화재 역사속       
남강서원(강진),강진의 자그마한 마을에서 느껴보는 우암 송시열,관광지 역사 역사공부 역사관광지 역사를품은곳 역사문화재 역사속      
새만금,대한민국의 새 길,BTS bts여행 bts투어 가족여행 간척지 걷기길 걷기좋은곳 관광지            
약수암(전주),시내 한복판에 있는 아담한 현대사찰,관광지 불교 불교문화 사찰 사찰여행 역사 자연속으로 자연환경       
수원향교,조선 시대 지방에 세운 공립 교육 기관인 수원 향교,경기도문화재자료 관광지 수도권 수원향교 역사 역사공부 역사관광지          
통진향교,고려 시대에 설립된 교육과 교화를 위한 교육기관,DMZ DMZ여행 경기도문화재자료 관광지 문화관광해설사 수도권 역사공부           
충주 이수일 묘소,조선 중기 충무공 이수일의 묘,관광지 역사 역사공부 역사관광지 역사를품은곳 역사문화재 역사속       
온양향교,전학후묘의 전형적인 형태인 향교,가족여행 관광지 아산 아산온양향교 아산의향교 아산향교 아이와함께                
송담서원(대구),박성을 기리기 위해 조선후기에 건립한 서원,관광지 달성송담서원 송담서원 역사 역사공부 역사관광지 역사를품은곳       
수암서원,옛 선비에게 배우는 인품과 학문의 가치,가족여행 관광지 역사 역사공부 역사관광지 역사를품은곳 역사문화재          
사산사,함평 이씨의 시조인 언이 배향된 곳,관광지 사산사 역사 역사공부 역사관광지 역사를품은곳 역사속 역사속으로         
박산서원,이후백을 제향 하는 서원,관광지 역사 역사공부 역사관광지 역사를품은곳 역사문화재 역사속      
안동향교,안동의 공교육을 담당하던 곳,관광지 역사 역사공부 역사관광지 역사를품은곳 역사문화재 역사속       
죽계서원(무주),왜적과 맞서 싸운 순국선열을 모신 서원,관광지 교육기관 무주여행 무주죽계서원 서원 역사 역사공부 역사관광지          
지선당,반남 박씨 문중의 재각,관광지 문화재 문화재자료 사당 역사 역사공부 역사관광지 역사를품은곳           
의령향교,지방민의 교육과 교화를 위해 지은 교육기관,경상권 경상남도유형문화재 관광지 역사 역사공부 역사관광지 역사를품은곳          
예천향교,경상북도 문화재자료 제138호,관광지 역사 역사공부 역사관광지 역사를품은곳 역사문화재 역사속       
근암서원,문경 선비의 기품이 남아있는 근암서원,관광지 문경가볼만한곳 문경명소 문경지역명소 역사 역사공부 역사관광지          
구양서원,홍건적을 토벌한 고려시대 무관 변안열을 추모하는 서원,관광지 역사 역사공부 역사관광지 역사를품은곳 역사문화재 역사속       
평천서원,선비문화의 숨결이 남아있는 서원,경남산청평천서원 경남평천서원 경상권 관광지 교과서속여행 산청평천서원              
청곡서원,일신당 이천경 선생의 학덕을 추모하기 위한 서원,관광지 산청군서원 산청청곡서원 역사 역사공부 역사관광지 역사를품은곳       
청계서원(함양),문민공 김일손을 기리기 위한 서원,관광지 역사 역사공부 역사관광지 역사를품은곳 역사문화재 역사속        
괴산 봉학사지 오층석탑,봉학사 터에서 발견된 고려 초기의 석탑,관광지 불교 불교문화 역사 역사공부 역사관광지 역사를품은곳 역사문화재          
김완장군묘소 및 신도비,영암의 위국충절의 상징 김완장군의 묘와 비,관광지 신도비 역사 역사공부 역사관광 역사관광지 역사를품은곳           
운구서원,선현을 제향 하기 위해 세운 서원,관광지 역사 역사공부 역사관광지 역사를품은곳 역사문화재 역사속          
장대서원,조선 중기 문신 신지제를 추모하기 위해 창건한 서원,관광지 역사 역사공부 역사관광 역사관광지 역사를품은곳 역사문화      
자동서원,조선 후기의 생활상을 볼 수 있는 자동서원,관광지 김천자동서원 역사 역사공부 역사관광지 역사를품은곳 역사문화재        
경주시 관광특구,천년의 고도. 한국 대표 역사 문화 도시,경상권 경주관광 경주문화재 경주여행 경주유적지 관광지 세계문화유산          
오산서원,조선시대 문신 김난상 추모를 위한 곳,관광지 역사 역사공부 역사관광지 역사를품은곳 역사문화재 역사속       
봉덕서원,조선시대의 문신 밀양 박두극을 배향한 서원,관광지 교육기관 봉덕재기 봉덕재상량문 서원 역사 역사공부 역사관광지             
구천서원(함양),선현들의 위패를 모시고 제향하는 서원,관광지 역사 역사공부 역사관광지 역사를품은곳 역사문화재 역사속     
명호서원,이원과 이주의 학문과 덕행을 추모하기 위한 서원,관광지 안동관광 안동명호서원 역사 역사공부 역사관광지 역사를품은곳         
