place,info,태그
송공여객선터미널,신나는 섬 여행의 시작,12사도 관광지 기점도 당사도 섬여행 섬티아고여행 송공여객선터미널    
낭만농장 귤밭76번지,귤도 따고! 인생 사진도 찍고!,감귤체험농장 관광지 귤따기체험 낭만농장귤밭76번지 제주감귤체험   
도남지,하중도 인근의 낚시하기 좋은 곳,관광지 대구가볼만한곳 대구낚시 대구저수지 도남저수지 도남지
고북제,민물 낚시꾼의 천국,고북저수지 고북지 관광지 드라이브코스 민물낚시터 서산낚시 서산저수지
냉정지,외래 어종이 없는 청정 저수지,관광지 아산낚시터 아산냉정지 아산데이트코스 아산레포츠 아산산책  
아산그린타워,"볼거리, 즐길거리를 모두 만족할 수 있는 전망대",관광지 아산가볼만한곳 아산곤충생태원 아산그린타워 아산여행 아산전망대
여사울성지,충청도 천주교회의 시작과 중심,관광지 예산나들이 예산데이트코스 예산산책 예산성당 예산여행 예산포토존
홍성전통시장 오일장(홍성5일정기시장),각종 먹거리가 가득한 홍성의 전통시장,쇼핑 홍성시장 홍성오일장 홍성재래시장 홍성전통시장
암태남강선착장,비금도로 가볼까?,1004섬 관광지 남강선착장 비금도 비금도여행 섬여행 신안여객선터미널   
배내고개,영남 알프스를 감상하기 좋은 포인트,관광지 등산로입구 배내고개 배내터널 배냇골입구 쉼터 영남알프스  
오도선착장,다양한 즐길 거리로 가득한 신안 관광 명소,1004대교전망 1004벤치 1004섬요트 관광지 신안섬여행 신안여행   
압해도선착장,바다낚시를 떠나는 배를 타는 선착장,1004섬요트관광 관광지 목포야경 신안배낚시 신안섬여행 신안여행   
증도 왕바위여객선터미널,여행의 시작!,관광지 노을명소 슬로시티 신안섬여행 신안여행 자은도 증도여행  
자라도선착장,신안의 작은 선착장,관광지 섬마을 신안섬여행 신안여행 안좌도 자라도 자라도선착장  
백암해안전망대,낭만이 가득한 영광의 노을을 즐기고 싶다면!,관광지 노을명소 백수해안도로 백암해안전망대 영광9경 영광여행 풍력발전기 
문화산수 옥화구곡 관광길,역사와 문화가 함께하는 자연친화적인 관광길,경치여행 경치좋은곳 남녀노소 레포츠 산책코스 산책하기좋은곳 옥화구곡    
반남박씨묘역,역사적 자료로서의 가치를 가진 곳,관광지 명필가윤덕준 서예 석인상 큰재봉공원 화성가볼만한곳 화성향토유적
다원이음터,다양한 체험을 할 수 있는 시설,1인미디어 다원이음터 문화시설 미디어창작소 이음터 화성시인재육성재단
나무키움(전의양묘영농조합법인),우리의 무궁화를 향한 진심,2024_여행가는달과함께하는_발도장여행지 가족과함께 관광두레 관광지         
잼토리 JAMTORY,음성군 최초 지역 전문 여행사,가족과함께 관광두레 관광지 아이와함께 여름휴가 음성군 잼토리      
주식회사 하늘,정성이 가득한 하늘굴비만의 특별한 맛,관광두레 관광지 굴비 먹거리 영광군 음식관광 전남 전남_관광두레   
아올,자연을 모티브로 한 목공 제품들을 만날 수 있는 곳,관광두레 관광두레_주민사업체 관광지 문화활동 아올 영광군 전남   
THE영광커피,즐거운 시간을 보내는 방법,관광두레 관광두레_주민사업체 먹거리 미식 식도락여행 이색체험 전남_관광두레     
서로마을,관광체험상품을 개발하고 있는 영광군 공동체,가족과함께 관광두레 관광두레_주민사업체 관광지 문화체험 연인과함께         
오류,,
GB포유공방,"비누공방, 캔들 공예, 화장품을 제작하는 공방 주민사업체",가족과함께 가죽공예 공예체험 관광두레 관광두레_주민사업체 쇼핑       
지구마을산책,영천의 매력속으로 풍-덩,가족과함께 경북 경북_관광두레 경북영천시 관광두레 관광두레_주민사업체        
고가담(가치를 담다),‘고성의 가치를 담다’,가족과함께 경남_관광두레 고가담(가치를담다) 관광두레 관광두레_주민사업체     
옹기랑,아름다운 해안과 어우러진 절경,가족과함께 경남 경남_관광두레 고성군 관광두레 관광지 문화체험 
배바우청정마을,자연의 아름다움이 보존된 마을,가족과함께 관광지 농촌마을 아이와함께가기좋은 자연마을 자연좋은곳
은구비역사공원,자연과 역사를 느낄 수 있는 공원,관광지 대전공원 대전데이트코스 대전산책 대전여행 대전유아공원 대전힐링여행
동아리조트,충남 태안군 안면읍에 자리 잡은 리조트,관광지 꽃지해수욕장숙소 동아리조트 숙박 태안리조트 태안숙박 태안숙소
리츠캐슬 리조트,가족과 좋은 추억 쌓기 좋은 리조트,관광지 리츠캐슬리조트 숙박 태안리조트 태안숙박 태안숙소
레인보우캐슬리조트,편안한 하루 밤을 선사하다,관광지 레인보우캐슬리조트 숙박 태안리조트 태안숙박 태안숙소
클라임파크,온 가족이 즐길 수 있는 스포츠 클라이밍,가족카페 레포츠 실내암장 암벽체험 양산레포츠 양산시 유아스포츠   
토곡요,통도사 인근 대형 갤러리카페,갤러리카페 도자기전시 도자기카페 문화시설 양산시 양산시도자기 양산토곡요  
오션힐리조트,자연 속 힐링 숙소,관광지 숙박 오션힐리조트 태안리조트 태안숙박 태안숙소
명동선착장,우도와 소쿠리섬을 오고 가는 선착장,관광지 명동선착장 배타는곳 소쿠리섬 우도 음지도 진해해양공원  
애니멀스토리,다양한 동물 친구들을 만날 수 있는 공간,관광지 동물원 마산동물원 먹이주기체험 실내동물원 애니멀스토리 창원시
울산업스퀘어,울산 최대 복합 쇼핑몰,쇼핑 울산데이트코스 울산데이트코스 울산삼산볼거리 울산서점 울산쇼핑몰 
한림술뫼파크골프장,김해 시민과 타 시군 주민을 위한 공간,김해시 낙동강변 레포츠 술뫼생태공원 술뫼파크골프장 실버스포츠 월간_사진_제보_이벤트 
합천왕후시장,풍성한 농산물을 만날 수 있는 합천 최대 전통시장,관광지 농수산물 생필품 쇼핑 왕후시장 재래시장 합천오일장 합천왕후시장  
송도항,섬 여행의 시작!,관광지 민어 병어 새우젓 송도선착장 송도수산시장 송도항 신안여행  
감악산항노화웰니스체험장,아름다운 풍경을 조망할 수 있는 곳,감악산 감악산꽃밭 감악산풍력발전 감악산항노화웰니스체험장 거창산상화원    
옥천계곡,창녕을 대표하는 여름철 피서지,관광지 관룡사 낙동강여행 옥천계곡 용선대 창녕가볼만한곳 창녕계곡  
학포수변생태공원,낙동강을 따라 산책하기 좋은 공원,관광지 낙동강 창녕가볼만한곳 창녕산책 창녕산책로 창녕생태공원 창녕여행  
지세포항수변공원,조용하게 휴식을 취할 수 있는 곳,거제가볼만한곳 거제낚시 거제도낚시 거제도여행 거제여행 거제여행지추천   
둔촌갯벌체험장,전통 쏙 잡이 체험을 즐길 수 있는 곳,갯벌체험 관광지 남해가볼만한곳 남해바다체험 남해여행 독일마을 둔촌갯벌체험장   
장승포 해안일주도로,아름다운 해안 절경을 따라 드라이브하기 좋은 곳,거제가볼만한곳 거제도드라이브 거제도여행 거제도전망좋은곳 거제드라이브    
지세포 낚시공원,낭만 있게 방파제에서 낚시를,거제가볼만한곳 거제낚시 거제도낚시 거제도여행 거제여행 거제여행지추천   
오늘은카트레이싱,성읍 녹차마을 옆에서 즐기는 카트레이싱,레포츠 오늘은카트레이싱 제주관광지 제주도가볼만한곳 제주도여행 제주액티비티   
명량해상케이블카,하늘에서 신비로운 울돌목 회오리를 감상할 수 있는 케이블카,가족과함께 관광지 남녀노소 바다경치 이색체험 케이블카 해남가볼만한곳    
노원 불빛정원,오색찬란한 조명을 밝힌 빛의 향연,관광지 서울_여행지_추천 서울가볼만한곳 서울권 야경명소 폐역
달전망대,시화호와 서해를 조망할 수 있는 시화 지역의 랜드마크,관광지 뷰맛집 서해 시화나래조력문화관 시화지역랜드마크 안산가볼만한곳 
대진항 (영덕),경상북도 영덕군 영해면 대진리에 위치해 있는 항구,관광지 대진항 영덕가볼만한곳 영덕낚시 영덕여행 영덕항구
롯데뮤지엄,"세상을 보는 새로운 가치, 롯데뮤지엄",LMOA 감실전시관 롯데뮤지엄 롯데뮤지엄오브아트 롯데박물관 문화시설  
서울청과,80년이 넘는 역사를 가진 국내 최고의 농산물 도매시장 법인,가락동농수산물시장과일 가락동시장청과물 과일도매유통 서울청과 쇼핑  
대관령 스키 역사관,국내 최초의 이야기가 있는 스키 박물관,문화시설
HAPPY700 평창시네마,즐거운 여가생활,문화시설 영화관 평창 평창시네마 평창영화관
CFI 에너지미래관,신재생에너지를 배우는 전시·학습 공간,관광지 산업관광 산업관광지 신재생에너지 아이들과함께 제주여행
평창자연휴양림,"맑은 공기, 편안한 휴식이 있는 곳",관광지 자연휴양림 태기산휴양림 평창자연휴양림
화전분재예술원,멋진 분재들을 작품으로 만날 수 있는 독특한 음식점,드라이브코스 서울근교나들이 음식 이색식당 화전분재예술원 화전생두부  
석조보살좌상,고려시대 화엄계통 사원에서 만든 특징을 보여주는 대표적인 작품,관광지
판관대,율곡 이이에 관한 전설이 깃든 곳,강원 관광지 메밀꽃밭 문학의길 자연 판관대 팔석정 평창 평창군    
돈너미 카르스트,국내 대표적인 카르스트지대,관광지 카르스트지대 카르스트지형 평창가볼만한곳 평창군
고마루 카르스트,자연이 만든 신비한 지형,강원 강원평창군 고마루 고마루길 고마루카르스트 관광지 지대 천연동굴 
순수 양떼목장,반려동물과 함께 넓은 초원과 양떼를 볼 수 있는 힐링 여행,강원권반려동물여행지 강원도 강원도여행 관광지 반려동물 반려동물동반여행지  
기화리 코끼리바위,거대한 코끼리를 닮은 특이한 지형,강원 강원평창군 고생대지질공원 관광지 기화리 석회암 지대 코끼리바위  
청성애원 우루루동물농장,다양한 동물들과 교감할 수 있는 자연 놀이터,관광지 동물농장 아이와함께 평창
한강뮤지엄,카페와 전시회 관람 모두 가능한 공간,강변뷰 갤러리카페 남양주드라이브 남양주카페 문화시설 전시관람 팔당역카페 
100년임당방앗간,100년의 역사가 깃든 방앗간을 개조한 카페,가족과함께 강릉가볼만한곳 강릉카페 강원권 강원도_여행지_추천 연인과함께      
용인시기후변화체험교육센터,어린이들의 눈높이에 맞춘 맞춤형 기후변화 교육 공간,기후변화 기후변화체험교육센터 멸종위기 문화시설 생태체험관 지구온난화  
두타산협곡마천루,암릉과 기암절경이 호위하는 아름다운 풍경,강원권 강원도_여행지_추천 걷기좋은길 관광지 동해가볼만한곳 두타산
무릉 달빛 호암소,청정 자연을 느끼며 걸어보는 힐링 명소,강원권 강원도_여행지_추천 걷기좋은길 관광지 동해가볼만한곳 무릉계곡 
김해 와인동굴,특산물 산딸기 와인을 전시하는 와인동굴,경남관광 관광지 김해가볼만한곳 김해가족여행 김해레일바이크 김해여행   
밤일마을,다양한 먹거리를 제공하는 음식 문화거리,관광지 광명가볼만한곳 광명시 월간_사진_제보_이벤트 음식문화개선특화거리 
대경도 대합실,해상에서 즐기는 휴식,경도골프장 고래닮은섬 관광지 대경도 대경도대합실 여수경도골프 여수경도여객선   
리버포인트 수상레저,대형 수상레저 시설과 깔끔한 인테리어를 자랑하는 곳,가평 가평가족여행 가평수상레저 가평수상스포츠 가평숙소 레포츠 리버포인트수상레저
경포플라워가든,다채로운 빛깔의 튤립이 만개하는 곳,강릉가볼만한곳 강원권 강원도_여행지_추천 경포호 관광지 봄꽃여행지
구름산 산림욕장(구름산 도시자연공원),피톤치드가 가득한 도심 속 휴식 공간,가족 관광지 구름산 나들이 산림욕장 월간_사진_제보_이벤트 주말  
기흥레스피아호수공원,"산책로와 자전거도로, 반려견 놀이터가 잘 조성된 수변공원",경기권반려동물여행지 관광지 노을명소 데이트코스 반려동물 반려동물동반여행지    
금강공원에코스튜디오,자연과 조형물이 조화로운 아름다운 공간,강원권 강원도_여행지_추천 관광지 동강 생태공원 영월가볼만한곳
현천마을,산수유가 아름다운 마을,관광지 구례군 구례여행 봄여행 산수유 산수유마을 여행지 지리산 
무궁화수목원,5천년의 역사와 이야기가 있는 무궁화,강원권 강원도_여행지_추천 걷기좋은길 관광지 무궁화 수목원 홍천가볼만한곳
동천자연식물원,동식물과 함께하는 아이들의 자연 놀이터,관광지 동물원 동천자연식물원 먹이주기체험 숲생태학교 아이와함께  
로만바스,다양한 내부 시설로 이색 데이트가 가능한 곳,가족나들이 관광지 로만바스 서울에서가까운온천 수도권온천 용인온천  
미륵사(용인),목조로 만든 관세음보살이 있는 사찰,고요한 관광지 대한불교조계종미륵사 말구리고개 미륵사 삼광사 수지사찰 
강씨봉 자연휴양림,아름다운 경관을 온몸으로 만끽하다,관광지 산림욕 시가있는숲길 웰빙 자연휴양림 피톤치드 휴양림
양지체육공원,시민들의 건강한 여가를 위한 다목적 체육공원,관광지 반려견산책 산책하기좋은 양지근린공원 용인가볼만한곳 용인주차가능공원 
영덕레스피아,용인시민들을 위한 체육 공간,관광지 반려견산책공원 영덕레스피아 용인가볼만한곳 용인공원 용인운동시설  
용인중앙공원,아름드리 산과 공존하는 공원,관광지 반려견산책 산책하기좋은 아이와함께 용인가볼만한곳 용인주차가능공원 
서천레스피아,남녀노소 편안하고 즐겁게,관광지 바닥분수 서천레스피아 아이와가볼만한곳 용인가볼만한곳 용인공원   
고원화목원,꽃과 나무를 즐기며 산림문화를 배울 수 있는 공간,관광지 자연학습 전북권 전북특별자치도_여행지_추천 진안가볼만한곳 
산약초타운,진안군에서 자생하는 약초를 활용한 테마파크,관광지 마이산 산약초 전북권 전북특별자치도_여행지_추천 진안가볼만한곳
남부시장 청년몰,"볼거리, 즐길거리가 다양한 공간",남부시장 쇼핑 전북권 전북특별자치도_여행지_추천 전주가볼만한곳  
객사길,매년 열리는 전주국제영화제의 배경,관광지 영화의거리 전북권 전북특별자치도_여행지_추천 전주가볼만한곳  
침강저류지,용인의 차크닉 명소!,관광지 꽃창포 사진찍기좋은곳 억새명소 용인가볼만한곳 용인산책코스  
천주교 손골성지,신자들이 조선의 언어와 풍습을 익히던 장소,관광지 도리헨리코성인 성지순례 순교자의길 스탬프투어 용인가볼만한곳  
우리유황온천,도심 속에서 즐기는 온천,관광지 서울온천 온천 우리유황온천 천연유황온천 프라젠스파
광명에디슨뮤지엄,과학을 상상하고 생각을 체험하는 박물관,과학전시관 과학체험 문화시설 어린이과학관 어린이과학체험 에디슨  
도비도항,다양한 자연 생태자원이 있는 곳,관광지 당진낚시 당진데이트코스 당진산책 당진여행 당진항구
대천연안여객선터미널,아름다운 바다 풍경을 조망할 수 있는 대천연안여객선터미널,관광지 보령데이트코스 보령산책 보령여객선 보령여객선터미널 보령여행 
구강사,도심 속 마음의 평안을 위해 찾는 사찰,강동구사찰 관광지 구강사 금강유치원 도심사찰 불교유치원 서울사찰
정릉아리랑시장,오랜 세월 자리를 지켜온 전통시장,골목시장 백종원의골목시장 쇼핑 아리랑골목시장 재래시장 전통시장 
황도,서해안에서 일출을 감상하자,관광지 섬 일출 일출맛집 태안가볼만한곳 태안관광 태안여행
회암저수지,아담한 소류지,경기도남부저수지 관광지 안성저수지 안성회암저수지
상궁저수지,드라이브 코스로 알려져 있는 상궁저수지,관광지 드라이브코스 보은낚시 보은붕어낚시 보은블루길낚시 보은저수지 
충도저수지,배스낚시를 즐기는 낚시꾼들이 즐겨찾는 저수지,관광지 소이지 음성낚시터 음성붕어낚시 충도저수지
호계종합시장,쇼핑하기 좋은 곳,쇼핑 안양전통시장 안양호계시장 호계시장 호계시장이벤트 호계종합시장
내포항,낚시 포인트로 유명한 항구,가볼만한곳 관광지 낚시명소 내포항 태안군 태안낚시 태안여행 태안항구
거잠포선착장,노을이 아름다운 선착장,거잠포선착장 관광지 서해바다 서해일출 영종도 용유도 인천선착장
만정민트바다낚시터,추억을 낚는 곳,레포츠 만정민트바다낚시터 바다유료낚씨터 영종도낚시터 유료낚시터  
만정사계절바다낚시터,안정감이 좋은 여유로운 낚시터,레포츠 만정사계절바다낚시터 영종도낚시터 인천낚시터 인천유료낚시터 
여천선착장,여수의 금오도와 안도를 가기위한 항구,관광지 금오도 바다여행 비렁길 섬여행 여수바다 여수섬여행 여수여행  
오동도 유람선터미널,아름다운 풍경을 바라보며 해상에서 즐기는 휴식,관광지 여수바다여행 여수밤바다 여수여행 오동도여행 오동도유람선터미널  
여수 연안여객선터미널,여수를 대표하는 여객 터미널,거문도 거북선대교 관광지 금오도 돌산대교 섬여행 여수밤바다 여수섬여행  
금강생태공원(서천생태공원),해마다 겨울철이 되면 철새 군무를 감상할 수 있는 곳,관광지 생태공원 서천공원 서천데이트코스 서천드라이브 서천산책 서천여행
당암포구,낚시꾼들의 성지,관광지 당암포구 태안낚시 태안여행 태안포구
몽산포어촌계수산물판매장,몽산포 어민들이 운영하는 해산물 판매장,몽산포어촌계수산물판매장 쇼핑 태안가볼만한곳 태안수산시장 태안여행 
신두리사구센터,해안사구에 대한 정보를 쉽게 배우는 공간,문화시설 신두리사구 신두리사구센터 신두리해안사구 태안가볼만한곳  
신진항,태안에서 가장 큰 항구,관광지 신진항 신진항어시장 태안낚시 태안여행 태안항구
음포해수욕장,아담하고 조용한 음포해수욕장,관광지 여행 음포해수욕장 태안군 태안여행 태안피서지 태안해수욕장
학암포선착장,태안 낚시 명소,관광지 낚시 산책하기좋은곳 선착장 조용한항구 지방어항 태안낚시명소
대야도선착장,낚시객들이 많이 찾는 항구,관광지 대야도항 태안낚시 태안여행 태안항구
낙천탕,충북 충주시 수안보면에 위치한 온천,관광지 낙천탕 수안보가족탕 수안보온천 천연온천수 충주여행 충주온천
월악선착장,전망 좋은 카페와 프라이빗 캠프닉 캠핑장이 있는 선착장,관광지 다람쥐섬 악어섬 월악선착장 유람선여행 충주가볼만한곳 충주여행 
고운뜰공원,아늑한 시민들의 휴식 공간,고운뜰공원 고운뜰전망대 관광지 세종가볼만한곳 세종나들이
충주농수산물도매시장(충주시농수산물도매시장),충청북도 북부권의 유일한 농수산물 유통의 중심지,쇼핑 충주가볼만한곳 충주농수산물도매시장 충주쇼핑 충주시장
호암지생태공원,도심 속 산책하기 좋은 생태공원,관광지 생태공원 충주나들이 충주데이트코스 충주여행 호암지생태공원
청량리청과물시장,전통과 역사를 가진 청과물 전문 도매시장,도매시장 쇼핑 청과물시장 청량리과일도매시장 청량리과일시장 청량리청과물시장
도마큰시장,먹거리가 가득한 도마큰시장,대전가볼만한곳 대전시장 대전재래시장 도마큰시장 쇼핑
뚝섬 전망 문화 콤플렉스,시민 모두를 위한 문화 쉼터,관광지 뚝섬자벌레 뚝섬전망문화콤플렉스 복합문화공간 서울생각마루   
백골병단전적비,한구 최초의 유격부대였던 백골 병단을 기리는 백골병단전적비,관광지 역사 역사관광지 전쟁역사
오색 용소폭포,맑은 계곡과 울창한 숲이 어우러진 수려한 경관,강원여행 관광지 양양가볼만한곳 양양여행 오색용소폭포 용소폭포 자연  
기사문항,38선에 위치한 작은 규모의 항,관광지
송악산 진지동굴,"역사의 흔적이 남은 동굴, 송악산 진지동굴",관광지 송악산 제주가볼만한곳 제주관광명소 제주도여행 제주도여행추천   
순천중앙시장,"정겨운 분위기 속에서 쇼핑과 먹거리, 문화를 함께 즐길 수 있는 전통시장",쇼핑 순천가볼만한곳 순천반찬가게 순천여행 순천재래시장 순천전통시장  
송악카트체험장,바다를 바라보며 신나는 스피드를 즐겨보자!,레포츠 송악카트체험장 제주가볼만한곳 제주관광명소 제주도여행 제주도여행추천  
송악산전망대,아름다운 경치를 감상할 수 있는 송악산,관광지 송악산전망대 제주99봉 제주가볼만한곳 제주관광명소 제주도여행  
묘도선착장,일출이 아름다운 고양이처럼 생긴 묘도,고양이섬 관광지 광양만 묘도대교 묘도선착장 여수낚시 여수여행   
백야선착장,여수의 작은 섬들의 다리역할을 하는 선착장,관광지 백야도 백야선착장 삼여행 여수관광 여수바다낚시 여수섬여행  
솔오름 (미악산),우거진 산림 속 가벼운 트래킹 하기 좋은 곳,관광지 미악산 솔오름 제주가볼만한곳 제주관광명소 제주도여행 제주도여행추천 
중앙쇼핑센터,1975년 개설된 상가건물형의 중형시장,꿈뜨락몰 쇼핑 여수가볼만한곳 여수시장 여수여행 여수중앙시장 여수청년몰  
대정성지,정난주 마리아의 묘가 안치된 곳,관광지 대정성지 정난주마리아 제주가볼만한곳 제주관광명소 제주도여행  
어란진항,매력이 넘치는 항구,관광지 다도해역 어란진항 어불도 해남가볼만한곳 해남바다낚시 해남여행
드림바다실내낚시터,도심 가운데 실내 바다낚시터,24시간 김포실내바다낚시터 낚시터 년중무휴 레포츠 실내 창고형
서프홀릭포항,포항 최대 규모의 서핑 강습 및 체험 공간,경북서핑 레포츠 서핑 서핑강습 포항레포츠 포항서핑 포항여행
오소재쉼터,두륜산으로 가는 다양한 길 !,관광지 두륜산 오소재쉼터 오소재약수터 해남가볼만한곳 해남관광명소  
중문카트체험장,제주도에서 즐기는 신나는 레이싱,레포츠 제주가볼만한곳 제주도가족여행 제주도카트체험 제주어린이놀이   
황우지해안열두굴,일본군이 인공적으로 만들어 놓은 군사방어용 굴,관광지 제주가볼만한곳 제주관광명소 제주도동굴 제주도여행추천 제주여행  
꽃객프로젝트,몽환적인 핑크뮬리 정원,고창수목원 고창핑크뮬리 고창핑크뮬리축제 관광지 민간정원 반려동물     
새만금무궁화공원,다양한 품종의 무궁화를 만날 수 있는 공원,고군산군도 관광지 군산여행 무궁화공원 바다공원 새만금무궁화공원  
클럽디 보은,"약 94만5,000㎡ 부지에 들어선 18홀 코스의 골프장",골프관광 골프여행 골프장 국내골프장 레포츠 클럽디보은
선유1구항,정겹고 행복한 쉼이 있는 어항,고군산군도 고군산길 관광지 구불8길 군산여행 새만금방조제 선유도   
마음수련 메인센터(마음수련 논산 메인센터),나를 돌아보는 시간,논산가볼만한곳 논산여행 레포츠 마음수련메인센터 명상체험
병암유원지,여름 휴가철마다 피서객들의 방문이 많은 관광 명소,관광지 논산데이트코스 논산드라이브 논산산책 논산여행 논산유원지
보령 베이스리조트(대천웨스토피아콘도),충남 보령시 명천동에 자리 잡고 있는 리조트,관광지 보령리조트 보령베이스리조트 보령숙박 보령숙소 숙박
