place,info,태그
서산동부전통시장,따뜻한 정이 넘치는 서산동부시장,가족여행 나들이 나홀로여행 데이트코스 동부시장 먹거리 서산동부시장            
디타워 (replace 광화문),"레스토랑, 카페 등 공간이 어우러진 도심형 복합 타워",광화문맛집 광화문상가 광화문쇼핑 디타워광화문점 쇼핑 월간_사진_제보_이벤트   
아빠가 만든 캠핑장,조용하고 프라이빗한 캠핑장,가족캠핑 강원도캠핑장 넓은사이트 레포츠 애견동반캠핑장 여름물놀이 
어울림펜션 캠핑장,조용하고 쾌적한 캠핑을 즐길 수 있는 곳,강원도캠핑장 낚시 레포츠 레프팅 별보기좋은 소규모캠핑장 영월군캠핑장 
웰리힐리파크오토캠핑장,한폭의 파노라마 처럼 펼쳐진 아름다움,강원도캠핑장 겨울눈꽃명소 레포츠 스키 액티비티 횡성군캠핑장
영지사,영천 구룡산에 있는 의상대사가 창건한 사찰,관광지 불교 불교문화 사찰여행 역사 자연속으로 자연환경 전통사찰      
은적사(대구),"고려 태조 왕건을 살린 벼랑 끝 은신처, 비슬산 은적사!",가족여행 경상권 관광지 대구비슬산 대구사찰 불교 불교문화 사찰                  
인천일본풍거리,20세기 초 일본의 근대 거리를 볼 수 있는 곳,관광지 동화마을 인천개항장거리 인천일본58은행지점 일본감성카페   
서천 금빛노을 서울시캠핑장,자연 속에서 즐기는 휴식,가을단풍명소 걷기길 레포츠 서천군캠핑장 여름물놀이 충청남도캠핑장
오류,,
수입천(하천),천혜의 자연이 꽃피는 곳,관광지 월간_사진_제보_이벤트 자연
백양산명소,독특한 지형을 만끽할 수 있는 트레킹형 명소,경상권 관광지 백양산 백양산명소 생태관광 생태관광지 자연여행    
안산 갈대습지공원,시화호의 수질개선을 위해 조성한 국내 최초의 대규모 인공습지,걷기길 걷기여행 관광지 비봉습지공원 생태관광 생태관광지 습지와갯벌    
"강화도 남단(여차리, 선두리 해안)",청정한 생명력으로 가득한 우리나라 최대 규모 연안 습지,갯벌체험 겨울방학가볼만한곳 관광지 교동도 바다와섬 볼음도 생태관광        
괴산 산막이옛길,훼손되지 않은 자연의 아름다움을 느껴보자,걷기길 걷기여행 관광지 괴산산막이옛길 괴산호 생태관광 생태관광지  
한라산국립공원,태고의 신비를 간직한 한라산,관광지 눈꽃&설경여행 산과공원 생태관광 생태관광지 트레킹 한라산
우암 송시열 글쓴바위,바닷가의 암벽에 새긴 우암 송시열의 시,관광지 암각시문 역사공부 역사관광지 역사를품은곳 역사문화재 역사속            
인천승마공원,사람도 동물도 모두가 행복해지는 곳 인천승마공원,레포츠 승마공원 승마레슨 어린이승마 인천승마교육 인천승마체험 인천승마클럽 
강정포구,환상적인 일출과 일몰을 감상하다,강정포구 관광지 제주가볼만한곳 제주사진명소 제주산책길 제주여행    
이천 도립리 반룡송,하늘에 오르려는 소나무의 기묘한 용틀임,관광지 도선국사 백사면 수도권 이천가볼만한곳 이천도립리반룡송 이천도립리소나무    
넵튠 수상레저 & 웨이크서핑 인싸서프,입문자를 위한 원포인트 레슨 맛집,국가대표강습 남양주수상레저 남양주웨이크서핑 레포츠 웨이크보드 초보자강습
한탄강변자연생태탐방로(벼롯길),바스락바스락 낙엽을 밟으면서 걷기 좋은 길,걷기길 걷기여행 관광지 단풍여행 벼룻길 비둘기낭폭포 생태관광    
창원 주남저수지,철새의 군무를 사진으로 담을 수 있는 장소,걷기길 겨울방학가볼만한곳 관광지 람사르문화관 생태관광 생태관광지    
경안천 습지생태공원,소중한 사람과 같이 걸을만한 곳,걷기길 경기도자박물관 경안천 경안천습지생태공원 관광지 박물관 분원백자자료관      
북악산생태탐방로,아름다운 자연의 소중함을 느끼며 걷는 힐링로드,걷기길 관광지 북악산 북악산생태탐방로 산책하기좋은곳 생태관광 생태관광지     
선암골생태유람길(숲소리길),맑은 물과 눈부시게 하얀 너럭바위가 옹기종기 모인 풍경을 감상할 수 있는 코스,걷기길 관광지 드라이브여행 생태관광 생태관광지 선암계곡 선암골생태유람길  
태종대명소,부산을 대표하는 해안 경관지,걷기길 걷기여행 관광지 생태관광 생태관광지 영도해양문화공간 전망대  
오류,,
제천솔방죽 생태공원,느긋하고 평화로운 산책길,걷기길 관광지 생태공원 생태관광 생태관광지 솔방죽 주말추천여행지 
무릉계곡관광지,기암괴석과 폭포들이 절경을 이루는 곳,관광지 두타산 무릉계곡 생태관광 생태관광지 자연속으로 자연여행      
한탄강자연생태탐방로,한탄강을 온몸으로 느낄 수 있는 곳,걷기길 걷기여행 관광지 생태관광 생태관광지 수도권 승일교 주말추천여행지    
강원도 자연환경연구공원,자연환경을 배우고 체험하는 곳,가족과함께 강원권 강원도자연환경연구공원 관광지 생태관광 생태관광지       
갯골생태문화탐방로,우리나라의 대표적인 내만 갯벌,갯골생태문화탐방로 걷기길 관광지 국가습지보호구역 생태관광 생태관광지    
보성 벌교 갯벌,천혜의 자연 환경을 간직한 생태의 보고,관광지 벌교 벌교갯벌 생태관광 생태관광지 습지와갯벌 여름방학가볼한곳  
속리산국립공원,산들이 겹겹이 펼쳐놓은 절경 속 힐링의 시간,관광지 국립공원 단풍여행 봄꽃여행 산과공원 생태관광 생태관광지    
태안군 신두리 해안사구,우리나라 최대의 해안사구,관광지 바다와섬 생태관광 생태관광지 신두리 주말추천여행지 태안  
주남저수지 생태학습관,주남저수지 생태계를 느낄 수 있는 전시관,가족여행 걷기길 관광지 생태관광 생태관광지 생태체험 주남저수지   
몰운대,우거진 송림과 기암괴석이 연출하는 아름다운 해안절경,걷기길 관광지 몰운대 생태관광 생태관광지 힐링&휴양여행
낙동 승곡마을(농촌체험마을),경상북도 상주시 농촌체험 휴양마을,경상권 관광지 낙동승곡마을 농촌체험 농촌체험마을 생태관광 생태관광지      
동백동산 습지센터,우리가 꼭 지켜야 내야 할 자연의 선물,걷기길 관광지 동백동산 동백동산습지센터 생태관광 생태관광지 유네스코세계지질공원  
무안갯벌,국내 최초 갯벌습지보호지역으로 지정된 무안갯벌,갯벌습지보호지역 걷기길 관광지 람사르습지 무안갯벌 무안황토갯벌랜드     
솔향기길 1코스,숲소리와 바닷소리를 들으며 자연을 느껴보자 !,걷기길 걷기여행 관광지 생태관광 생태관광지 솔향기길 자연좋은곳   
서산시 천수만,세계적인 규모의 철새 도래지,관광지 박물관 보령시 생태관광 생태관광지 서산버드랜드 안면읍       
경북동해안지질공원,동해에서 만나는 다양한 지질·지형 명소,걷기길 경북동해안지질공원 경상권 관광지 바다와섬 생태관광 생태관광지 
동림저수지,멸종 위기종인 수달과 철새들의 낙원,걷기길 겨울방학가볼만한곳 관광지 동림저수지 생태관광 생태관광지 
옹진군 신도,괭이갈매기가 번식하는 장소,관광지 구봉정 모도 생태관광 생태관광지 수기해수욕장 시도 신도     
제주도 하도리 숨비소리길(하도리밭담길),해녀들의 물질 숨소리길,관광지 드라이브여행 생태관광 생태관광지 제주권 제주도하도리 피서여행  
소백산국립공원(영주),사계절 다른 절경을 선사하는 산악형 국립공원,경상권 관광지 눈꽃여행 단풍여행 봄꽃여행 산과공원 생태관광 생태관광지    
월출산국립공원,달이 뜨는 산,걷기길 걷기길 관광지 나주 눈꽃&설경여행 단풍여행 목포 봄꽃여행       
오류,,
울진 금강소나무숲길,수백년을 살아온 소나무들과 함께 걸어보자 !,걷기길 관광지 산책로 산책하기좋은곳 생태관광 생태관광지 숲산책     
오대산국립공원,우리나라 문수신앙의 성지,강릉 강원권 걷기길 관광지 눈꽃&설경여행 단풍여행 상원사 생태관광     
월악산국립공원,웅장한 기암절벽과 아름다운 자연을 품은 월악산국립공원,걷기길 관광지 눈꽃&설경여행 단풍여행 산과공원 생태관광 생태관광지      
백룡동굴,천혜의 비경과 절경으로 알려진 평창 백룡동굴,강원권 강원웰니스관광지 관광지 마하리 미세먼지탈출_이색동굴여행        
운곡 람사르,세계문화유산인 고인돌 유적이 현존하는 곳,걷기길 고창 고창운곡람사르습지 관광지 생태관광 생태관광지 운곡람사르습지  
지동산촌마을,사시사철 푸른 아름드리 잣나무 숲이 아름다운 마을,관광지 생태관광 생태관광지 수도권 자연속으로 지동산촌마을 포천     
줄포만갯벌생태공원,부안에서 떠나는 생태체험,갯벌생태공원 걷기길 관광지 부안줄포만 생태공원 생태관광 생태관광지    
순천시낙안면꽃마차마을,넉넉한 인정과 훈훈한 인심을 가지고 있는 꽃마차마을,관광지 금전산 꽃마차마을 생태관광 생태관광지 전라권 주말추천여행지   
치악산국립공원,사계절이 모두 아름다운 치악산,강원권 관광지 구룡사 기차여행 단풍여행 단풍여행 상원사 생태관광    
덕유산국립공원,백두대간의 중심부,관광지 눈꽃&설경여행 덕유산국립공원 레포츠체험 무주구천동 무주리조트       
순천만 자연생태공원,"다양성이 풍부한 생물의 보고, 순천만",걷기길 관광지 생태공원 생태관광 생태관광지 순천만 순천만갈대길         
개매기체험,맨손으로 물고기를 잡는 전통 어업법을 직접 체험해보자 !,10월추천가볼만한곳 7월추천가볼만한곳 8월추천가볼만한곳 9월추천가볼만한곳           
만장굴,유네스코 세계 자연유산에 지정된 용암 동굴,관광지 김녕굴 만장굴 생태관광 생태관광지 유네스코세계문화유산 자연관광지      
문경새재 도립공원,아름다운 자연과 풍경을 품고 있는 도립공원,걷기길 관광지 교귀정 드라마촬영지 문경새재 생태관광 생태관광지        
에너지자립섬 자급자족 죽도,느리게 흘러가는 시간 속 휴식하기 좋은 섬,걷기길 걷기여행 관광지 바다경치 바다내음 생태관광 생태관광지   
억불산명품테마길,장흥에서 즐기는 트레킹,걷기길 걷기여행 관광지 생태관광 생태관광지 억불산 억불산명품테마길   
장산명소,다양한 화산암과 웅장한 지형을 만날 수 있는 곳,걷기길 걷기여행 경상권 관광지 생태관광 생태관광지 장산 트레킹
강화갯벌센터,갯벌의 중요성을 배우는 교육의 장,강화갯벌센터 관광지 동검리 동막리 바다경치 생태관광 생태관광지         
전남 신안 증도 [슬로시티],아시아 최초의 슬로시티,관광지 생태관광 생태관광지 소금박물관 소금박물관 슬로시티 신안갯벌센터          
고성 DMZ,남한 고성과 북한 고성으로 나뉜 분단군,DMZ DMZ DMZ박물관 관광지 금강산 김일성별장 생태관광 생태관광지          
물영아리 오름,물이 고인 습지를 품고 있는 신령스런 산,걷기길 관광지 물영아리오름 생태관광 생태관광지 제주권 제주도오름  
북한산 생태탐방연수원,청정한 국립공원이 가진 우수한 자연에 대해 배워보자 !,관광지 박물관 북한산생태탐방연수원 생태관광 생태관광지 자연관광지     
송도반도명소,부산지역 지각의 변형 과정을 한눈에 보다 !,걷기길 관광지 생태관광 생태관광지 송도반도 송도해수욕장 암남공원  
백두대간 숲 생태원,국내 최고의 숲 배움터,경상권 관광지 백두대간생태교육장 백두대간숲생태원 생태관광 생태관광지  
무주반디랜드 반딧불이자연학교,아름다운 청정지역에서 보내는 특별한 시간,관광지 무주반디랜드 무주반디별천문관 박물관 반딧불연구소 생태관광    
솔향기길 2코스,태안의 자연을 만끽하는 걷기 여행,걷기길 걷기여행 관광지 생태관광 생태관광지 솔향기길 자연 충청권   
서귀포시 걸매생태공원,자연의 풍류를 즐기는 공간,걷기길 걸매생태공원 관광지 생태공원 생태관광 생태관광지 제주권  
파주DMZ,분단의 아픔을 고스란히 담고 있는 곳,19_20한국관광100선 DMZ 경기 경기평화센터 관광지 도라전망대                     
고씨동굴,임진왜란 당시 피난처로 사용되었던 동굴,강원고생대 강원고생대_국가지질공원 강원권 고씨굴 고씨동굴 관광지      
국립 생태원,자연과 인간의 공존을 위한 국가 자연 생태 플랫폼,관광지 국립생태원 생태관광 생태관광지 전시관 체험학습 충청권
명지산-청계산 생태공원,가평군의 청정 자연과 생태 자원을 지키기 위한 노력,관광지 명지산 명지산생태전시관 생태공원 생태관광 생태관광지 생태전시관      
진천만뢰산 자연생태공원,자연환경이 잘 보전된 체험형 자연 생태공원,관광지 만뢰산 만뢰산자연생태공원 생태공원 생태관광 생태관광지 수목원    
순천자연휴양림,천혜의 자연환경을 갖춘 대한민국 생태수도,걷기길 관광지 생태관광 생태관광지 순천자연휴양림 주말추천여행지 
제주1100 고지습지,제주의 신비로운 습지 생태계를 만나 볼 수 있는 곳,1100고지습지 1100도로 걷기길 관광지 눈꽃여행 드라이브여행 생태관광     
대청호 추동습지,자연 속 휴식공간,걷기길 걷기여행 관광지 대청호 생태관광 생태관광지 습지와갯벌  
태안해안 국립공원,다양한 해안 생태계가 공존하는 국내 유일의 해안형 공원,걷기길 걷기여행 관광지 바다와섬 산과공원 생태관광 생태관광지   
왕피천생태탐방로,숲과 하천이 어우러진 편안한 숲길,걷기길 관광지 불영계곡 생태관광 생태관광지 왕피천 체험학습
안양천 생태이야기관,건강하고 아름다운 안양천 생태를 보호하자 !,관광지 교육여행 생태관광 생태관광지 생태여행 수도권 아이와함께    
북한산국립공원,도심속에 자리잡은 시민들의 휴식처,걷기길 관광지 봄꽃여행 북한산 북한산국립공원 북한산성 산과공원        
오류,,
대청호자연생태관,즐거운 체험과 함께 자연환경의 소중함을 느껴보자 !,걷기길 걷기여행 관광지 대청호 대청호자연생태관 드라이브여행 생태관광   
변산반도 국립공원,육상의 대자연과 해상의 청정함을 아우르는 국립공원,걷기길 관광지 변산반도 산과공원 생태관광 생태관광지 적벽강 전라권    
창녕군 우포늪,자연 속 휴식공간,겨울방학가볼만한곳 경상권 관광지 박물관 생태관광 생태관광지 소벌못        
정남진(편백숲우드랜드),자연과 더불어 숨쉬는 여행,걷기길 걷기여행 관광지 생태관광 생태관광지 숲산책 억불산 이색체험      
서산 버드랜드,새와 사람의 아름다운 만남,2022친환경추천여행지 겨울방학가볼만한곳 관광지 버드랜드 생태관광           
지리산 남부 국립공원,셀 수 없이 많은 봉우리가 절경을 이루는 지리산,걷기길 관광지 눈꽃&설경여행 단풍여행 산과공원 생태관광 생태관광지   
고창선사문화탐방로3,유네스코 생물권보전지역을 탐방해보자 !,걷기길 고창갯벌습지 고창읍성 고창인돌유적지 관광지 생태관광 생태관광지    
목포시 특정자생식물원,희귀·멸종위기 식물을 보전하고 증식하는 곳,관광지 생태관광 생태관광지 전라권 체험학습 특정자생식물원
서귀포시 성산포,성산일출봉을 품고 있는 곳,걷기길 관광지 생태관광 생태관광지 서귀포시성산포 성산일출봉 성산포       
순천만국가정원,아름다운 나무와 꽃이 만발하는 곳,5월추천가볼만한곳 INFP혼행 걷기길 관광지 봄꽃여행 생태관광 생태관광지   
오륙도명소,각양각색의 해식동굴과 동식물이 가득한 곳,걷기길 경상권 관광지 생태관광 생태관광지 오륙도 이기대 이기대해안산책로 
남해나비생태공원,나비의 생장 과정을 주요 테마로 만든 국내 최초의 공원,경상권 관광지 나비공원 나비생태공원 남해 남해나비생태공원 생태공원    
문경활공랜드,아름다운 문경의 하늘을 즐겨보자 !,관광지 레포츠체험 문경 문경새재 문경활공랜드 생태관광 생태관광지     
대송습지,천혜의 자원을 갖고 있어 서해의 보물섬이라 불리는 습지,관광지 낙조전망대 대부도 대부바다향기테마파크 대부해솔길 대송습지       
다산생태공원,자연과 교감할 수 있는 수변공원,9월추천가볼만한곳 걷기길 관광지 다산문화관 다산생태공원 다산유적지     
단양고수동굴,단양읍 고수리에 있는 석회동굴,고수동굴 고수리 관광지 단양고수동굴 미세먼지탈출_이색동굴여행 생태관광    
계룡산 국립공원,산세가 아늑하면서도 변화무쌍한 아름다운 산,가볼래터 걷기길 계룡산 계룡산국립공원 관광지 단풍여행 봄꽃여행      
양구DMZ,자연경관을 둘러볼 수 있는 생태관광지,DMZ 걷기길 관광지 내금강 대암산 두타연 박수근미술관 방산자기미술관        
소백산국립공원,아름다운 야생화들이 만발하는 소백산국립공원,걷기길 걷기길 고수동굴 관광지 국망봉 눈꽃&설경여행 단풍여행 봄꽃여행         
내장산 국립공원,조선 8경의 하나로 호남의 금강이라 불리는 내장산,15_16한국관광100선 19_20한국관광100선 21_22한국관광100선 관광지              
하례리생태관광마을,자연과 역사가 아름답게 어우러져 있는 마을,걷기길 걷기여행 관광지 생태관광 생태관광마을 생태관광지 제주권     
임진강변생태탐방로(율곡습지꽃가람놀이배움터),임진강을 따라 걸으며 자연의 소중함을 느껴보자 !,걷기길 걷기여행 관광지 생태관광 생태관광지 수도권 습지와갯벌      
순천시별량면거차뻘배체험마을,순천만 갯벌에서의 멋진 추억,거차뻘배체험마을 관광지 농촌체험 별량 생태관광 생태관광지 여름방학가볼만한곳  
서천군 조류 생태 전시관,가까이서 보고 즐기고 느끼는 새들의 마을,10월추천가볼만한곳 11월추천가볼만한곳 관광지 교육여행 금강하구     
거제생태문화탐방로(천주교순례길),자유와 평화를 찾다,거제몽돌해안 거제생태문화탐방로 걷기길 걷기여행 공곶이 관광지 생태관광       
구상반려암명소,지구의 신비를 간직한 희귀암을 만날 수 있는 곳,관광지 부산지질공원 생태관광 생태관광지 역사유적지 체험학습 황령산
두웅습지,자연이 살아 숨쉬는 곳,관광지 구례포해수욕장 두웅습지 생태관광 생태관광지 습지보호지역        
솔향기길 3코스,자연의 풍류를 즐기는 공간,걷기길 걷기여행 관광지 생태관광 생태관광지 솔향기길 태안
낙동강하구명소,강과 바다가 어울린 천연의 모래섬,걷기길 걷기여행 경상권 관광지 낙동강 생태관광 생태관광지 전망대 
제주 노루생태관찰원,자연의 신비함을 만끽하다,걷기길 관광지 생태관광 생태관광지 제주권 제주노루생태관찰원 체험학습 
남해 바래길,남해의 눈부신 자연 속으로 걸어가 보자 !,가천다랭이마을 걷기길 걷기여행 경상권 관광지 남해바래길 다랭이지겟길   
낙동강생태문화탐방로 나각산권,우거진 소나무 숲에서 삼림욕하기 좋은 탐방로,걷기길 관광지 나각산 낙동강 낙동강생태문화탐방로 상주 생태관광   
소백산자락길 동무삼기,소백산을 따라 걷는 힐링의 시간,걷기길 걷기여행 관광지 생태관광 생태관광지 소백산
민물고기 생태체험관,국내 최고 수준의 민물고기 생태체험 학습의 장,경상권 관광지 민물고기생태체험관 생태관광 생태관광지 전시관 체험학습
국립 종복원기술센터,한반도의 건강한 생태축 복원을 위한 곳,관광지 국립종복원기술센터 생태관광 생태관광지 여름방학가볼만한곳  
함평곤충생태관,자연의 풍류를 즐기는 공간,곤충생태관 관광지 생태관광 생태관광지 생태학습 이색체험 전라권  
백운산자연휴양림,가족과 여행하기 좋은 곳,관광지 백운산 백운산자연휴양림 생태관광 생태관광지 자연휴양림 전라권  
자연생태박물관,문경새재의 생태자원 및 생물자원을 연구하여 전시하는 곳,경상권 관광지 문경새재 박물관 생태관광 생태관광지 체험학습
만리포미소카라반,바다 뷰의 카라반,레포츠 바다뷰 카라반캠핑 태안 태안카라반
순천시주암면순천용오름마을,용이 구름을 안고 승천하는 듯한 아름다운 마을,관광지 농촌체험 생태관광 생태관광지 용당소 전통&역사문화체험 체험학습
파로호수변생태탐방로,중국군을 크게 이겨 지은 파로호,강원권 걷기길 걷기여행 관광지 비목공원 생태관광 생태관광지 파로호 
문경한지체험장,전통 방식 그대로의 한지를 만나볼 수 있는 곳,관광지 무형문화재 문경한지체험장 생태관광 생태관광지 전통&역사문화체험 
고창선사문화탐방로1,유네스코 생물권보전지역을 탐방해보자 !,갯벌습지 걷기길 고인돌유적지 고창갯벌습지 고창고인돌유적지 고창읍성       
순천만백리길,자연의 풍류를 즐기는 공간,걷기길 걷기여행 관광지 대여자도 별량화포 생태관광 생태관광지    
낙동강생태문화탐방로 경천대권,"가족 동반 산행하기에 좋고, 삼림욕하기에도 좋은 곳",걷기길 경상권 경천대 관광지 낙동강 생태관광 생태관광지 트레킹  
예래마을,자연의 풍류를 즐기는 공간,개다리폭포 갯깍주상절리대 걷기길 관광지 논짓물 생태관광 생태관광지       
다도해 국립공원(서부),신비로운 자연을 만나볼 수 있는 우리나라 최대 면적의 국립공원,걷기길 걷기여행 관광지 국립공원 다도해국립공원 비금&도초도코스        
선암골생태유람길(고개넘어길),산길과 도로를 따라 걸으며 즐기는 단양,걷기길 관광지 드라이브여행 생태관광 생태관광 생태관광지 생태관광지  
양구생태식물원,자연이 살아 숨쉬는 곳,강원권 걷기길 관광지 대암산 생태관광 생태관광지 양구생태식물원  
성보예술촌,시간을 창조하는 특별한 공간,경상권 관광지 생태관광 생태관광지 성보예술촌 성보촌 전시관 체험학습
전주자연생태 체험센터,전주권 자연생태의 명소로 자리매김 하는 곳,관광지 생태관광 생태관광지 승암산 자연속으로 자연여행 자연좋은곳     
사곡리마을,친환경농업의 최적지로 알려진 마을,경상권 관광지 농촌체험 사곡리 사곡리마을 생태관광 생태관광지    
심마니마을(가시오가피 마을),약초를 재배하는 깨끗한 농촌마을,가시오가피마을 강원권 관광지 농촌체험 생태관광 생태관광지 심마니마을     
하곡마을,깨끗한 자연이 숨 쉬는 해발 330m의 고랭지 마을,걷기길 관광지 생태관광 생태관광지 자연좋은곳 자연환경 진안 피서여행    
팔랑1리마을,대암산에서 불어오는 신선한 바람으로 스트레스를 날리시고 맛있는 곰취를 먹을 수 있는 마을,강원권 관광지 대암산 무형문화재 생태관광 생태관광지 양수암폭포    
지리산 생태탐방연수원,건강하고 지속 가능한 에코 리더를 양성하기 위한 곳,관광지 생태관광 생태관광지 지리산 지리산생태탐방연수원 체험학습
수분마을,신비한 이야기가 전해지는 마을,관광지 금강 새만금지방환경청 생태관광 생태관광지 섬진강 수분마을  
블루원글램핑,경주 시내 인근의 프라이빗 캠핑장,경상북도캠핑장 경주시캠핑장 럭셔리글램핑 레포츠 리조트 보문단지 
종달리해변,제주 동쪽 구좌읍에 위치한 조용한 해변,관광지 구좌읍여행 제주가볼만한곳 제주도수국 제주도해변 제주바다   
