place,info,태그
울기등대,우리나라 동해안 최초의 등대,가족과함께 경치좋은곳 관광지 대왕암공원 바다경치 바다풍경 아이와함께    
신남항,등대가 아름다운 항구,관광지 등대 산책코스 삼척가볼만한곳 항구 항구산책
남원사(익산),아담한 사찰,관광지 불교 불교문화 사찰 사찰여행 역사 연중무휴 익산남원사          
하평해변(동해),조용하고 한적하게 휴식하기 좋은 해변,경치여행 경치좋은곳 관광지 바다경치 여름피서지 자연관광지 자연속으로    
유민미술관,아르누보의 유리공예 작품을 전시하는 미술관,감성사진 문화공간 문화시설 문화예술 사진찍기 사진찍기좋은곳 사진촬영   
교동저수지(교동생태습지),사계절을 온몸으로 느낄 수 있는 나들이 명소,관광지 벚꽃명소 산책 산책길 저수지 저수지뷰 휴식 휴식하기좋은
보성녹차 시배지,아름다운 초록 물결이 흐르는 곳,관광지 녹차 보성 보성녹차 보성녹차시배지
지지계곡,울창한 수림과 청류수의 조화가 아름다운 계곡,관광지 여름피서지 자연 자연속으로 자연여행 자연좋은곳 자연풍경      
선도리갯벌체험마을,"물이 빠지면 광활한 갯벌이, 물이 들어오면 푸른 파도가 넘실",가족여행 갯벌체험 갯벌체험마을 관광지 생태체험학습장 쌍도 아이와함께         
죽림서원,선현에게 제사를 지내고 후학을 교육하기 위해 세운 서원,관광지 역사 역사공부 역사관광지 역사를품은곳 역사문화재 역사속       
강천사(순창),산세가 용이 꼬리를 치며 승천할 형상,가족여행 강천산 강천산군립공원 관광지 교과서속여행 불교 불교사찰         
대암산 용늪 (강원평화지역 국가지질공원),사시사철 구름을 품은 하늘의 연못,경치좋은곳 관광지 국가지질공원 인제자연생태계 자연 자연관광지 자연속으로        
개오리오름,세 개의 봉우리로 이루어진 복합형 화산체,가족과함께 개오리오름 관광지 등산 자연 자연관광지 제주가볼만한곳 
창포마을,일년 내내 창포밥의 보물을 만나 볼 수 있는 곳,BTS bts여행 bts투어 BTS힐링성지 가족과함께 관광지 농촌 농촌마을            
성국사,설악산 주전골에 자리 잡은 성국사,관광지 불교문화 불교사찰 사찰여행 자연속으로 자연여행 자연좋은곳     
진안 평지리 이팝나무 군,하얀 꽃으로 뒤덮여 아름다운 나무,관광지 자연 전라권 진안평지리이팝나무 천연기념물
영월 무릉리 마애여래좌상,아름다운 계곡과 절경이 보이는 곳에 위치한 마애상,관광지 역사공부 역사관광 역사관광지 역사문화 역사문화재 역사속       
고천암호(철새도래지),가창오리의 환상적인 군무를 볼 수 있는 곳,고천암호 관광지 살인의추억 서편제 영화촬영지 자연 전라권 철새  
곡성 단군전,단군왕검의 영정을 모신 사당,곡성여행 관광지 교육여행 단군 아이와함께 역사 역사공부 역사관광지     
스파레이,전통 동유럽 분위기를 물씬 느낄 수 있는 스파,관광지 뷰티&스파 사우나 여성전용 연중무휴 온천&스파 찜질방 친구와함께    
영월 술빛고을,청정지역 농산물을 다양하게 즐길 수 있는 곳,가족과함께 관광지 농촌마을 아이와함께 이색체험 자연환경
성거산,다양한 명소를 품은 천안의 명산,관광지 등산하기좋은 위례산성 자연 자연관광지 천안등산코스 천안시
사자바위,전설이 전해지는 사자 형상의 바위,경상권 관광지 기암괴석 사자바위 울릉도관광 울릉도바위 울릉도여행  
죽림사(포항),봉비산 자락에 위치하고 있는 도심 속 전통시장,경상권 관광지 불교 불교문화 사찰 사찰여행 역사 연중무휴 자연속으로         
단호사(충주),다양한 불교 유물을 볼 수 있는 사찰,관광지 교과서속여행 단호사 불교 불교문화 사찰 사찰여행 아이와함께          
카페 가은역(문경 구 가은역),레트로 느낌이 넘치는 간이역 카페,가볼래터 관광두레 관광지 여행구독 체험프로그램 카페 휴가추천여행지 
통구미몽돌해변,자연몽돌이 가득한 해변,관광지 울릉도관광 울릉도레포츠 울릉도여행 울릉도해변 울릉도해수욕장 
우이령 숲속문화마을(구 우이동 먹거리마을),북한산 아래 다양한 먹거리가 가득한 곳,가을먹거리 관광지 남녀노소 등산객 맛집탐방 먹거리 먹거리투어      
적가리골,계곡 물길을 따라 펼쳐치는 아름다운 바위와 골짜기,DMZ DMZ여행 가족여행 강원권 계곡 계곡트레킹 계단폭포 관광지       
마한문화공원,1500년전 고대국가 마한의 역사를 돌이켜 보는 공원,가족여행 걷기여행 관광지 교과서속여행 교육여행 나들이 산책길         
곤충농장 벅스팜,아이의 높이에 맞는 곤충 교육체험학습장,가족과함께 곤눙농장 관광지 교육여행 아이와함께 이색체험 자연여행    
주작산자연휴양림,자연과 함께 숨쉬는 편안한 공간,관광지 자연 전라권 주작산자연휴양림 휴양여행 힐링
금풀애마을,자연이 전하는 정취와 여유를 나누는 마을,가족과함께 관광지 농촌마을 농촌여행 자연마을 자연속힐링 자연좋은곳     
의신마을 (의신 베어빌리지),반달가슴곰과 함께 하는 의신마을,관광지 반달곰 베어빌리지 산책길 산책하기 산책하기좋은곳 의신마을베어빌리지          
문화세상고리 협동조합,서로 다른 문화를 연결하다,2021으뜸두레 2023으뜸두레 가족과함께 관광두레 관광지 문화활동    
해뜨는 대부도 고랫부리,대부도의 모든 것이 궁금하다면 !,가족과함께 경기안산시 관광지 대부도 생태관광지 아이와함께 음식관광  
내나로도,육지에서 본 비단과 같은섬 내나로도,관광지 낚시 섬 자연 자연속으로 자연여행 자연좋은곳 자연풍경   
보개바람,양곡창고를 개조해 만든 이색 베이커리 카페,관광두레 관광지 음식 음식관광 체험프로그램 카페 휴식공간
서귀포 용왕난드르마을,평온하고 따스한 마을,관광지 농어촌체험 어촌체험 어촌체험마을 이색체험 자연관광지 자연속으로        
올드타임,특별한 체험과 추억의 맛을 느낄 수 있는 곳,가족과함께 관광두레 관광지 근대산업유산 레트로 문화체험 음식관광 
거창 서변마을,딸기가 맛있는 청정 마을,가족체험 경상권 관광지 농촌 농촌체험 농촌체험학습 서변마을 아이와함께        
포천로컬푸드마켓,포천의 특산물을 체험하고 요리하다,관광두레 관광지 농산물직거래 농장체험 쇼핑 음식관광 특산물
녹도,보령 앞바다의 그림같은 섬,2020_휴가철찾아가고싶은_33섬 2022찾아가고싶은섬 2022찾아가고싶은섬_가을섬               
엘오알오,문경의 삶과 이야기를 들려주는 지역 관광두레 선정 업체,경북_관광두레 관광두레 관광지 문화활동 연인과함께 청년두레 체험프로그램 
대원공원,맨발 황톳길이 조성된 산책하기 좋은 공원,걷기길 경기도공원 관광지 대림공원 도심공원 산책길 산책로 산책하기          
갈천약수터,구룡령 계곡 바위에서 솟아나오는 약수,갈천약수터 관광지 약수터 양양군 자연
오류,,
남해 척화비,흥선대원군이 전국 각지에 세운 비,관광지 역사 역사공부 역사관광지 역사를품은곳 역사문화재 역사속       
오류,,
거제도해초쑥 영농조합법인,거제바다의 향기 해초쑥,2022으뜸두레 거제농업 관광두레 관광지 냉동쑥 농가소득증대 문화체험          
맹글(레몬트리협동조합),숨은 재능을 발굴하는 지역 공작소,가족과함께 관광두레 관광지 문화활동 연인과함께 이색체험 체험프로그램
현풍향교,조선시대 지역 유생들이 머물며 수학한 지방의 관학 기관,경상권 관광지 역사 역사공부 역사관광지 역사를품은곳 역사문화재              
카페나전역(나전카니발농업회사법인주식회사),아날로그 감성이 가득한 국내 1호 간이역 카페,2021으뜸두레 2022으뜸두레 2023으뜸두레 가족과함께 관광두레 관광지        
수륙해수욕장,잔잔한 파도와 얕은 수심으로 가족 단위로 놀기 좋은 해수욕장,가족과함께 가족피서지 경상권 공설해수욕장 관광지 바다 여름피서지       
이플아토,친환경 핸드메이드 제품들을 직접 만들어보자 !,2022으뜸두레 2023으뜸두레 관광두레 관광두레_주민사업체 관광지       
서곡정사석조약사여래입상,광배와 대좌를 갖추고 약그릇을 들고 서있는 모습의 약사불,관광지 불교 불교사찰 사찰탐방 역사공부 역사문화재 역사속 역사속으로     
어슬티굿밤,자유롭고 여유롭게,2023으뜸두레 관광두레 관광두레_주민사업체 관광지 문화체험 숙박시설      
남도상회,광양을 담은 기념품 가게,관광두레 관광지 기념품가게 소품샵 쇼핑 이색체험 친구와함께
순솝,"순천을 닮은, 순천을 담은 관광두레 지역사업체",관광두레 관광두레_주민사업체 순솝 순천여행 연인과함께 이색체험    
농업회사법인 ㈜ 가을농원,귀농한 농민 부부가 운영하는 농장,가족과함께 관광두레 관광지 식도락여행 아이와함께 추억쌓기 충청_관광두레
율곡로,아픈 역사를 간직한 고풍스러운 돌담 가로수길,가로수길 관광지 돌담길 산책코스 산책하기좋은곳 수도권 역사 역사이야기       
마린데크(커피마린협동조합),해안 드라이브를 즐길 수 있는 해안절벽 위 카페,가족과함께 관광두레 관광지 맛집 문화활동 식도락여행 여름휴가     
관악산,서울 시민들이 즐겨 찾는 휴식공간,관광지 관악산 관악산등산코스 관악산자연공원 관악산코스 등산 서울근교등산           
이호테우해변,제주의 조랑말을 형상화한 등대가 매력적인 명소,2024_여행가는달과함께하는_발도장여행지 가족여행 관광지 등대 바다풍경           
구미 선산향교,공자와 훌륭한 성현을 기리고 전통을 이어가는 조선시대 국립교육기관,가족여행 경상권 관광지 아이와함께 역사 역사관광지 역사속으로   
순천브루어리,순천의 특별한 이색 수제 맥주를 즐길 수 있는 곳,2022으뜸두레 2023으뜸두레 가볼래터 관광두레 관광두레_주민사업체         
만세장터 봉사회,우리의 농특산물로 나누는 온정,관광두레 관광두레_주민사업체 관광지 농산물 문화체험 문화활동 쇼핑    
신석구 사택 터,항일운동에 앞장선 민족대표의 집터,관광지 수도권 신석구사택터 역사 역사관광지 역사를품은곳 역사문화재        
김성래 가옥,삶과 지혜가 녹아있는 한국의 가옥,관광지 역사공부 역사관광지 역사를품은곳 역사문화재 역사속 역사속으로      
해남윤씨 녹우당 일원,해남 윤씨의 종가와 그 주변의 자연환경과 건축물,가족여행 관광지 교과서속여행 녹우당 녹우당일원 아이와함께 역사                   
바늘꽃피우다,나만의 특별한 자수를 체험해보고 싶다면 !,가족과함께 관광두레 관광지 문화활동 업사이클링 체험관광지 체험프로그램  
개화예술공원,보령 성주산 골짜기에 조성된 종합 허브예술단지,2024_여행가는달과함께하는_발도장여행지 SNS속핫플레이스 가족여행                    
마을여행사 청보리,청양을 더욱 깊이 즐기는 오감만족 여행,걷기길 관광두레 관광두레_주민사업체 관광지 농촌체험 레저체험 문화체험     
여민루,조선시대 아산군 관아 입구에 세웠던 문루건물,관광지 여민루 역사 역사공부 역사관광지 역사를품은곳 역사문화재        
동구리호수공원,만개한 벚꽃 속에서 여유롭게 산책하기 좋은 공원,관광지 산책하기 산책하기좋은곳 아이와함께 자연좋은곳 자연환경 휴식공간    
삼척 가시오가피마을,깨끗한 자연과 전통 먹거리가 가득한 마을,가족과함께 관광지 자연마을 자연속으로 자연여행 자연좋은곳 자연환경      
점봉산,한반도의 대표적인 원시림을 볼 수 있는 숲,강원권 관광지 등산 산 월간_사진_제보_이벤트 자연 점봉산
해담마을,첩첩산중에 해를 담고 있는 마을,관광지 남녀노소 아이와함께 여름방학가볼한곳 이색체험 익스트림스포츠        
삽교호놀이동산,레트로 분위기가 물씬 풍기는 추억의 놀이동산,SNS감성사진 감성사진 관광지 남녀노소 놀이공원 데이트명소 반려동물        
옥천성당,충청북도의 유일한 성당 건축물,관광지 역사공부 역사관광지 역사를품은곳 역사문화재 역사속 역사속으로      
금강휴게소,천혜의 자연환경과 첨단 건축기술이 조화된 금강휴게소,가족과함께 경치여행 경치좋은곳 관광지 금강 금강휴게소 휴식공간    
만양정육점,드라마 ‘괴물’ 촬영지,관광지 남녀노소 드라마촬영장 드라마촬영지 사진찍기 사진찍기좋은곳    
스페이스 선,사람과 자연의 조화,가족과함께 관광지 남녀노소 이색체험 자연여행 자연환경 체험프로그램   
국립 방장산자연휴양림,지친 마음을 달래주는 휴식처,관광지 등산 자연 자연속으로 자연여행 자연좋은곳 자연풍경 자연환경      
운심사(군산),구름이 깊은 곳이라는 뜻의 자성불선원,관광지 군산여행 불교문화 불교사찰 사찰 사찰여행 역사 역사이야기         
탑골마을,"평창의 녹색관광마을, 탑골마을",관광지 녹색관광마을 농촌체험 생태마을 자연과함께 자연관광지 평창가볼만한곳  
화천 목재문화체험장,목재 산업의 지식과 체험 정보의 모든 것,가족과함께 공예체험 공예품 관광지 목공예 목공예공방 목재문화       
제월섬,꿈놀자학교의 야외 교육장,가족과함께 관광지 산책길 산책하기 산책하기좋은곳 아이와함께 자연속으로    
선광사,태백에 위치한 아담한 사찰,강원 강원여행 관광지 사찰 선광사 역사 역사여행 절 태백 태백사찰  
비인 선도리 쌍도해안,슬픈 전설을 가진 섬이 있는 해안,갯벌체험 관광지 비인해수욕장 선도리갯벌체험장 쌍도해안 자연
서울웨이브아트센터,서울에 새로운 물결을 일으키다,문화시설 서울 아트센터 컨벤션센터 한강
진주 내촌호수마을,청정한 자연환경이 갖추어진 체험마을,걷기길 경상권 관광지 내촌마을 내촌호수마을 자연 자연마을 자연속으로            
필름로그 현상소,필름 카메라로 아날로그 감성에 푹 빠져 보자 !,감성사진 사진여행 사진찍기 사진찍기좋은곳 사진촬영 쇼핑 아날로그   
오체향마을,다섯 가지 체험의 향이 살아있는 마을,경상권 관광지 농촌체험 농촌체험마을 농촌체험여행 농촌체험학습 아이와함께          
문학산역사관,"미추홀 2,000여 년의 역사와 문화를 품고 있는 문학산",관광지
성판악,삼림으로 덮여있는 한라산 백록담 오름,관광지 성판악탐방로 오름 자연 자연관광지 제주가볼만한곳 한라산 
복주머니마을,오감만족 즐기는 여행,관광지
강당골계곡,외암민속마을 뒤편의 아름다운 계곡,강당골 경치좋은곳 계곡 관광지 광덕산계곡 등산 등산로 아산강당골            
하광정항,가족과 휴식하기 좋은 양양 항구,관광지
성남시 식물원,양묘장과 용도 폐기된 배수지를 재활용하여 조성된 곳,관광지 목공체험 산림체험 식물원 은행식물원 자연 자연학습 체험학습
계양산성박물관,계양의 유구한 역사와 문화를 알리는 공간,문화시설
연북정,제주의 아름다운 바다 경치를 한눈에 담는 곳,관광지 역사 역사공부 역사관광지 역사를품은곳 역사문화재 역사속           
멍딩이마을,아름답고 살기 좋은 고장,가족과함께 가족체험 공예 공예체험 관광지 농촌마을 농촌여행 아이와함께        
서부 오미(味)가미(味)거리,맛있는 음식과 다양한 체험을 즐기는 곳,가족과함께 가족여행 경상권 관광지 맛집여행 서부시장프랜차이즈특화거리      
국립제천치유의숲,삶의 질을 높이는 휴양지,관광지 산책하기좋은곳 우수웰니스관광지 자연치유 제천 체험학습 치유숲길  
천안홍대용과학관,우주의 천문학과 함께 상상력과 창의력 키우기!,과학 관광지 다양한 상상력 우주 우주여행 창의력 천문학 천안시    
고창오거리당산,고창읍 동·서·남·북·중앙의 5방위 당산,고창여행 관광지 국가민속문화재 문화재 역사 역사관광지 역사를품은곳       
함백산,고산수목인 주목과 야생화들이 군락을 이루는 산,강원권 경치여행 경치좋은곳 관광지 등산 새해맞이 자연 자연속으로   
하의도,물 위에 연꽃이 떠 있는 모습을 띠는 섬,관광지 섬 신안 신안하의도 자연 하의도
휴파크 광산점,바쁜 생활 도심 속 소박한 힐링을 만끽하는 친환경 오토 캠핑장,2024_여행가는달과함께하는_발도장여행지 광산구휴파크 광주오토캠핑장      
깃대봉,홍도의 최고 봉우리이자 우리나라 100대 명산 중 하나,관광지 자연
금호강 오토캠핑장,금호강을 배경으로 휴식하는 여행,레포츠
엘리바덴 월성점,건강한 삶을 추구하는 도심 속 휴양지,관광지
개심사 (서산),속세의 시름을 잊게 하는 아름다운 자연 속 고즈넉한 사찰,2024_여행가는달과함께하는_발도장여행지 가족여행 개심사 관광지 불교                
화순향교,조선 시대 지방 교육 기간 화순향교,관광지 역사 역사공부 역사관광지 역사를품은곳 역사문화재 역사속       
수승대오토캠핑장,빼어난 절경에서 즐기는 캠핑,거창군 거창캠핑장 레포츠 오토캠핑장 캠핑장
반고개 무침회 골목,톡 쏘는 매운맛과 새콤달콤한 무침회를 맛볼 수 있는 곳,골목식당 관광지 대구무침회맛집 맛집탐방 먹자골목 먹자골목 먹자골목     
모둘자리 힐링체험마을,자연 속에서의 멋진 휴식시간을 보낼 수 있는 곳,가족과함께 관광지 산업관광 산업관광지 전통한옥 체험 휴가지추천 
가평 레일바이크,추억과 낭만을 싣고 달릴 레일바이크,가평여행 경치여행 경치좋은곳 레일바이크 레포츠 사진찍기 사진찍기좋은곳    
성흥사 계곡,조계종 성흥사 옆에 있는 계곡,경상권 계곡여행 관광지 여름여행 자연 자연유원지 진해관광 창원계곡   
전북특별자치도 119안전체험관,각종 재난 상황을 체험하는 교육 현장,119안전체험관 관광지 교육공간 교육관광 교육여행 교육프로그램 아이와함께     
칠곡양떼목장,사람과 동물 모두의 행복을 추구하는 목장,관광지 아이와함께 이색체험 자연여행 자연좋은곳 자연체험 자연환경   
환봉서원,중국에서 귀화한 천만리 장군을 기리는 서원,관광지 남원여행 서원 역사 역사공부 역사관광지 역사를품은곳 역사문화재          
코리아플라워파크,대한민국의 화훼 화훼랜드마크를 추구합니다.,가족과함께 관광지 꽃구경 꽃여행 봄꽃여행 봄꽃여행지 봄꽃축제  
괴산 보안사 석조약사여래좌상,보안사 대웅전에 모시고 있는 석조여래좌상,관광지 역사 역사공부 역사관광지 역사를품은곳 역사문화재 역사속       
송정 자연휴양림,기반산 아래 자리한 아름다운 자연 휴양림,가족과함께 경상권 관광지 생태체험 숲체험 아이와함께 자연 자연속으로        
대관령 눈꽃마을,"365일 내내, 오감이 즐거운 산속 체험마을",강원권 경치좋은곳 관광지 농촌체험 이색체험 자연마을 자연좋은곳      
국제 롤러스케이트장,신나는 음악과 함께 즐기는 스케이트,레포츠 롤러스케이트 실내데이트 아이와함께 친구와함께
죽림암(임실),용요산 밑 언제나 푸르른 대나무 숲을 닮은 암자,관광지 불교 불교문화 사찰 사찰여행 역사 자연속으로 자연환경       
사탕수수 족욕카페,지친 일상의 피로를 푸는 힐링공간,감성사진 감성카페 사진찍기좋은곳 연인과함께 예쁜카페 음식 음식점       
충절사·상의재,단종의 충절지사 엄흥도를 기리는 사당(충절사)과 서원(상의재),관광지 엄흥도 역사 역사공부 역사관광지 역사를품은곳 역사문화재       
탑정호 수변생태공원,싱그러운 자연을 만끽할 수 있는 공원,경치여행 경치좋은곳 관광지 산책하기 산책하기좋은곳 아이와함께 자연관광지      
원풍리 마애불병좌상,암석에 나란히 조각된 두 불상,관광지 역사 역사공부 역사관광지 역사를품은곳 역사문화재 역사속      
호남호국기념관,호국영웅들과 역사를 기억하는 곳,기념관 문화시설 순천 호국기념관
경주 남산 미륵곡 석조여래좌상,보리사터에 남은 가장 잘 보존된 신라 석불,관광지 역사 역사공부 역사관광지 역사를품은곳 역사문화재 역사속       
향수호수길,대청호반의 절경을 따라 걷는 생태문화 탐방로,경치여행 경치좋은곳 레포츠 산책하기좋은곳 수변산책로 자연관광지      
착량묘,충무공 이순신 장군을 모시는 최초의 사당,경상남도기념물 관광지 미륵도 민간사당 역사 역사공부 역사관광지                
달빛고운병곡캠핑장,다양한 체험과 캠핑을 함께 즐길 수 있는 곳,거창군 경상남도 레포츠 캠핑장
소이산 생태숲 녹색길,때 묻지 않은 자연 속 생태숲 녹색길,가족체험 강원권 관광지 소이산 소이산생태숲녹색길 숲 영월 자연 
라베니체 마치에비뉴,도시의 불빛이 낭만을 만드는 거리,경치좋은곳 관광지 남녀노소 데이트명소 산책하기 쇼핑거리 야경맛집     
하늘공원 메타세쿼이아 숲길,사계절 낭만이 가득한 숲길,경치여행 경치좋은곳 관광지 레포츠 산책길 산책하기 산책하기좋은곳       
예끼마을,선비처럼 멋스럽고 느긋함이 느껴지는 마을,관광지 교육여행 산책하기좋은곳 아이와함께 안동가볼만한곳 안동여행        
괴산 율지리 미선나무 자생지,우리나라에만 자생하는 미선나무가 모여 자라고 있는 곳,관광지 괴산여행 괴산율지리미선나무자생지 미선나무 자생지 자연 자연속으로     
무주향교,전통체험이 있는 향교,관광지 무주여행 역사 역사공부 역사관광지 역사를품은곳 역사문화재          
구녀산,구녀 전설이 내려오는 가볍게 등산하기 좋은 산,관광지 등산명소 등산하기좋은곳 자연 자연관광지 청주 풍경맛집
화수관광농원,천연잔디 축구장이 있는 단체 가족모임하기 좋은 곳,관광농원 관광지 농촌마을 농촌여행 농촌체험 농촌체험학습 산업관광              
제이큐브미술관,차 한 잔과 그림 감상의 여유가 있는 공간,강원권 문화시설 미술관 영월 영월당일코스 제이큐브미술관
거창국민여가캠핑장,자연 속의 특별한 휴식처 미리내 숲,거창군 경상남도 레포츠 미리내숲 캠핑장
수운정(단양),물과 구름이 어우러진 정자,관광지 역사 역사공부 역사관광지 역사를품은곳 역사문화재 역사속       
배내골장선휴마을,영취산 자락에 자리 잡고 있는 마을,관광지 농촌체험 농촌체험마을 농촌체험학습 아이와함께 체험 팜스테이마을     
의성 왜가리생태마을,국내 왜가리와 백로 최대 서식지,관광지
남평문씨본리세거지,인흥마을이라 불리는 고려 문익점의 마을,관광지 역사 역사공부 역사관광지 역사를품은곳 역사문화재 역사속     
관음산,울창한 숲속에서 호젓한 산행을 즐기기에 좋은 곳,관광지 관음산 등산 등산객 수도권 자연 자연좋은곳 자연환경 트레킹    
초도항,고성 최북단에 위치한 초도항,경치여행 경치좋은곳 고성여행 관광지 바다경치 바다내음 자연 자연속으로   
서천 치유의 숲,"꿈꾸는 숲, 치유하는 숲, 함께하는 숲",2024_여행가는달과함께하는_발도장여행지 관광지 반려동물 반려동물동반여행지 
칠갑산 오토캠핑장,아이들과 방문하기 좋은 캠핑장,레포츠 청양 청양1박2일 청양숙박 청양칠갑산 청양칠갑산오토캠핑장  
