place,info,태그
천호자전거거리,자전거 라이더들을 위한 거리,관광지 자전거거리 천호동자전거 천호동자전거거리 천호자전거거리
숭인시장,노포감성이 가득한 시장,미아사거리시장 미아숭인시장 쇼핑 숭인시장 시장떡볶이
외도유람선 외도랑 / 와현유람선터미널,거제의 대표 관광코스,거제바다여행 관광지 바다의금강산 와현유람선터미널 와현해수욕장 외도관광   
흰작살해변,흰색 자갈의 해변,관광지 통영가볼만한곳 통영관광명소 통영섬여행 통영여행 통영여행추천  
보문산 전망대,낭만이 가득한 대전 도심 속 야경 명소,관광지 대전데이트코스 대전산책 대전여행 대전전망대 대전힐링여행
우이시장,사람과 사람사이 오고가는 정이 가득한 재래시장,쇼핑 수유동우이시장 수유동재래시장 우이시장 우이시장곰보냉면
대전목재문화체험장,"목재에 대한 교육, 놀이의 장",관광지 대전가족여행 대전목재문화체험장 대전산책 대전여행 대전유아여행  
봉명동 우산거리,알록달록한 우산으로 가득 찬 대전의 명소,2024_여행가는달과함께하는_발도장여행지 관광지 대전봉명동 대전우산거리  
노원천문우주과학관,우주와 과학에 특화된 과학관,과학관 과학체험 노원우주학교 노원천문우주과학관 문화시설 서울시민천문       
내장산골프앤리조트,"나무, 바위, 호수 자연을 담은 골프장",1박2일골프 1박2일골프여행 가을의내장산cc 골프투어 내장산cc 내장산골프앤리조트  
상관리조트&스파,"아름다운 소중한 추억, 휴식과 치유를 위한 상관리조트&스파",관광지 상관리조트부페 상관리조트스파 상관리조트앤스파 상관리조트조식    
노룬산골목시장,1970년대에 개설된 광진구에서 가장 역사 깊은 전통시장,건대입구가볼만한곳 노룬산골목시장 노룬산시장 쇼핑 자양동시장 재래시장 
플로팅아일랜드,세빛섬의 랜드마크,문화시설 새빛섬결혼식장 선상웨딩 세빛섬 세빛섬플로팅아일랜드 프라이빗모임     
더서울라이티움,민간 최대 규모의 복합문화 전시공간,대관시설 더서울라이티움 문화시설 복합문화전시관 서울숲갤러리 서울숲데이트코스    
오류,,
법안정사,한불 수교 100주년을 기념하여 지어진 사찰,관광지 불교 산책 석가탄신일 절 종교
양천해누리체육공원,양천구민의 건강한 생활체육활동을 위한 공간,관광지 농구장 야외체육시설 양천체육공원 인조잔디축구장 족구장 체육공원  
성북동성당,아름다운 외관을 하고 있는 성당,관광지 서울성북동성당 성당 성북동가볼만한곳 성북동나들이 성북동산책   
빅토리스포츠아카데미,올바른 인성과 가치관을 키워주는 스포츠 학원,농구교실 레포츠 빅토리스포츠아카데미 스포츠아카데미 야구교실 운동전문학원  
스위트파크 롯데 어린이 식품체험관,"롯데 식품을 테마로 구성한 마을과 자일리톨 치아 건강 교육 등
상상력을 자극하는 Edutainment 공간",가볼래터 과자박물관 롯데식품체험관 롯데어린이식품체험관 롯데제과과자박물관         
여의도공원 문화의마당,여가와 휴식을 즐길 수 있는 문화공간,가을단풍길 관광지 문화의마당 여의공원로 여의도공원 여의도공원문화의마당    
민주화운동기념관,아픔을 기억하며 희망으로 미래를 열어가는 기념관,김근태의원고문장소 남영동대공분실 문화시설 민주역사현장 민주인권기념관    
거북시장,"먹거리, 볼거리, 즐길거리가 가득한 거북시장",거북시장 건어물 도너츠 먹거리 쇼핑 야채
건평항,한적한 바다에서 아름다운 일몰을 감상할 수 있는 곳,강화나들길4코스 강화차박장소 강화차박캠핑 강화차크닉 강화힐링장소  
티라시아리조트,드넒게 펼쳐진 바다가 한눈에 보이며 웅장한 일몰을 바다와 함께 감상할 수 있는 탁월한 곳,강화도리조트 강화도바다전망펜션 관광지 숙박 티라시아리조트
교동읍성,강화군 교동도 화개산 남쪽 아래에 있는 조선시대 읍성,강화가볼만한곳 강화교동읍성 강화유적지 강화읍성 관광지 교동유적지     
망월돈대 및 장성,오랜 역사를 느낄 수 있는 조선시대의 돈대,강화가볼만한곳 강화유적지 고려장성 관광지 망월돈대 망월돈대및장성   
세계춘화박물관,성인들만 갈 수 있는 이색적인 박물관,강화성박물관 건강한성문화 국내춘화 문화시설 세계춘화 세계춘화박물관 
분성산생태숲생태체험관,자연 속에서 힐링하는 시간,가족여행가볼만한곳 관광지 김해가볼만한곳 김해여행 분성산생태숲 생태체험관  
노을공원(인천),아름다운 경치를 바라보며 휴식할 수 있는 공간,관광지 노을공원 인천피크닉장소 청라노을공원 청라스케이트장 청라스케이트프라자   
연지공원,김해의 역사 유적을 살펴보다 잠시 들러 휴식 취하기 좋은 곳,가족공원 관광지 김해가볼만한곳 김해여행 김해연지공원 분수공원 산책하기좋은곳   
서곶근린공원,인천 서구 주민들의 든든한 건강지킴이 서곶근린공원,공원눈썰매장 공원장미원 공원장미축제 관광지 서곶공원 서곶근린공원 
장유율하카페거리,감각적인 인테리어로 꾸며놓은 카페들과 이색적인 맛집들이 어우러지다,관광지 김해가볼만한곳 김해여행 김해카페 김해카페거리 김해핫플레이스  
광주비엔날레전시관,볼거리 즐길거리가 많은 다양한 전시회를 구경할 수 있는 공간,광주문화예술 광주북구 광주비엔날레 광주비엔날레전시관 문화시설 역사공원 
석남체육공원,도심 속 건강한 삶을 위한 체육시설,관광지 석남동체육공원 석남체육공원 인천서구체육공원
일자산 허브천문공원,큰 우주를 그리고 있는 공원,강동구가볼만한곳 강동구공원 강동구산책공원 강동구천문공원 견우직녀별자리         
마도농산물재래시장,신선한 식재료와 다양한 물품을 볼 수 있는 시장,5일장 김장재료 마도농산물재래시장 마도재래시장 쇼핑 전통시장 화성재래시장
워커힐숲길,"벚꽃길, 단풍길 그저 아름다운 곳",가을단풍길 광진구둘레길 광진구산책로 단풍명소 드라이브하기좋은곳      
문화공원,연수구 주민들을 위한 휴식처,공원스케이트장 관광지 문화공원 야외공연장 연수3호공원 연수구공원  
거리공원,자연과 여가를 동시에 즐길 수 있는 공원,거리공원 관광지 구로거리공원 근린공원 신도림거리공원
은평역사한옥박물관,"은평의 역사와 문화, 한옥의 미래가 머무르는 공간",문화시설 박물관 아이와함께가볼만한곳 유물전시관 은평구역사 은평구한옥   
가회동성당,한국 천주교회의 첫 미사가 봉헌된 곳,가회동성당 관광지 북촌 북촌관광 선교사 성당 성지 성지순례 천주교성지순례
박노수미술관,박노수 화백 예술품의 보고,문화시설 미술관데이트 박노수 박노수미술관 서촌가볼만한곳 세종마을 
복순도가,손으로 직접 빚은 순수 생막걸리,관광지 막걸리 산업관광 산업관광지 술여행 울주가볼만한곳 전통주
선바위(선암),기암괴석의 비경을 벗 삼는 선바위,관광지 서울시문화재 서울시민속문화재 선바위 선암 인왕산 인왕산선바위  
수성동계곡,아름다운 풍경을 간직한 계곡,관광지 수성곡계곡
삼각어린이공원,놀이 행성으로 모험을 떠나자!,관광지 삼각어린이공원 서울공원 서울어린이공원 아이와함께 어린이공원
해돋이공원,화사한 장미를 만나볼 수 있는 공원,관광지 송도가볼만한곳 송도과학놀이공간 송도근린공원 송도피크닉장소       
양오낚시터,초보자도 물고기를 쉽게 잡을 수 있는 곳,가족여행 강화도 레포츠 인천 저수지
외포항젓갈수산시장,김장철만 되면 붐비는 젓갈의 명소,강화도새우젓축제 강화도수산물시장 강화젓갈시장 쇼핑 수산물시장 외포항   
배미꾸미조각공원,모도의 배미꾸미 해변에서 즐기는 예술,DMZ DMZ여행 관광지 배미꾸미조각공원 시간촬영지 이일호조각가  
영흥바다낚시터,바다낚시 시설로는 국내에서 가장 큰 규모를 가진 곳,TV출연낚시터 동상이몽낚시터 레포츠 영흥도낚시터 영흥바다낚시터 
황산초지바다낚시터,강화도 최대 규모 낚시터,강화도낚시터 강화도유료낚시터 레포츠 실내낚시 야외낚시 황산초지바다낚시터
계산시장,편하게 쇼핑하기 좋은 곳,계산시장 계양구먹거리 계양구전통시장 쇼핑 인천전통시장
강화오상리고인돌군,강화군에 있는 청동시대 지석묘,강화고인돌 강화오상리고인돌군 고인돌 관광지 오상리고인돌 인천시기념물 
리얼월드 성수,스토리 속 주인공이 되어보는 이색 체험 공간,2023_설날_핫플 가볼래터 관광지 성수동가볼만한곳 성수동데이트 성수동핫플레이스  
백운산전망대,인천의 황홀한 야경을 볼 수 있는 곳,관광지 낙조명소 백운산 백운산전망대 서해낙조명소 영종도전망대 인천일몰명소  
경인아라뱃길귤현나루,서해와 한강을 잇는 김포의 자연친화적 휴식공간,경인아라뱃길 경인아라뱃길 귤현나루 관광지 귤현나루 아라뱃길 전망대    
작전시장,먹거리들이 가득해 맛집 기행으로 이름난 골목형 시장,계양구전통시장 골목시장 쇼핑 작전시장 전통시장
효성공원,계양구민들의 건강을 책임지는 체육시설 및 공원,계양구농구장 계양구인조잔디축구장 계양구축구장 관광지 효성공원 효성공원인조잔디축구장 
간석자유시장,다양한 먹거리를 저렴하게 구매할 수 있는 시장,간석동전통시장 간석자유시장 간석자유시장닭강정 쇼핑 인천재래시장  
남촌농산물도매시장,인천 남동구 남촌동에 위치한 남촌 농산물 도매시장,남촌농산물도매시장 대형시장 쇼핑 인천농산물도매시장 인천도매시장
만수시장,옛날 전통시장 분위기를 간직한 곳,남동구재래시장 남동구전통시장 만수시장 쇼핑 재래시장 전통시장
석바위시장,먹거리투어 장소로 유명한 시장,미추홀구만두 미추홀구먹거리 미추홀구토스트 석바위시장 석바위시장토스트     
소래포구해오름광장,이색적인 전망대가 있는 공원,관광지 새우타워전망대 소래포구 소래포구 수변광장 소래포구 해오름광장          
소래포구재래어시장,싱싱한 해산물과 각종 젓갈을 구입할 수 있는 시장,남동구수산시장 남동구어시장 소래어시장 소래재래어시장 소래포구 소래포구 재래어시장  
세계평화의숲,"산림청, 인천국제공항공사 및 기업들과 시민들의 기금으로 조성된 공간",관광지 생태체험학습 세계평화의숲 숲체험 아이와함께가볼만한곳 영종도자연생태공원   
용남시장,인천 미추홀구 용현동에 위치한 전통시장,미추홀구대하구이 미추홀구전통시장 쇼핑 용남시장 재래시장 전통시장
문학산,자연 그대로를 간직한 미추홀의 진산,관광지 문학산 문학산 역사관 인천문학산 인천산
미추홀공원,미추홀 왕국의 역사적 상징성을 구현한 대형 테마 근린공원,관광지 미추홀공원 송도근린공원 송도산책로 송도수변공원
연수체육공원,운동하기에 좋은 체육공원,X-Game장 관광지 연수구X게임장 연수구농구장 연수구배드민턴장 연수구인라인스케이트장 
골프존카운티선운,평화로움과 아름다움에 중점을 둔 코스,1박2일골프여행 고창여행 골프존카운티선운CC 도심속골프장 레포츠   
골프존카운티 드래곤,유려하지만 강인한 매력이 돋보이는 골프장,1박2일골프여행 남원골프 남원골프장 레포츠 전라도골프장
지리산가는길,아름다운 길 100선에 선정된 드라이브 코스,경상남도여행 곡성등심돈까스 곡성레스토랑 곡성맛집 곡성식당 곡성지리산가는길          
삼척항활어회센터,삼척 바다의 신선한 활어회를 맛볼 수 있는 곳,동해여행 삼척관광 삼척항 생선회 쇼핑 회센터
도원리계곡,물이 맑고 깨끗한 명소,고성계곡 고성관광 고성여행 관광지 여름계곡 여름피서지 월간_사진_제보_이벤트
오류,,
영월중앙시장,"메밀전병과 부꾸미, 배추전 등 먹거리가 가득한 시장",메밀전병 배추전 쇼핑 영월관광 영월맛집 월간_사진_제보_이벤트 재래시장
봉포항활어회센터,쇼핑의 장,고성여행 동해바다여행 동해여행 봉포항 쇼핑 회센터
용화사(원주),소원을 들어주는 원주 용화사,걷기여행 관광지 원주관광 치악산 치악산둘레길 치악산명소
농업인새벽시장,안전한 제철농산물을 소비자에게 제공하다,농산물시장 새벽시장 쇼핑 원주관광 원주여행 월간_사진_제보_이벤트 
치악산둘레길 1코스,자연 속 체험여행,걷기여행 레포츠 원주관광 월간_사진_제보_이벤트 치악산 치악산둘레길 
학리항(학리방파제),기장 해안가의 오래된 포구,관광지 기장바다여행 부산가볼만한곳 부산관광명소 부산여행추천 부산포구여행 
해광사,푸른 바닷가 앞의 사찰,관광지 기장군사찰 부산가볼만한곳 부산관광명소 부산사찰 부산여행추천 
로미지안 가든,완전한 자연에서 온전한 치유를 경험하다,가볼래터 가족과함께 관광지 여행구독 연인과함께 우수웰니스관광지         
오류동역 광장,역 앞에 펼쳐진 쉼터 공간,관광지 오류동광장 오류동역광장 오류동축제장소 오류동행사장소 오류역산책로
서운체육공원,편안한 휴식과 활발한 운동을 동시에 즐길 수 있는 공원,가족소풍장소 계양구꽃마루 계양체육공원 관광지 서운체육공원 아이와함께가볼만한곳 
이끼터널,푸르른 이끼벽이 환상적의 경치,관광지 단양가볼만한곳 단양여행 사진명소 이끼터널 충남권 충청남도_여행지_추천
육영재단 어린이회관,어린이가 행복한 세상을 만들기 위한 곳,관광지 광나루어린이회관 광진구어린이회관 근화원 복지회관 실내놀이터     
범바위,속초 영랑호에 있는 호랑이를 닮은 바위,가볼래터 관광지 속초관광 속초명소 속초여행 여행구독 영랑호 영랑호명소
10꼬르소꼬모 청담점,편집숍과 함께하는 카페,10꼬르소꼬모 10꼬르소꼬모청담점 강남브런치카페 쇼핑 음식 청담동카페  
해동성취사,아름다운 바다 경치와 어우러지는 사찰,관광지 바닷가사찰 부산가볼만한곳 부산관광명소 부산사찰 해동성취사
남창옹기종기시장,오랜 전통을 자랑하는 시장,각종먹거리 남창옹기종기시장 쇼핑 울산5일장 울산가볼만한곳 울산시장   
덕하시장,생동감과 역동감이 가득한 시장,각종먹거리 쇼핑 울산5일장 울산가볼만한곳 울산시장여행 울산여행  
HN원주어시장,싱싱한 횟감을 구매할 수 있는 원주 유일의 어시장,강원도여행 쇼핑 어시장 원주관광 원주여행 월간_사진_제보_이벤트 
여의도한강공원 멀티프라자,서울세계불꽃축제가 열리는 곳,관광지 서울불꽃축제장소 여의도멀티프라자 여의도한강공원 여의도한강공원멀티프라자      
대진항 수산시장,동해안 최북단 항구에 위치한 수산시장,고성여행 동해바다여행 동해여행 봉포항 쇼핑 월간_사진_제보_이벤트 
시골살이마을,청정 자연환경에서 경험하는 시골살이 체험,관광지 농촌체험 시골살이 옥천체험마을 자연과함께 체험마을
한신시장,부천의 상설 재래시장,부천맛집 부천시장 부천여행 부천재래시장 부천한신시장 소상공인시장공단  
옥정사,부산 달음산 기슭에 자리한 불국사의 말사,관광지 기장군사찰 부산가볼만한곳 부산관광명소 부산사찰 부산여행추천 
북부수자원생태공원,시민들의 건강을 위한 쉼터 공간으로 활용되고 있는 하수처리장의 변신,관광지 부천가볼만한 곳 부천관광지 부천북부수자원생태공원 부천생태공원 
팔음산마을,자연 속 즐거움을 찾을 수 있는 곳,관광지 아이와함께 자연과함께 자연속힐링 체험마을
대평지,맑은 계곡물이 모이는 저수지,계곡저수지 관광지 농업용수 매봉산 우두산 임진의병전적지 정응진장군
정관신도시시장,신도시 시장,기장군시장 부산가볼만한곳 부산먹거리 부산시장 쇼핑 정관신도시시장
승일교,한국전쟁으로 인해 시간차이를 두고 완성한 남북합작의 다리,관광지 국가등록문화재 문화유산 철원관광 철원명소
생산소,삶과 기억을 예술로 만드는 생산소,계절상품시리즈 계절상품시리즈(주식회사생산소) 관광두레 관광두레_주민사업체        
클래식문구사,어른들을 위한 빈티지 소품샵,감성소품 문구 문구점 소품 소품가게 쇼핑 제주도감성소품샵
이후북스 제주점,제주도에 있는 작고 조용한 동네 책방,독립서점 쇼핑 제주
숲속에 동물농장,동물과 함께 살아가는 법을 배우는 곳,관광지 동물농장 동물먹이주기 승마 아이와가기좋은 평창여행 포토존 
루지월드-대명비발디파크,속도감을 즐길수 있는 트랙 레포츠,레포츠 루지 스피드즐기기 아이와가기좋은 홍천여행
파로호전망대,그림 같은 파로호 전경을 눈에 담을 수 있는 곳,관광지 안보전시관 전망대 파로호 포토존 화천명소
강릉자동차극장,즐길거리와 낭만이 가득한 자동차극장,강릉가볼만한곳 강릉데이트 문화시설 영화관람 자동차극장 자동차영화관
샤이니숲길,사진 찍기 좋은 작은 숲길,관광지
월드온천24,드라마 겨울연가 촬영지,관광지 노천탕 물좋은 불가마 온천 찜질방 춘천갈만할곳 휴식
상가리야자숲,사계절 푸른 야자나무가 있는 이국적인 야자숲,가볼래터 관광지 반려동물 반려동물동반여행지 산림욕 야자수산책길         
왕피천하늘담야영장,아름다운 추억을 만들 수 있는 곳,가을단풍명소 경상북도캠핑장 레포츠 산촌마을축제 여름물놀이 울진군캠핑장
김택준가옥,조선 후기의 전형적인 주택양식을 볼 수 있는 곳,관광지 김택준가옥 양양 유적 유형문화재
장태산 자연휴양림 캠핑장,울창한 메타세콰이아 숲속에서 자연을 즐기다,가족과함께 대전시캠핑장 레포츠 메타세콰이어숲 서구캠핑장 연인과함께 
러빙유카라반캠핑장,감성 가득한 카라반 캠핑을 즐길 수 있는 곳,당진시캠핑장 레포츠 삽교호관광지 신리성지 왜목마을 충청남도캠핑장
이두형가옥,온돌 중심의 겹집과 마루가 있는 민가,관광지
강릉항회센터,신선한 회를 사서 바로 먹을 수 있는 곳,강릉수산물쇼핑 쇼핑 안목항 횟집 커피거리 횟집 활어회센터
양양 오색리 삼층석탑,신라 시대의 양식으로 만들어진 삼층석탑,강원 관광지 양양 양양여행지 양양여행지추천 역사관광지 오색리삼층석탑
묵호항수변공원,드넓게 펼쳐진 동해 바다를 한눈에 담다,관광지 동해관광 동해여행 묵호항관광 수변공원 해돋이명소
파스텔상점피크닉,"강릉 관광지, 해변에서 영화같은 인생샷을 찍어보자",감성피크닉 강릉_감성여행 쇼핑 피크닉세트_대여
봉래산(영월),영월의 북동쪽에 우뚝 솟아있는 산,관광지 등산코스 영월가볼만한곳 월간_사진_제보_이벤트 자연관광지 
도째비골 해랑전망대,광활한 바다 위를 걷는 듯한 이색 체험,23_24한국관광100선 25_26한국관광100선 강원권 관광지 동해관광      
만봉불화박물관,한국불교문화의 우수성을 알리는 곳,문화시설
정동진조각공원,푸른 바다와 조각상이 어우러진 일출 명소,관광지 정동진공원 정동진관광 정동진명소 정동진포토존 정동진풍경
대관령아기동물농장,동물들과 함께 행복한 시간을 보낼 수 있는 동물농장,강릉가족여행 강릉동물원 관광지 당나귀타기 대관령아기동물농장 동물과의교감     
명주예술마당,"시민의 문화예술활동 및 교육, 공연, 창작, 전시, 연습 및 교류 공간",강릉문화 강릉문화제단 관광지 연습실대여 예술마당 예술체험
순포습지,자연생태를 관찰할 수 있는 습지,강릉 관광지 생태여행 석호 조류탐방 철새도래지
방파제회센터,비슷한 규모의 28개 횟집이 모여있는 곳,강릉관광 생선회 쇼핑 주문진관광 회맛집 회센터
천년학 힐링타운,두루미를 볼 수 있는 자연생태공원,관광지 놀이공원 동물생태공원 두루미생태공원 식물생태공원 어류생태공원  
휘바핀란드,울타리 없는 방목형 양떼목장,관광지 양떼목장 홍천관광 홍천양떼목장 홍천여행 홍천펜션
태기산 전망대,이색적인 풍경을 만끽할 수 있는 곳,관광지 눈꽃절경 등산로 전망좋은곳 포토존 횡성가볼만한곳
묵호항 활·선어판매센터,신선한 수산물이 모이는 곳,동해관광 동해바다여행 동해여행 묵호항 쇼핑 회센터
춘천중도 물레길,이벤트를 하기 좋은 카누 전문 레저시설,강원권반려동물여행지 레포츠 반려동물 반려동물동반여행지 서바이벌카누      
강촌테마랜드,최신 장비와 자연형 교장을 갖춘 레포츠 전문 시설,강촌여행 글램핑 래프팅 레포츠 사륜바이크 서바이벌게임 춘천여행 
건봉령승호대,은하수가 펼쳐지는 명소,관광지 소양호명소 춘천공원 춘천명소 춘천여행 춘천출사
현지사,평화로운 마음을 얻을 수 있는 곳,관광지 명상하기좋은 사찰 연등구경 이색풍경 춘천여행
골든몽키,홍천강 상류에서 즐기는 복합레저시설,가평물놀이 레포츠 수상레저 워터파크 춘천가볼만한곳 춘천여행 홍천강
봉래산산림욕장,지친 심신을 달래기 좋은 에너지 충전 공간,관광지 봉래산 영월산림욕 영월자연휴양림 자연 자연휴양림 휴식공간    
개야리유원지,홍천군 노지캠핑과 차박 명소,강변 관광지 노지캠핑명소 유원지 캠핑 트레킹 홍천여행
인디고트리,오래된 귤 창고를 카페이자 편집샵으로 개조한 곳,감성사진 관광지 사진찍기좋은곳 서귀포 연인과함께 음식 이색공간       
대풍바위 오토캠핑장,바다 전망을 즐길 수 있는 곳,걷기길 경상남도캠핑장 낚시 레포츠 일몰명소 통영시캠핑장
고령 대가야 카라반,다양한 체험이 있는 캠핑장,경상북도캠핑장 고령군캠핑장 국궁체험 대구시근교 레포츠 승마체험 
구산오토캠핑장,사계절을 모두 즐길 수 있는 캠핑장,경상북도캠핑장 구산해수욕장 레포츠 소나무숲캠핑 여름물놀이 울진군캠핑장 
통영 동원리조트 글램핑,동원 로얄 리조트 내에 있는 글램핑장,가을단풍명소 걷기길 경상남도캠핑장 낚시 레포츠 봄꽃여행 수상레저     
달빛마을,대청호가 내려다보이는 한적한 산촌체험마을,관광지 농촌마을 산촌마을 옥천디지털관광주민증 옥천체험마을 주민증혜택여행지
통영캠핑스토리,조용한 분위기 속 일몰이 아름다운 캠핑장,걷기길 경상남도캠핑장 낚시 레포츠 봄꽃여행 일몰명소 일출명소 
햇다래마을,자연을 느끼고 호흡하는 오감만족마을,관광주민증 관광지 농촌체험 옥천가볼만한곳 옥천여행
욕지도파라다이스캠핑장,욕지도의 바다를 한 눈에,걷기길 경상남도캠핑장 낚시 레포츠 봄꽃여행 수상레저 여름물놀이   
솔바람캠핑장,물놀이 하기 좋은 계곡 인근 캠핑장,경상북도캠핑장 계곡물놀이 레포츠 물놀이장 어린이놀이터 청도군캠핑장
부귀농원가족캠프,전주 시내와 가까운 캠핑장,가족캠핑 넓은계곡 레포츠 불멍하기좋은 애견동반캠핑장 전북특별자치도캠핑장  
두리선착장,"퍼플섬의 입구, 작은 선착장",관광지 두리선착장 신안선착장 신안여행 안좌도 여객선 퍼플교 퍼플섬  
복호선착장,주변 섬들의 연결 통로가 되어주는 곳,관광지 복호선착장 신안섬여행 신안안좌도 신안여행 안좌도항구 여객선  
송공리선착장,섬 여행의 시작,관광지 기점도 섬여행 섬티아고순례여행 송공리선착장 신안여행 여객선  
