place,info,태그
방산 종합시장,종합인쇄와 포장산업 물품 전문시장,가족여행 나홀로여행 데이트코스 먹거리 방산시장 방산종합시장 쇼핑        
송당무끈모루,제주 삼나무 숲에 위치한 사진 명소,관광지 반려동물 비밀의숲 사진명소 삼나무숲 연인과함께 제주가볼만한곳 
천부해중전망대,우리나라 유일 수중 전망대,가볼래터 가족과함께 경치좋은곳 관광지 남녀노소 바다경치 바다내음       
갯골캠핑장,갯골생태공원내의 푸르른 캠핑장,가족여행 갯골캠핑장 레포츠 소래포구캠핑장 숲속캠핑장 시흥가볼만한곳 
서귀포칠십리시공원,외돌개와 해안올레길을 연결하는 공원,가족과함께 공원 관광지 산책하기좋은 서귀포가볼만한곳 서귀포공원  
울릉도,"아름다운 신비의 섬, 울릉도",2021_휴가철찾아가고싶은_33섬 2022찾아가고싶은섬 2022찾아가고싶은섬_여름섬                     
고흥 유자공원,유자향을 맡을 수 있는 재배 단지 인근 공원,가족과함께 경치좋은곳 고흥 고흥유자마을 관광지 산책하기좋은곳 자연좋은곳   
월명호수,물안개를 뿜어내는 산 속의 호수,가족여행 관광지 군산여행 군산호수 나들이 월명공원 호수
소래산산림욕장,숲 속 피톤치드를 느끼며 산책하기 좋은 곳,가볼만한곳 가족여행 관광지 나들이 데이트코스 드라이브여행 산림욕장              
은계호수공원,"산책, 피크닉 하기 좋은 호수공원",관광지 나들이 소래저수지 시흥시공원 운동 저수지공원 호수공원 
서울 문묘와 성균관,성현들의 제사를 지내는 사당이자 조선 최고의 교육기관,관광지 성균관 역사 역사공부 역사관광 역사관광지 역사를품은곳         
오아시스,퇴역경비함 해우리 12호를 리모델링하여 만든 문화예술 공간,가족 관광지 나들이 노을맛집 여행 오이도 오이도체험 전망대
무악산 동봉수대 터,적의 침입을 알리던 조선시대의 봉화터,관광지 역사 역사공부 역사관광지 역사를품은곳 역사문화재 역사속       
맑은물상상누리,산업유산을 재생한 창의적 문화복합공간,가족과함께 공간재생 관광지 교육여행 남녀노소 뉴트로_감성여행 복합문화공간      
월곶포구,"서해바다, 일몰이 아름다운 포구",경기권반려동물여행지 관광지 반려동물 반려동물동반여행지 시흥 시흥당일코스 
보현선원,부처님의 가르침을 배우고 실천하려는 불자들,관광지 광교산아래절 보현선원 수원 수원1박2일코스 수원사찰 수원절
수원 화성 [유네스코 세계유산],실용적인 구조로 되어 있는 동양 성곽의 백미,2024_여행가는달과함께하는_발도장여행지 2024한국관광의별 23_24한국관광100선                  
북수원시장,맛있고 다양한 먹거리를 저렴하게 구매할 수 있는 시장,북수원시장 쇼핑 수원 수원가볼만한곳 시장 시장전용주차장 전통시장
경주 깁 모어 막걸리,전통주가 왜 올드해? 경주의 맛을 힙하게 재해석한 로컬 대표 양조장,경주가볼만한곳 관광지 다양한막걸리 막걸리 양조장 양조체험 이색체험 
의항해수욕장,각양각색의 조약돌로 반짝이는 해수욕장,가족여행 관광지 바다낚시 바다풍경 아이와함께 자연 체험학습 태안가볼만한곳   
남해독일마을,여권 없이 떠나는 유럽 어딘가,19_20한국관광100선 19_20한국관광100선 2024_여행가는달과함께하는_발도장여행지                    
천리포항,조용한 풍경을 보며 즐기는 바다낚시,가족과함께 관광지 낚시 일몰맛집 천리포항 태안가볼만한곳 태안여행 
홍천 배바위카누마을,거대한 배를 연상시키는 배바위의 아름다운 경관을 타고,관광지 꿀잼_액티비티 체험
숭례문(남대문) 수입상가,수입품을 전문으로 하는 상가,남대문 쇼핑 수입잡화 음향기기 카메라
미약골,"깊은 계곡과 맑은 물이 어우러진, 자연 속 힐링 명소 미약골",관광지 생태탐방 자연 자연관광지 자연발생 자연생태 자연여행 자연좋은곳       
꾸지나무골해수욕장,아담한 백사장과 소나무숲이 어우러진 해수욕장,경치좋은곳 관광지 바다풍경 반려동물 반려동물동반여행지 여름여행      
홍천 은행나무숲,홍천의 가을을 대표하는 은행나무 단풍 명소,가을단풍여행 가을단풍축제 가을여행 가을여행의_정석 가을여행지 가을여행지추천                 
퇴계로 오토바이상가,충무로의 오토바이 행렬이 이어지는 곳,도매상가 서울오토바이판매점 쇼핑 액세서리 오토바이 오토바이가게    
프레젠트모먼트,동심으로 돌아가는 듯한 산타창고,가볼래터 망원동 빈티지 서울 소품샵 쇼핑 여행구독 인형 크리스마스
국립 삼봉자연휴양림,"산과 숲, 계곡이 어우러진 국립삼봉자연휴양림",강원권 관광지 숲해설사 자연 편백비누만들기 홍천휴양림 홍천힐링여행   
진해루해변공원,시원한 바닷바람 맞으며 즐기는 여행,경남관광 관광지 진해루 진해루공원 진해루해변공원 창원가볼만한곳   
꽃게다리,드르니항과 안면도 백사장항을 잇는 다리,경치좋은곳 관광지 꽃게다리해변길 남녀노소 대하랑꽃게랑 드르니항             
구두미포구,누알과 섬도 코지의 사이 바닷가 포구,관광지 구두미포구 섶섬 올레길6코스 제주가볼만한곳 제주낚시명소   
서울 평화시장,의류를 생산하고 판매하는 도소매 시장,가족여행 나들이 나홀로여행 데이트코스 도매상가 도심여행 동대문시장             
가령폭포,깊은 산 속에 숨어있는 웅장하고 시원한 폭포,관광지 백암산 자연 자연관광지 홍천5경 홍천계곡 홍천여행
함안수박전시관,수박 주산지인 경남 함안에서 경험하는 체험·교육의 장,경남권 경상남도_여행지_추천 문화시설 수박전시관 함안가볼만한곳 
대혜폭포,하늘의 선녀가 내려와 목욕을 즐긴다는 곳,경북여행 계곡폭포 관광지 구미명소 구미여행 금오산
무흘구곡전시관,김천 무흘구곡의 역사를 노래하는 곳,경북권 경상북도_여행지_추천 김천가볼만한곳 무흘구곡 문화시설 한강정구
솔개공원,제주도를 연상케하는 아름다운 해안공원,걷기좋은길 관광지 울산_여행지_추천 울산가볼만한곳 울산권 해안산책로
도봉사,비구니들만 거주하는 사찰,경북권 경상북도_여행지_추천 관광지 비구니사찰 사찰여행 칠곡가볼만한곳
속리산연꽃단지,단아한 매력이 가득한 물 위 연꽃의 자태를 감상할 수 있는 곳,관광지 보은관광 보은여행 속리산 수련 연꽃단지 충북여행
스카이라인 루지 통영,바다풍경을 보며 즐기는 짜릿한 액티비티,19_20한국관광100선 2024_여행가는달과함께하는_발도장여행지 꿀잼_액티비티           
휴일엔캠핑장,아름다운 계곡이 있는 휴일엔캠핑장,거창군 레포츠 캠핑 캠핑장
금남시장,맛과 정을 느낄 수 있는 시장,금남시장 금호동시장 김구시장 독서당로시장 쇼핑 재래시장 전통시장
송정공원,현지인들이 즐겨 걷는 숨은 산책 명소,걷기좋은길 관광지 울산_여행지_추천 울산가볼만한곳 울산권 해안산책로
방이시장,정겨운 미소와 넉넉한 인심이 가득한 전통시장,가족과함께 골목시장 남녀노소 서울여행 송파구 송파구맛집 쇼핑  
밀브릿지,방아다리 약수터 인근의 천혜 자연학습장,가볼래터 강원웰니스관광지 관광지 여행구독 웰니스관광 평창숙소 평창웰니스관광
보성 열화정,옷소매붉은끝동 촬영지,관광지 보성가볼만한곳 보성여행 보성역사여행 보성열화정 열화정 이진만 
신선계곡야영장,아이들과 물놀이 하기 좋은 캠핑장,경기도캠핑장 계곡물놀이 광주 광주시캠핑장 다슬기잡기 레포츠 산책로
소풍캠핑장,현대적인 시설에서 편하게 즐겨보는 캠핑,가을단풍명소 걷기길 겨울눈꽃명소 경기도캠핑장 레포츠 봄꽃여행 여름물놀이  
가평썬캠핑,일상속의 걱정을 내려놓고 한적한 여유를 즐길 수 있는 곳,가족캠핑 가평군캠핑장 경기도캠핑장 계곡물놀이 레포츠 서울시인근 
양지유황천,풍광이 아름다워 힐링하기 좋은 유황온천,가족여행 관광지 부모님과함께 서울근교나들이 서울근교온천 양지유황천  
애플마루 펜션캠핑장,맑은 공기와 청정한 자연 속에서 즐기는 휴식,계곡물놀이 단양군캠핑장 레포츠 사과농장 산책로 충청북도캠핑장
종학당,고즈넉한 풍경과 함께 여유를 느낄 수 있는 종학당,관광지 논산가볼만한곳 봄꽃여행지 충남권 충청남도_여행지_추천 파평윤씨
곰내연밭,끝없이 펼쳐진 연꽃이 반겨주는 곳,관광지 부산관광 생태공원 연꽃공원 이색공원
해운대수목원,풀이랑 꽃이랑 나무의 좋은 만남,2024_여행가는달과함께하는_발도장여행지 관광지 부산관광 생태공원  
삼밀사,신비로운 오백나한상을 만날 수 있는 사찰,관광지 불교사찰 사찰여행 삼밀사 장복산 진해관광 창원여행
별책부록,다양한 매력이 가득한 해방촌 독립서점,독립서점 문화시설 서울_여행지_추천 서울가볼만한곳 서울권 해방촌
스포츠 360 플레이,스포츠 기업들의 제품·시설들을 시연하고 홍보하는 공간,레포츠 서울가볼만한곳 서울여행 스포츠시설 올림픽공원 체험시설
구재봉활공장,아름다운 전경의 하늘을 날아볼 수 있는 공간,경남권 경상남도_여행지_추천 구재봉 레포츠 사진명소 패러글라이딩 
반야월연꽃단지,국내 최대 규모의 연꽃단지,관광지 대구관광 대구명소 대구산책 대구여행 연꽃단지
인천시민애집,인천 시민들을 위한 복합문화공간,2024_여행가는달과함께하는_발도장여행지 문화시설 문화전시 시장관사    
명락사,도심 속에서 만날 수 있는 사찰,관광지 관악구사찰 다문화사찰 대한불교천태종사찰 도심속사찰 명락사   
인천축산물백화점,다양한 종류의 육류를 즐길 수 있는 곳,서구축산물백화점 서구축산물시장 쇼핑 인천축산물백화점 인천축산물시장 
영남용바위,아름다운 전경을 한눈에 담을 수 있는 곳,고흥가볼만한곳 고흥가족여행 고흥바다여행 관광지 영남용바위 용바위  
옥종불소유황천,워터파크와 온천이 함께있는 곳,관광지 노천탕 불소유황천 하동가족나들이 하동수영장 하동온천 하동워터파크
감만시민부두,부산항대교의 야경을 볼 수 있는 항구,감만동 감만시민공원 관광지 부산가볼만한곳 부산낚시 부산차박 부산차박명소  
보람공원,자연 속에서 힐링할 수 있는 공원,관광지 벚꽃명소 보람공원 부산가볼만한곳 부산강서구 부산벚꽃 부산산책로 
윤동주시인의언덕,아름다운 서울의 밤 풍경을 즐기기 좋은 언덕,관광지 노을명소 문학여행 서울노을명소 서울일몰명소 서울조망명소      
명지동근린공원,도심 속에서 자연을 느낄 수 있는 공원,강서기적의도서관 관광지 명지동근린공원 부산가볼만한곳 부산강서구   
흰돌메공원,아름다운 숲속공원,관광지 뷰가좋은공원 산림공원 숲속공원 전망좋은곳 창원전망 출렁다리
오류,,
구암현대시장,1980년 개설된 상가건물형의 소형시장,쇼핑
내서농산물도매시장,"생산자와 판매자, 구매자 모두가 행복해지는 공간",내서버스터미널 농산물도매시장 쇼핑 시장여행 신선식재료 전통시장 
신비의 바닷길 동섬,"자연이 주는 즐거움, 생태체험이 가능한 섬",관광지 진해나들이 진해동섬 진해동섬물갈라짐 진해모세의기적 창원당일치기 
단양 단성벽화마을,골목길을 따라 알록달록 벽화가 펼쳐지는 아름다운 마을,감성사진 관광지 남녀노소 단양가볼만한곳 단양여행 사진찍기 사진찍기좋은곳   
거제 옥화마을,조용히 쉬다 갈 수 있는 한적하고 깨끗한 마을,감성사진 관광지 남녀노소 사진여행 사진찍기 사진찍기좋은곳 사진촬영명소    
진해유람선,힐링 가득한 유람선여행,경남여행 관광지 속천항 유람선관광 진해유람선 창원가볼만한곳 창원데이트명소 
해양생물테마파크,바닷속 다양한 생물을 만나는 공간,문화시설 진해해양공원생물테마파크 창원가족여행 창원교육프로그램 창원여행   
거제고현시장,거제 최대 전통시장,거제가볼만한곳 거제고현시장 거제시장맛집 거제전통시장 거제종합시장 
한산도유람선,제승당을 둘러보려는 관광객을 위한 유람선,경남여행 관광지 제승당 통영가볼만한곳 통영바다여행 통영유람선 한산도 
거제해양레포츠센터,해양 레포츠 즐기기,거제가족여행 거제관광 거제요트체험 거제윈드서핑 거제해양레포츠센터   
장사도대포크루즈,한려수도 섬과 바다 풍경의 아름다움,거제가볼만한곳 거제도유람선 거제바다여행 경남여행 관광지 별그대  
대촌마을,역사가 오래된 유서 깊은 마을,관광지 대촌광장 대촌마을 원부춘–가탄구간 지리산둘레길 최참판댁 
백혜마을,화개골과 섬진강을 한눈에 담을 수 있는 마을,레포츠 밤나무터널 백혜마을 백혜마을경노당 원부춘-가탄 구간 지리산둘레길 
상우마을,봄이면 산속 오솔길에서 매화 향이 진동하다,레포츠 밤밭촌 상우마을 지리산둘레길 지리산탐방 하동읍–서당 구간
서당마을,소박한 농촌 풍경,관광지 삼거리마을 서당마을 지리산둘레길 지리산탐방 하동읍–서당 구간
창원마을,지리산 둘레길에 위치한 산촌생태마을,관광지 석봉씨네카페 인월–금계구간 지리산둘레길 창원마을 함양가볼만한곳
엄천강 카누카약,스릴 넘치고 짜릿한 카누 카약,레포츠 엄청강 엄청강래프팅 지리산래프팅 지리산리조트 카누 카약 
인서울27 골프클럽,27개의 홀이 선사할 다양한 즐거움,27홀골프장 강서골프장 골프장 대중골프장 레포츠 서울골프장 인서울27골프클럽
입석마을,작은 선돌 미술관이 있는 마을,관광지 대축–원부춘 구간 마을미술관 선돌 입석마을 지리산둘레길 하동가볼만한곳
정금마을,아름다운 차밭과 함께 걷는 곳,관광지 녹차밭 양귀비밭 원부춘–가탄구간 정금마을 정금정 정금차밭  
동강또랑마을/동강마을,지리산 둘레길 동강–수철 구간에 있는 자연생태 우수마을,1박2일 MC몽 동강–수철구간 동강도랑마을 동강마을 레포츠 자연생태마을 
엄천강 래프팅,천혜의 자연경관과 풍부한 수량,레포츠 엄청강 엄청강래프팅 엄청강수달 지리산래프팅 지리산리조트  
에스팩토리,트렌디한 문화 허브 공간,문화시설 복합문화공간 복합예술공간 성수동나들이 성수동데이트 성수동복합문화공간   
장봉선착장,걷기 좋은 장봉도로 가는 길,DMZ DMZ여행 관광지 서해바다 옹진군선착장 장봉도 장봉도선착장 
무의바다누리길,소무의도 섬 전체를 둘러볼 수 있는 걷기 좋은 누리길,관광지 누리길 무의도도보코스 무의바다누리길 무의바다누리길1코스        
낙동강 생태탐방선,자연과 함께 떠나는 낙동강 에코투어,관광지 낙동강 부산_여행지_추천 부산가볼만한곳 부산권 생태관광  
다대포항,관광객으로 북적이는 항구,BTS bts여행 bts투어 관광지 다대포 다대포항 다대포해수욕장 몰운대전망대  
경호강휴게소ATV,경호강을 따라 달리는 ATV 레포츠,경호강래프팅 경호강휴게소ATV 레포츠 산악오토바이 산청래프팅 산청여행
BIG-O쇼 (빅오쇼),여수 밤바다를 장식하는 환상과 감동의 공연,BIG-O쇼 관광지 여수가볼만한곳 여수가족여행 여수공연 여수바다여행   
여수수산시장,50년 역사의 여수 3대 수산시장,꿀잼전통시장 로컬푸드시장 먹킷리스트 쇼핑 수산시장 액티비티_시장투어         
부산근현대역사관 별관,현존하는 대표적인 일제강점기 서양식 건물,문화시설 부산교육프로그램 부산근대역사관 부산역사 부산역사교육 부산청소년체험
존재고택,오랜 역사가 느껴지는 존재고택,관광지 위백규 위백규생가 장흥가볼만한곳 장흥가족여행 장흥종가집  
진목마을 이청준생가,문학작품의 탄생 근원지인 이청준 생가,관광지 문학기행 소설가이청준 소설문학길 장흥 장흥가볼만한곳 전남여행  
전주난장,전주한옥마을의 명소! 민속 추억 박물관,70여개테마존 가볼래터 레트로여행 문화시설 여행구독 전주가볼만한곳     
미포항,해운대의 아름다움을 느낄 수 있는 항구,관광지 미포방파제 미포항 부산가볼만한곳 부산바다여행 해운대 해운대해수욕장
신기한놀이터 떼굴떼굴,아이들의 천국! 신기한 놀이터,관광지 모래놀이터 서대문구신기한놀이터 서대문놀이터 신기한놀이터   
이화여고100주년기념관,다채로운 공연과 문화 교육 행사가 열리는 공간,100주년기념관 공연장 문화시설 서대문공연장 이화여고 이화여고100주년기념관   
고성당항포랜드,가족들과 함께 보내는 즐거운 시간,경남여행 고성가볼만한곳 고성가족여행 고성당항포랜드 고성여행 고성테마파크  
고성 소을비포진성,왜구의 침입을 막기 위해 설치한 성,걷기좋은길 경상남도_여행지_추천 고성가볼만한곳 관광지 성곽길 역사관광지  
삼천포 마리나 레저클럽,청정해역에서 안전하게 즐기는 해양레저,광포항 레포츠 사천가족여행 사천관광 사천수상스키 사천웨이크보드   
남해카약체험센터,안전하게 즐기는 바다와 해안절경,남해가족여행 남해관광 남해여행 남해카약체험센터 레포츠 사촌해수욕장   
드림카약투어,씨카약과 스노클링을 즐길 수 있는 곳,남해가족여행 남해관광 남해스노쿨링 남해액티비티 남해카약 드림카약투어  
선구몽돌해변,특히 둥글고 예쁘기로 소문난 몽돌,경남여행 관광지 남해가볼만한곳 남해낚시데이트 남해바다여행 남해바래길  
장포항,갯바위 포인트,경남여행 관광지 남해가볼만한곳 남해갯바위낚시 남해낚시데이트 남해낚시여행  
포세이돈마린레저,바다에서 다양한 해양 레포츠를 즐길 수 있는 곳,남해가족여행 남해관광 남해액티비티 남해해양레포츠 레포츠 바나나보트  
신도선착장,바닷길을 통해 배를 타고 오가다,DMZ DMZ여행 관광지 모도 서해바다 신도 신도선착장 인천캠핑
삼덕항,낚시 포인트로 알려져 낚시꾼들의 사랑을 받는 곳,경남여행 관광지 삼덕항 통영가볼만한곳 통영낙조 통영낚시데이트 통영낚시여행 
예단포선착장,영종도 북쪽의 아름다운 산책길이 시작되는 작은 항구,관광지 미단시티공원산책로 영종도 영종도산책로 예단포선착장 예단포항
삼여전망대(욕지도),해안절경이 아름다운 곳,경남여행 관광지 삼여전망대 욕지도 통영가볼만한곳 통영데이트명소  
유동해변(유동해수욕장),몽돌이 예쁜 유동해변,경남여행 관광지 욕지도 유동해변 통영가볼만한곳 통영낚시여행 통영몽돌해변 
토영이야길1코스,도란도란 함께 걷기 좋은 길,경남여행 레포츠 토영이야길 토영이야길1코스 통영가볼만한곳 통영산책  
토영이야길2코스,"통영의 문화, 역사가 녹여진 길을 걷는 코스",경남여행 레포츠 미륵산 토영이야길 토영이야길2코스 통영가볼만한곳  
기촌마을,조용하고 아늑한 분위기의 기촌마을,관광지 구례가볼만한곳 기촌마을 밤나무 벚꽃 지리산둘레길 피아골
통영수산과학관,바다의 매력에 빠져들 수 있는 색다른 공간,관광지 통영가족여행 통영교육프로그램 통영수산과학관 통영청소년교육  
오류,,
우포늪체험장,자연을 온몸으로 즐기며 배우는 공간,문화시설 아이와가볼만한곳 우포늪체험장 창녕가볼만한곳 창녕여행 창녕우포늪
화개야생차밭,하동군이 선정한 하동 10경(景) 중 하나,관광지 야생차 야생차밭 야생차체험 차밭사진 차밭풍경 화개차밭
법하마을,한국의 아름다운 길이 있는 마을,가탄-송정구간 관광지 법하마을 십리벚꽃길 십리벚꽃터널 지리산 둘레길 
둘레길하동센터,지리산 둘레길 순례증과 배지를 발급받는 곳,둘레길순례증 둘레길안내센터 둘레길안내소 문화시설 스탬프북 지리산둘레길 
보성 이진래고택,시골의 정취와 한옥의 서정적인 분위기를 제대로 느끼다,고택 관광지 보성가볼만한곳 보성이진래고택 역사여행 이진래 이진래고택 
관동마을,지리산 자락의 고즈넉한 마을,관광지 김해가볼만한곳 김해관광 산책하기좋은 솔뫼생태공원 솔뫼생태공원둘레길
궁항마을,넓은 평야지에 자리한 자연마을,관광지 궁항댐 궁항마을 궁항마을민박 위태–하동호구간 지리산둘레길
백운공원,희망을 노래한 한하운 시인의 시비가 있는 곳,관광지 백운공원 부평산책로 부평축구장 부평테니스장 한센병시인
틈문화창작지대,문화 콘텐츠 창작자 양성과 인천 지역의 문화산업을 육성하는 곳,문화시설 미추홀구틈문화창작지대 영상제작 인천각종행사 인천콘텐츠코리아랩 
연경산배드민턴장,사계절 누구나 이용할 수 있는 운동시설,레포츠 미추홀구배드민턴장 실내배드민턴장 연경산 연경산배드민턴장 
아차산배수지체육공원,다양한 근린시설과 도심 속 자연 휴식공간,관광지 광진구농구장 광진구족구장 광진구체육공원 광진구축구장 광진구풋살장 
잠실야구장,한국의 대표 경기장,LG트윈스 두산베어스 레포츠 야구경기장 야구장 잠실야구장 잠실종합운동장 
뱃길조각공원,아라뱃길에 있는 일몰이 멋진 조각공원,경기도 공원 관광지 김포 김포가볼만한곳 김포공원 나들이
춘천칠층석탑,과거와 현재의 연결,관광지 춘천가볼만한곳 춘천보물 춘천여행 춘천칠층석탑
춘천한백록묘역,임진왜란 당시 이순신 장군과 함께 싸운 충장공 한백록의 묘,관광지 득충 춘천가볼만한곳 춘천여행 춘천한백록묘역
석산곶,아름다운 일출을 만나볼 수 있는 곳,관광지 서해바다 석산곶일출 야경명소 영종도일출 인천석산곶 일출
붓이야기박물관,한국 전통 붓의 모든 것,문화시설 박경수필장 붓이야기박물관 춘천가볼만한곳 춘천여행
순천만탐사선,배를 타고 바람을 맞으며 가까이에서 느끼는 순천만 습지의 아름다움,관광지 선상투어 순천가볼만한곳 순천만 순천만탐사선 순천생태체험  
신장절공묘역,고려의 개국공신 장절공(壯節公) 신숭겸 장군의 묘소,관광지 신숭겸장군 장절공신숭겸장군묘역 춘천가볼만한곳 춘천여행
초록잎이펼치는세상,눈 앞에 펼쳐지는 초록빛,관광지 녹차밭전망카페 보성가볼만한곳 보성감성카페 보성녹차밭 보성녹차아이스크림  
죽림동성당,춘천의 역사가 담긴 주교좌성당,관광지 죽림동성당 춘천가볼만한곳 춘천성당 춘천여행
율포항,보성 녹차밭에 이어 많은 관광객이 찾는 명소,관광지 보성가볼만한곳 보성바다여행 율포관광지 율포항 율포해수욕장 
비봉공룡공원,상상만해도 즐거운 공룡테마파크,관광지 보성가볼만한곳 보성가족여행 보성공룡체험 보성테마파크 비봉공룡공원  
매운탕골,민물고기 음식 전문점을 만날 수 있는 춘천 명소,관광지 매운탕골 춘천가볼만한곳 춘천댐맛집 춘천매운탕
봇재,보성의 차산업과 차문화를 보여주는 공간,녹차 문화시설 보성가볼만한곳 보성녹차 보성역사문화관 보성특산물  
묵호시장,묵호항 바로 앞에 있는 재래시장,쇼핑
득량만바다낚시공원,바다낚시하는 시간,가족바다낚시 낚시데이트 득량만바다낚시공원 레포츠 보성가볼만한곳   
광양매화문화관,"매화와 매실의 모든 것, 광양매화문화관",광양가볼만한곳 광양매화문화관 광양여행 매실담그기체험 매화마을 매화전시관  
