place,info,문의 및 안내,홈페이지,주소,이용시간,휴일,주차,지정현황,화장실,주차요금,review,이용요금,접근로,출입통로,장애인 주차 안내,엘리베이터,대중 교통,이용가능시설,입장료,시설이용료,유모차,수유실,휠체어,유아용보조의자,판매 품목,체험가능 연령,시각장애 기타상세,규모,개장기간,부대시설,주요시설,객실,입점브랜드,관람석,점자 홍보물,수용인원,오디오 가이드,지체장애 기타 상세,주차 요금,점자 블록,대여안내,보조견 동반,안내 요원,코스안내,보유장비,강습안내,이용 시기,입실시간,퇴실시간,객실내 취사 여부,식음료장,객실수,예약안내,예약안내 홈페이지,객실유형,영유아가족 기타상세,체험
일산수산물판매센터,울산 동구에 위치한 싱싱하고 질 좋은 수산물과 횟감을 살 수 있는 곳으로 1층에서 횟감을 고르고 2층에 있는 초장집에서 싱싱한 회를 즐길 수 있다. 지난 2010년 5월에 개장한 일산 수산물 판매센터는 자연산을 주로 판매하며 총 4개 어장을 보유하고 있는 일산 어촌계에서 운영하고 있다. 그래서 다른 어느 곳보다 싱싱한 해산물을 맛볼 수 있는 곳이다. 1층은 오후 8시 정도면 영업을 마감하지만 2층 초장집은 10시까지 운영한다. 초장집은 몇 군데가 있으며 가격은 동일하다. 일산해수욕장과 아주 가까운 곳에 있다.,,,울산광역시 동구 일산진11길 150 (일산동),점포별 상이,매주 월요일,가능 (소형 약 110여 대),,,,,,,,,,,,,,,,,,"수산물, 활어회",,,,,,,,"활어직판장, 건어물판매장, 초장집",,,,,,,,,,,,,,,,,,,,,,,,
울산농산물종합유통센터,"울산광역시 북구에 위치한 울산농산물종합유통센터는 지역 농수산물 소비 촉진을 위해 관내 농수축산물 최우선 구매를 원칙으로 한 농협이 농수산물 유통 활성화와 가격 안정을 위해 설립한 대형 쇼핑몰이다. 유통단계를 최소화하여 물류비용을 절감하는, 즉 생산자와 소비자를 동시에 보호하며 건전한 소비와 유통을 위해 노력하고 있다. 또한, 매장 직원을 울산 시민 80% 이상 고용하는 것을 원칙으로 하는 울산의 일자리 창출을 위해서도 노력하고 있다. 아울러 꽃 시장도 있어 다른 대형 쇼핑센터와 차별화된 시장이기도 하다. (주)농협 하나로유통에서 운영한다.",,,울산광역시 북구 진장유통로 90 (진장동),"마트 09:00 ~ 22:00
하훼매장 10:00 ~ 21:00",연중무휴,"가능 (1,260대 / 지하주차 160대,지상주차 1,100대)",,,,주로 회포장할때 방문해요 가게가 많아서 골라살수있어요 그 외에 과일도 신선해서 박스로 구입할때는 농수산물로 갑니다. 새벽에는 생선도매도 저렴하게 구입할수 있으니 참고하세요 식자재도매매장이 함께 있어 자주 방문했습니다. 상품이 신선하고 종류도 많아 사람도 많고 주차공간도 넓어서 이용하기가 아주 편합니다. 꽃시장까지 함께라 눈코입이 전부 즐겁습니다,,출입구까지 턱이 없어 휠체어 접근 가능함,주출입구는 턱이 없어 휠체어 접근 가능함,장애인 주차장 있음_무장애 편의시설,,,,,,,,,,"농수산물, 축산물, 화훼 작물 등",,,,,,,,,,,,,,,,,,,,,,,,,,,,,,,,
학성새벽시장,"1974년 개설된 학성새벽시장은 울산 최고의 도소매 시장으로 산지 직송의 식자재를 싼 가격에 판매하는 등 연간 매출액이 600억이 넘고, 일 방문객도 5,000명을 넘어서는 명실상부한 울산의 식자재 시장이다. 주로 새벽에 장이 서며, 대량 위주로 도매 거래를 한다. 시장 내 2개 구간을 지정해 특색 있는 디자인 골목을 조성하고, 시장 입구에는 LED 전광판을 설치해 적극적으로 시장을 홍보하고 있으며 특색 있는 포장재 제작과 소비자와의 소통을 위한 모바일 마케팅도 준비하고 있다. 나아가 공공기관과 학교, 대형 식당에 식자재를 납품하는 배달 서비스도 하고 있다.",,,울산광역시 중구 새벽시장3길 21 (학성동),04:00~21:00 (점포별 상이함),"점포별 상이함
※ 매주 일요일 쉬는 곳 많음",가능 (인근 주차장 이용 가능),,,,,,출입구까지 턱이 없어 휠체어 접근 가능함,주출입구는 턱이 없어 휠체어 접근 가능함_무장애 편의시설,,,,,,,,,,,싱싱한 채소와 농산물,,,,,,,,,,,,,,,,,동반가능_시각장애인 편의시설,,,,,,,,,,,,,,,
범서온천 지지워터피아,"범서온천은 지하 1,000m 천연암반수에서 뽑아 올린 최고의 수질, 천연물 탕인 100% 천연 온천수이다. 특히 pH.6의 알칼리성 수질로 비누를 조금만 사용해도 거품이 잘 일고 피부에 탄력을 주는 좋은 효과로 목욕 후에도 피부가 부드러워진다. 양이온인 나트륨, 칼슘, 칼륨, 마그네슘 등과 음이온인 중탄산, 탄산 등 인체에 이로운 성분이 다량 함유된 광천으로 아름다운 피부와 건강을 지킬 수 있게 해 준다. 신경통 류머티즘 질환, 위장병, 부인병, 만성 변비, 피로 해소, 두통, 불면증, 아토피 등에 탁월한 효능을 가진 최상의 건강 온천탕이다.",,,울산광역시 울주군 범서읍 두동로 704,06:00~20:00,연중무휴,가능,,있음,,,,,,,,,,,"- 대인 11,000원
- 소인 7,000원",,,,,,,,,,,,,,,,,,,,,,,,,,,,,,,,,,,,,
솔개해수욕장,"솔개해수욕장은 진하해수욕장에서 간절곶 방향으로 가다 보면 나오는 해변이다. 울산 시가지 변두리에 있어 접근성은 조금 떨어지지만, 번잡하지 않은 해수욕장을 원한다면 안성맞춤이다. 여름에 성수기 때 한적한 곳을 원한다면 추천한다. 솔개해수욕장은 아주 고운 모래를 가지고 있는 아담하고 작은 해변이다. 인근 해수욕장에 비하면 규모는 작지만 많은 사람으로 붐비는 해수욕장과는 또 다른 매력을 느낄 수 있다. 해수욕장에서 데크 산책로로 해안을 산책할 수 있으며, 해수욕장과 인접한 곳에 여가를 즐길 수 있는 시설도 있다. 또한, 솔변공원도 조성되어 있다.",,,울산광역시 울주군 서생면 진하리,상시 개방,연중무휴,가능,,,,작지만 아이들과 놀기엔 딱인 해수욕장입니다 진하에서 쭉 걸어오면 경치가 끝내주죠 ㅎ,,,,,,,,무료,,,,,,,,,,,,,,,,,,,,,,,,,,,,,,,,,,,,,,
고복수음악관,"울산 중구 중앙 1길 및 새즈믄해거리 일대에 조성된 고복수 길을 따라 걷다 보면 복고 감성으로 무장한 낡은 건물과 오래된 골목이 말을 걸어온다. 오래된 가정집을 개조하여 꾸며진 고복수 음악관은 1층은 전시공간 2층은 복합 문화공간으로 운영되고 있다. ‘타향살이’로 유명한 울산 출신 고복수 선생과 부인 황금심 여사의 생애와 그의 작품, 대표곡도 감상할 수 있게 꾸며놓았다. 고복수 음악관은 개화기 시대의 분위기를 고스란히 느낄 수 있는 축음기, 피아노, 등의 소품과 인테리어로 꾸며 레트로풍 감성 사진을 찍기에도 안성맞춤이다. 울산에서는 한국 가요사에 큰 발자취를 남긴 고복수 선생의 업적을 기리고 한국 대중가요 발전을 위해 매년 고복수가요제를 개최하고 있다. 2층 카페 성남살롱에서는 음료를 즐기며 쉴 수 있다.",,,울산광역시 중구 중앙1길 9 (성남동),10:00~18:00,매주 월요일 / 1월 1일 / 설·추석 당일,가능,,있음,유료,,,,,,,,가수 고복수 선생의 전시공간 / 고복수 카페 성남살롱,무료,,,,,,,,,,,,,,,,,,,,,,,,,,,,,,,,,,,,,,
마근저수지,마근저수지는 울주군 서생면에서 가장 높다고 하는 곳에 자리 잡고 있다. 화산천의 발원지로 예전에는 화산저수지라고도 불렸다. 화산천은 효암천과 만나 바다로 흘러 들어가는 개천이다. 물이 맑고 주변 풍경이 아름다운 이곳에는 저수지를 한 바퀴 돌 수 있는 둘레길이 조성되어 있다. 둘레길의 절반은 데크 길이고 절반은 일반도로로 이루어졌다. 시작점에 정자가 있으며 적당히 굽은 길이어서 지루하지 않게 걸을 수 있다. 한 바퀴를 거의 다 돈 지점에 ‘길 없음’이란 표지판이 있는데 이곳부터 제방까지는 흙길이다. 제방으로 가려면 시작점에서 가는 것이 더 수월하다. 가벼운 산책이나 나들이하기에 좋은 곳이다.,,,울산광역시 울주군 서생면 화산리,상시 개방,연중무휴,불가능,,없음,,,,,,,,,둘레길 / 체육시설 / 정자,무료,,,,,,,,,,,,,,,,,,,,,,,,,,,,,,,,,,,,,,
울산과학관,"2011년 3월 개관한 이래 연간 30만 명 이상이 찾는 울산의 과학 교육기관이다. 학생과 학부모, 시민들이 함께 즐길 수 있는 다양한 프로그램을 운영하고 있다. 울산과학관은 현대식 건물에 114종의 첨단과학 체험시설을 갖춘 전시체험관, 천체투영관, 천체관측실, 무한상상실, 발명교육센터, 울산메이커미래교육센터, 각종 과학실험실과 갤러리 등을 갖추고 있다. 학생과 시민들에게 다양한 과학 체험활동의 기회를 제공하고, 과학적 소양과 탐구력을 신장시키며, 나아가서는 과학 문화 확산에 공헌하고 있다. 재미와 감동을 주는 과학체험 프로그램을 경험하면서 어린이들의 꿈과 끼를 키울 수 있는 공간이다.",,https://use.go.kr/usm/index.do,울산광역시 남구 남부순환도로 111 (옥동),10:00~17:00,매주 월요일 / 국가 법정 공휴일 (5월 5일 제외),가능,,,,무료로 체험 할 수 있어서 하루종일 놀아도 좋아요 !! 울산과학콴은 어린이들과 부모님들이 많이 방문하네요. 여러가지 체험할 수 있는것들이 많고 배울것도 많습니다. 아이와 함께가기에 너무 유익한 곳이었습니다. 아이가 직접 만져보거 체험해보고 경험하거 너무 좋았습니다. 아이와 시간날때마다 방문해요. 관람할것도 많고 아이가 직접 조작하고 체험 할 수 있는게 다양해요 ^^ 셀프로 인바디 검사도 할 수 있어서 굿굿 !! 아이가 유독 좋아하는곳중 한군데입니다. 다양한 볼거리와 체험을 할수 있습니다 요즘같이 더운 날씨에 실내에서 아이와 함께 관람 또는 체험하기에 좋습니다. 어른들도 재미있어요 아이와 함께하기 좋아요 이것저것 같이 체험하고 과학에 흥미와 관심도 생기고^^ 다양한 체험을 할 수 있어요. 과학을 재미있고 쉽게 접할 수 있어서 좋습니다. 무엇보다 아이들이 좋아해요^^ 아이와 1년에 한두번은 꼭 체험하러 가는곳입니다. 아이가 어려 매년 보는 시각이 달라지니 늘 다른 호기심으로 접근 하더라구요-! 추천합니다 울산과학관 추천합니다. 재미와 감동을 주는 과학체험 프로그램을 경험하면서 어린이들의 꿈과 끼를 키울 수 있는 공간으로 아이들과 가기 좋습니다 아이 손 잡고 2-3살때부터 가던곳입니다^^ 아이도 어른도 남녀노소 볼거리도 많고 체험도 해볼수 있으니 꼭 한번 가보는것을 추천해요,무료,출입구까지 턱이 없어 휠체어 접근 가능함,주출입구는 턱이 없어 휠체어 접근 가능함(수동문),장애인 주차장 있음(14대)_무장애 편의시설,엘리베이터 있음,,,,,대여가능(안내데스크),수유실 있음(1층),,,,,,,,,,,,,,,,,무료,점자유도로 있음_시각장애인 편의시설,,,안내요원 있음,,,,,,,,,,,,,,과학체험교실 / 천체체험교실 / 발명교육
나사해변(나사리해수욕장),"모래가 쌓여 육지로 변해 마을이 된 나사(모래가 뻗어 나간다는 뜻) 마을의 이름처럼 이곳 나사해변은 육각 모래 해변으로, 모래가 몸에 잘 엉겨 붙지 않아 잘 털어지는 장점이 있는 곳이다. 물놀이 후에도 끊임없이 나오는 모래가 아닌 쉽게 털어버리고 해변을 벗어날 수 있어서 좋고, 주변의 거센 파도와 바람에도 이곳은 방파제로 인해 언제나 아늑하고 고요한 해변을 만날 수 있다. 한적하고 여유로운 바닷가에서 에메랄드빛을 내는 아름다운 바다를 바라보며 걷다 보면 바다의 낭만에 푹 빠지게 된다. 나사해변 끝자락에 이어지는 나사항에서 신선한 해산물도 맛볼 수 있어 산책과 식도락을 함께 즐길 수 있는 곳이다.

◎ 한류의 매력을 만나는 여행 정보 - 드라마 <이번 생도 잘 부탁해>
반지음과 문서하가 바다를 배경으로 춤을 추던 장소인 ‘나사해수욕장’은 반짝이는 윤슬이 아름다워 많은 시청자의 마음을 설레게 했던 장면이다. 쌓인 모래가 육지로 변해 마을이 되었다는 나사 마을의 해수욕장인 이곳에서 천천히, 느긋하게 산책을 즐겨보는 것을 추천한다.",,,울산광역시 울주군 서생면 나사리 434-5,상시 개방,연중무휴,가능,,없음,무료,"오늘은 날씨도 좋쿠 바다색깔도 이쁘고 너무 좋으네요 평일 오전에도 사람들 은근 많아요 ㅎ 등대가 아주 이쁜게 있고 파도가 다소 사납습니다 ㅎㅎ 하지만 조용하게 거닐면서 다니기 너무 좋지않나 싶습니다 제가 좋아하는 곳입니다^^ 조용하고 한적해서 쉬고싶을 때 찾아가곤 합니다. 주변 맛난 식당, 예쁜 커피숍이 많아요♡ 절로 힐링됩니다 나사해변의 부드러운 모래와 등대가 멋져요",,,,,,,등대 / 나사항,무료,,,,,,,,,,,,,,,,,,,,,,,,,,,,,,,,,,,,,,
덕신소공원,"덕신소공원은 울주군 온산읍에 있는 작은 도심 근린공원으로 삼각형 모양의 땅에 공원을 조성했다. 언제든 공원 내 운동 시설을 이용할 수 있으며 공원 바닥이 평탄해서 어린이들이 스케이트보드나 인라인스케이트를 즐기기에 안전하다. 봄에는 벚꽃놀이를 즐길 수 있으며 여름에는 물놀이장을 운영해 물놀이를 즐길 수 있다. 또한, 야외 무대를 갖추고 있어 다양한 공연을 즐길 수도 있다. 특히 덕신소공원 내 화장실은 국민 안심 공중 화장실로 범죄 예방 디자인 개선 작업을 마쳐서 더욱 안심하고 이용할 수 있다.",,,울산광역시 울주군 온산읍 덕신리 269,상시 개방,연중무휴,가능,,있음,,덕신소공원에서 행사도 하고 애들도 매일 뛰어놀고 어르신들 운동하시게 기구도 많아요 여기는 저녁먹고 산책하러 오면 좋습니다 가볍게 운동하기 편한곳이에요 동네 행사 있을때마다 여기서 해서 자주 와요 ㅎ,,출입구까지 턱이 없어 휠체어 접근 가능함,주출입구는 턱이 없어 휠체어 접근 가능함_무장애 편의시설,,,,,무료,,,,,,,,,,,,,,,,,,,,,,,동반가능_시각장애인 편의시설,,,,,,,,,,,,,,,
문수산전망대,"문수산은 울산광역시 울주군 청량읍 율리와 범서읍 천상리에 걸쳐 있는 산으로 문수보살이 이곳에 머물렀다고 하여 유래한 지명이다. 문수산 전망대에서는 영남알프스와 울산광역시를 조망할 수 있으며 전망대 2층에 등산로로 연결된 다리가 있어 짧은 등산코스를 원하는 사람들은 이곳에 자동차를 주차하고 전망대에서부터 산행을 시작하기도 한다. 최단 거리 코스이긴 하지만, 전망대부터 정상까지 급경사로 이어지는 탐방로이다. 전망대에서 문수산 정상까지는 1시간 30분 정도 걸리고 문수사까지는 30여 분 소요된다. 굳이 등산하지 않더라도 차량을 이용해 숲 속 맑은 공기를 마시며 나들이하기 좋은 장소이다.",,,울산광역시 울주군 청량읍 문수산길 514,상시 개방,연중무휴,가능,,있음,,문수산전망대 현재는 문수산쉼터이네요. 옛날에는 여기서 문수산을 전망할 수 있었는데 지금은 숲이 우거져서 전망이 잘 보이지 않음.,,,,,,,전망대,무료,,,,,,,,,,,,,,,,,,,,,,,,,,,,,,,,,,,,,,
울산큰애기집,"울산 시민과 관광객에게 다양한 볼거리를 주는 울산큰애기집은 관광상품 전시와 판매를 하고 있는 문화 복합공간이다. 울산큰애기는 2019년 제2회 우리 동네 캐릭터 대회에서 대상을 차지한 울산 대표 캐릭터이다. 1층은 관광안내소와 울산 큰 애기 캐릭터가 들어간 기념품샵이 자리하고 있다. 2층은 울산 큰 애기를 주제로 다양한 소품으로 꾸며진 전시공간이다. 특히 공주 침대와 아기자기한 소품들로 가득 찬 큰 애기 룸은 어린아이들이 가장 좋아하는 곳이다. 3층은 개화기 콘셉트의 스튜디오 이팔청춘 사진관이다. 복고풍 의상을 대여할 수 있어 연인, 친구, 가족들과 함께 찾는다면 다양한 스타일로 연출해 이색 사진을 찍을 수 있다. 스튜디오 이용 시 사전예약이 필요하다. 큰 애기 집을 나와 조금만 걸으면 울산 큰 애기 상점가가 있어 함께 둘러보기 좋다.",,,울산광역시 중구 문화의거리 28,10:00~19:00,연중무휴,불가능,,,,울산큰애기집 ㅋㅋㅋ 다녀왔어요. 울산에 지인 결혼식이 있어 갔다가 시간이 남아서 추천 받아서 다녀왔네요. 관광상품 전시와 판매를 하고 있는 문화 복합공간인데 울산 대표 캐릭터인 울산 큰애기 정말 새롭네요. 독특하기도 하구요.사진도 찍을수 있고 쇼핑도 할수 있어서 남은 시간 정말 잘 이용하고 왔네요. 울산 큰애기집 한번 꼭 다녀오세요. 아이들과 함께갔는데 만족합니다 1층에는 여행자팜플렛과 울산큰애기 소품등을 구입할 수 있어요 그리고 윗층으로 가시면 큰애기방 컨셉의 핑크색 가득한 예쁜 방이 있어서 컨셉 사진을 찍기좋아요,무료,,,,,,,,,,,,,,,,,,,,,,,,,,,,,,,,,,,,,,,,,,,,,의상 대여
철구소계곡,"철구소는 울산광역시 울주군 상북면 이천리 배내골에 위치한 곳으로 소의 모양이 좁고 절구 모양이라고 불려서 철구 소라고 불리는 곳이다. 특히 호박소, 파래 소와 함께 3대 소로 꼽히는 곳으로 선녀들이 목욕을 하러 내려오면 이무기가 자리를 피해 준다는 전설이 전해진다. 계곡물이 맑아 1 급수에서 서식하는 산가지와 탱가리, 메기, 가재, 소라 등이 서식하는 곳 중 하나로 부산과 울산 여름 휴가지로 조용한 곳을 찾는 사람들에게 인기가 높은 곳이다. 여름철 물놀이 장소로 이름나 있지만, 수심 5.5m로 깊은 편이어서 주변에 튜브와 구명조끼를 대여해 주는 곳이 있으며 안전요원도 배치되어 있다. 인근 식당에서 평상도 대여 가능하다.",,,울산광역시 울주군 상북면 이천리 829,상시 개방,연중무휴,불가능,,있음,,,,,,,,,,무료,,,,,,,,,,,,,,,,,,,,,,,,,,,,,,,,,,,,,,
불고기 팜 농어촌 테마공원,"불고기 팜 농어촌 테마공원은 상북면 지내리 못안못 일원 94,397㎡ 부지에 수변 공간과 광장 공간, 한우 불고기 테마관 등을 조성한 복합휴양 공간이다. 공원 한가운데 못안못이라는 저수지가 있으며 갈대 생태공원, 미나리 수질정화원을 비롯해 산책로, 전망대, 관찰 데크가 설치되어 있어 아름다운 자연을 보고 즐길 수 있다. 공원 광장에는 어린이 놀이터와 천막형 벤치, 피크닉 테이블이 설치돼 있어 가족 동반 나들이에 제격이다. 또한, 전통 한옥 형태로 지은 한우 불고기 테마관에서는 한우 불고기에 대한 정보를 알 수 있고, 울주군 내에서 생산된 우수한 육질의 한우 불고기를 싼값으로 맛볼 수 있는 한우직판장도 있다. 입도 즐겁고 아이들도 즐겁게 뛰어놀 수 있는 가족 나들이의 최적 장소이다.",,,울산광역시 울주군 상북면 지내리 8,상시 개방,연중무휴,"가능
요금 (무료)",,,,울산외곽에 고기 먹으러 가기 좋은 곳이예요 언양소불고기 유명한데 여기는 공원도 예쁘게 꾸며놔서 아이들이나 어른들산책하기도 좋아요 대기 걸고 산책한바퀴 아니면 식사마치고 가볍게 운동추천합니다,,,,,,,생태공원 / 산책로 / 전망대 / 어린이 놀이터 등,무료,,,,,,,,,,,,,,,,,,,,,,,,,,,,,,,,,,,,,,
와우쥬본점 / 와우 쥬,"와우쥬는 도심 속에서 동물들과 함께하는 울산광역시의 이색 카페로 자유롭게 생활하는 동물을 직접 만지고 가까이에서 호흡하고 교감할 수 있는 특별한 공간이다. 이곳에는 사막여우, 붉은 여우, 다람쥐원숭이, 올빼미 등과 파충류도 있으며 뱀은 직접 만져볼 수도 있다. 남미에서나 볼 수 있는 알파카 등 쉽게 만나기 힘든 동물들을 직접 보고 만져보며 생명의 소중함을 깨닫고 직접 체험할 수 있는 곳이다.",,,"울산광역시 남구 대학로 164 (무거동,웰츠타워)","평일 10:00~18:00
주말 10:00~19:00",연중무휴,가능 (상가 주차장),,있음(남녀구분),와우쥬 이용 시 2시간 무료,너무 귀여워서 좋았어요 공간이 따스워요 동물 가까이서 볼 수 있어서 좋아요 동물을 코 앞에서 마주하고 만져볼 수 있어서 좋아요,,,,,,,,"8,000원",,,,,,,나이 제한 없음,,,,,,,,,,,,,,,,,,,,,,,,,,,,,,,동물 교감 체험
공룡발자국공원,"울산 중구 공룡발자국공원은 약 1억 5천만 년 전 공룡이 살았던 시대의 발자국을 관찰할 수 있는 특별한 장소이다. 이곳은 공룡 발자국을 비롯한 다양한 고생물학적 유적들이 잘 보존되어 있어, 공룡 연구와 교육의 중요한 현장으로 알려져 있다. 공원 내에는 발자국을 실제로 볼 수 있는 탐방로와 전시관이 마련되어 있어 방문객들이 쉽게 공룡의 흔적을 체험할 수 있다. 또한, 아름다운 해안선과 자연경관이 어우러져 산책과 힐링의 공간으로 인기가 높다. 공룡발자국공원은 가족 단위 여행객들에게도 매력적인 명소이다.",,https://tour.ulsan.go.kr/kor/main.ulsan,울산광역시 중구 유곡동 259-2,상시 개방,연중무휴,"가능
요금 (무료)",,장애인 화장실 있음,,"넓은 산책로와 큰 조형물이 있어 아이랑 가기 좋은 곳인 것 같습니다.부산 근교에서 입장료와 주차료가 무료이고,규모도 크고 디테일한 공룡들과 소리와 움직임도 있어 생동감도 있었습니다.넓은 공원에 곳곳에 있는 공룡들을 찾으며 사진 찍는 재미가 쏠쏠했습니다.바닥에 화석도 숨겨진 모래 놀이터에 모래놀이도 가능하고 공룡 뼈 조형물도 감상하며 산책하기 좋았습니다. 공룡을 사랑하는 아이를 키우는 분들이라면 필수인 곳입니다 아이들이 진짜 진짜 너무 좋아합니다 그래서 덕분에 어른들도 재미있게 즐길 수 있어요 넓은 부지에 산책로와 휴게공간이 많아서 힐링하기도 좋은 곳입니다",,출입구까지 턱이 없어 휠체어 접근 가능함,주출입구는 턱이 없어 휠체어 접근 가능함,장애인 주차장 2면 있음_무장애 편의시설,,,화석 놀이터 / 포토존,무료,,,,,,,,,,,,,,,,,,,,,,,동반가능_시각장애인 편의시설,문화관광해설사 있음,,,,,,,,,,,,,,
방어진항,"1971년 국가 어항으로 지정된 방어진항은 넓은 부지의 수협위판장과 경매장이 있는 울산 대표 어항이다. 방어를 비롯해 갈치, 삼치, 멸치 등 다양한 어종이 잡히고, 인근 수산시장과 회센터에서 싱싱한 수산물을 구매해 바로 맛볼 수 있다. 방파제를 따라 있는 산책로는 사진 찍기 좋은 슬도등대까지 닿아 있고, 방어진항과 대왕암공원, 울기등대, 일산해수욕장으로 이어지는 바닷길 역시 낭만적인 풍경을 자랑한다. 관광자원 활성화를 위해 북방파제 벽화 및 바닥 디자인과 주차장 등을 조성하고, 마을 박물관인 방어진 박물관을 개관하였다. 울산 시민에게는 휴식할 수 있는 쉼터가 되어주고 관광객에게는 많은 볼거리를 제공하고 있다.",,,울산광역시 동구 성끝길 2 (방어동),상시 개방,연중무휴,"가능
요금 (무료)",,,,"방어진항은 슬도 방파제와 방어진항 오른쪽 방파제로 보호된 어촌의 항구 이네요. 방어진 가자미가 유명하다고 하는군요. 아름다운 항구입니다. ""방어진항""은 울산광역시 동구 방어동에 있으며 여러 종류의 수산물이 많습니다. 우리는 방어진활어센터에서 생선회로 점심을 먹고 슬도 쪽으로 도보로 이동하며 생선이랑 말린 생선들을 구경했습니다. 바다의 특유한 냄새가 향기롭네요. 방어진항에서 즉석에서 회썰어서 먹는 횟감이 정말 일품~ 시원함을 느끼며 구경하고 회 썰어서 즉석에서 먹을 수 있어요. 사진찍기도 좋습니다 ㅎㅎ 낚시하는 분도 있더라구요",,,,,,,,무료,,,,,,,,,,,,,,,,,,,,,,,,,,,,,,,,,,,,,,
