place,info,문의 및 안내,홈페이지,주소,이용시간,휴일,주차,지정현황,화장실,주차요금,review,이용요금,접근로,출입통로,장애인 주차 안내,엘리베이터,대중 교통,이용가능시설,입장료,시설이용료,유모차,수유실,휠체어,유아용보조의자,판매 품목,체험가능 연령,시각장애 기타상세,규모,개장기간,부대시설,주요시설,객실,입점브랜드,관람석,점자 홍보물,수용인원,오디오 가이드,지체장애 기타 상세,주차 요금,점자 블록,대여안내,보조견 동반,안내 요원,코스안내,보유장비,강습안내,이용 시기,입실시간,퇴실시간,객실내 취사 여부,식음료장,객실수,예약안내,예약안내 홈페이지,객실유형,영유아가족 기타상세,체험
울산애견공원,"울산 남구 문수국제양궁장 안에 있는 울산애견공원은 지난 2012년 3월에 전국 최초로 문을 연 반려견 전용 운동시설이다. 전국에서 유일하게 전용 수영장과 장애물 경기장을 갖춘 반려견 운동공원으로 해마다 이용자 수가 늘고 있다. 입장 주의사항은 4개월 미만의 어린 견들은 예방접종이 끝난 후에 출입이 가능하며, 전염성 질병 등이 있는 경우에는 출입이 제한된다. 접수처 건물 내에는 반려견인을 위한 다양한 프로그램을 운영하여 정보 교류 활동에 도움을 주고 있다. 대형견과 소형견 운동장이 따로 구분되어 운영 중이며, 집안에서만 생활하던 강아지들이 마음껏 뛰어놀며 스트레스를 해소할 수 있는 강아지들을 위한 공간이다.",,공식 네이버밴드 https://www.band.us/band/92394542,울산광역시 남구 남부순환도로 209 (옥동),09:00~17:00,매주 월요일 / 1월 1일 / 설·추석 연휴,"가능
요금 (무료)",,,,우리집 돌이와 산책겸 운동 나왔습니다. 울산애견공원에는 제법 많은 애견들이 놀려나왔네요. 잘 놀다 왔습니다. 울집 댕댕이랑 넓은곳에서 뛰어놀기 딱 좋아요 집근처라 주말이면자주가곤합니다 저렴한가격에 편히 있다 올 수 있어 너무 좋았어요 주말에 아이랑 멍멍이랑 같이나갈수있는곳이 부족했는데 애견공원을 안뒤로는 비가 오지않으면 자주갑니다 관리도 잘되어있고 눈치보지않고 강아지가 신나게 다닐수있어 저도 좋습니다,,,,,,,"미니풀장 / 애견운동공원(소형견, 대형견 별도) / 어질리티","- 남구주민 2,000원
- 타지역 3,000원
- 경감대상 1,000원
※ 경감대상 : 국가유공자, 독립유공자, 장애인",,,,,,,,,,,,,,,,,,,,,,,,,,,,,,,,,,,,,,펫티켓 행동교정
작천정 계곡,"작천정 계곡은 현 남쪽 5리 부로산 남쪽 기슭 아래에 있고 취서산 몇 리쯤에서 발원한다. 반석이 맑은 개똥벌레 불빛 일색이어서 바라보면 마치 옥판을 깐 듯하다. 냇가에는 바위하나가 웅덩이처럼 파여 술잔의 술을 따르는 모양이어서 내 이름을 작천정 계곡(작괘천)이라 하였다. 아래로 남천으로 흘러들어 울산 태화진으로 들어간다 하였다. 작천정 계곡은 거대한 화강암으로 된 옥산과 봉화산 사이의 협곡으로 이루어져 있으며, 화강암에는 유리의 원료가 되는 형석(螢石)이 많이 포함되어 있다. 자수정의 광맥도 이 형석인 어미돌로 이어져 있다. 이 모석을 따라 파 내려가면 단단한 화강암 속에 자수정 구덕이 형성되어 있다. 고려 충신 포은 정몽주의 글 읽던 자리와 언양 지방 3·1 운동의 중심지로서 역사성을 간직하고 있는 명소이다.",,https://www.ulju.ulsan.kr/tour,울산광역시 울주군 삼남읍 등억알프스로 133,상시 개방,연중무휴,"가능
요금 (무료)",,,,"작천정앞 작괘천은 커다란 암석으로 이루어져 풍류와 멋이 있고 사철 흐르는 물량이 많아 시원한 물소리와 함께 청량감이 좋았어요. 고전 드라마의 한 장면을 연상케하는 멋진 자연계곡이 다시 가고 싶을 정도로 기억에 남았답니다. 아이들과 물놀이 하기 너무 좋은곳이예요 근처 음식점도 많고 야영장이 있어 캠핑도 가능하지요 봄에는 벚꽃길이 장관이고 여름에는 애들과 물놀이하기 너무 좋은곳이예요 달빛,작괘,등억 캠핑장이 있어 아이들과 추억만들기 너무 좋은곳이예요 작천정은 울산과 대구에서 1시간반거리의 좋은 계곡입니다. 옆쪽 작천정 캠핑장과 달빛 캠핑장이있어서, 가족 여행으로 가기 너무 좋았고 작천정 계곡에서의 아이들과의 추억을쌓으며, 튜브로 미끄럼틀도 탈수 있어서 너무너무 좋았습니다. 앞쪽 매점과 시설물관리가 철저히 되고있어 너무 깨끗하고 쾌적한 공간입니다 한적한 여행지입니다. 성수기엔 복잡하지만 매년 여름 찾는 곳입니다 ㅎㅎ 추천합니다..👍",,,,,,,,무료,,,,,,,,,,,,,,,,,,,,,,,,,,,,,,,,,,,,,,
울산 롯데 그랜드 휠,울산고속버스터미널 바로 옆에 있는 롯데 영플라자 건물 7층에 위치한 공중관람차 시설이다. 영플라자 1층에서 매표 후 7층으로 올라가면 탑승할 수 있다. 일반 캐빈과 관람차 바닥이 투명유리로 되어있는 크리스탈 캐빈 두 종류의 관람차가 있으며 예매할 때 선택하면 된다. 건물 옥상에서 대관람차를 타면 1회 약 20분 동안 울산 전경을 감상할 수 있어 쇼핑을 하러온 손님과 관광객 모두가 찾는 명소이다.,,https://www.lotteshopping.com,울산광역시 남구 삼산로 288 (삼산동),"- 월요일~목요일 12:30~19:30
- 금요일~일요일 / 공휴일 12:30~20:30",연중무휴,가능,,있음,,일단 울산 삼산동이라 접근성이 뛰어나고 누구나 이용할 수 있고 밤에 타면 야경도 볼 수 있고 좋습니다 놀이공원이 없는 울산이라.. 관람차라도 탈 수 있어 다행이에요 연인끼리 타기 너무 좋았어요 백화점에 붙어있는 관람차죠 쇼핑과 함께 울산 구경을 한눈에 할수있어요 놀이동산에 있는거 보다 높아서 그런지 저는 좀 무서웠어요 ㅎ 애견카페도 있어 관람차를 안타고도 강아지 데리고 놀러가도 좋을거같아요 인상깊었던 여행지 중의 한곳이었어요 쇼핑몰 옥상에 대관람차가 있어요 그 높이가 어마어마하게 느껴져요 관람후에 주위에 쇼핑도 할수 있고 주위 맛집도 많아 다녀오시기 편해요 도심지라 주차도 편하고 아이와 다녀오기도 좋아요 울산 야경이나 전경을 높은 곳에서 유일하게 볼수 있는 곳이 아닌가싶어요^^ 저는 겁이 너무 많은데 아이가 타보고싶어해서 몇번이나 탔었네요ㅎㅎ 야경을 좋아하신다면 강추 야경이 매우 예쁜 울산의 랜드마크에요 !! 비용도 저렴한편이구 남자친구와 좋은추억 많이쌓고왔네요 ㅎㅎ,,,,,,,,,"[일반 캐빈]
- 대인 6,000원
- 소인 5,000원
[크리스탈 캐빈]
- 대인 7,000원
- 소인 6,000원",,,,,,,,,,,,,,,,,,,,,,,,,,,,,,,,,,,,,
함월루,"‘달을 품은 누각’이라는 뜻으로 예로부터 ‘달의 기운을 받았다’고 알려진 함월산에 위치했다. 중요무형문화재인 최기영 대목장이 도편수로 참여했고, 조계사와 해인사의 현판을 쓴 원로 서예가 송천 정하건 선생이 현판 작업을 맡아 최고의 완성도를 갖췄다. 누각 자체의 아름다움도 돋보이지만 세계에서 세 번째로 긴 현수교인 울산대교의 야경과 울산 시가지를 한눈에 조망할 수 있어 더욱 많은 사람들의 사랑을 받고 있다. 맛집과 예쁜 카페가 많기로 유명한 성안지구에 인접하여 연인들의 데이트 코스로 사랑받고 있다.",,https://www2.junggu.ulsan.kr/tour/index.do,울산광역시 중구 함월1길 7 (성안동),상시 개방,연중무휴,가능,,,,"달을 품은 누각이라는 뜻에 맞게 달빛보며 야경 보기 좋은 곳입니다. 작년 가을에 함월루를 갔었어요. 공기가 시원했고 야경이 예뻤죠. 2층 공간이 넓은데 나무기둥이 여러 개 세워져있어서 기둥 하나당 한 무리의 사람들이 모여 놀았네요. 딱히 뭔갈 하지 않아도 아파트가 바로 근처에 없고 조용한 분위기에 도란도란 노는게 즐거웠습니다. 바로 근처에 달모형 의자가 있는데 거기도 포토존으로 많이 사용하고 주차장도 커서 연인들, 친구들, 많이 와있던게 기억에 남아요^^ 울산 야경명소 함월루 입니다. 낮에가도 멋진 곳이지만 달을 품었다는 의미처럼 예쁜 달을 보기도 좋고 울산시내가 한 눈에 들어오는 야경이 일품입니다!! 한번은 꼭 가봐야지하면서 못가봤어요. 해 지고 야경보러가면 딱일거 같네요. ㅎㅎ",,,,,,,,무료,,,,,,,,,,,,,,,,,,,,,,,,,,,,,,,,,,,,,,
울산 경상좌도병영성,"1417년(태종 17)에 쌓은 울산 병영성은 해발 45m 이하의 낮은 구릉을 이용해 쌓은 조선시대의 전형적인 읍성으로 경상좌도 병마도 절제 사영의 주둔지였다. 전체의 평면 모양은 타원형이며, 성의 크기는 둘레 약 1.2㎞, 높이 약 3.7m 정도 된다. 처음 건립할 당시에는 여장(墻:적으로부터 몸을 보호하기 위하여 성벽 위에 설치한 낮은 담장과 같은 구조물) 등 기본적인 시설만 갖추었다가 세종·문종대에 와서 옹성(甕城)·적대(敵臺:雉城)·해자(垓字) 등 여러 방어시설을 설치하였다. 내부시설로 우물·도랑·창고 등이 있었다는 기록이 남아 있다. 과거 경상좌도 병마절도사영 위치를 기박 산성 자리로 옮기기 위해 그 둘레에 붉은 기를 꽂아두었는데 별안간 동해 쪽에서 일진의 광풍이 거세게 몰아쳤다고 한다. 이때 기 하나가 회오리바람을 타고 남쪽으로 날아갔는데, 그 방향을 따라가 보니 현재의 병영성 위치였다고 한다. 성을 풍수지리적 길지에 지어 외적의 침략을 막고 고을을 지키려는 백성들의 바람이 투영된 설화라 하겠다.

오랫동안 나라의 동남쪽 해안 방어를 담당하던 성은 임진왜란과 정유재란 당시 부근에 주둔하던 왜군이 이곳의 돌을 가져다 울산왜성을 쌓으면서 훼손되었다. 현대에 들어 도시개발사업이 진행되면서 성터만 남았다가 2010년부터 본격적으로 복원 사업이 진행되어, 지금은 많은 부분 원래의 모습을 되찾았다.",,https://www.heritage.go.kr/,울산광역시 중구 서동 149-8,상시 개방,연중무휴,가능,사적 울산 경상좌도병영성 (1987.07.18. 지정),,,산책하기에도 좋고. 비행기시간 맞으면 가까이서 볼 수 있어요 ^^ 역사가 살아숨쉬는 병영성에서 산책하기가 넘 좋습니다 근처 공항과 가까워서 운이 좋으면 가까이에서 비행기 사진도 찍을수 있습니다 고도가 높아 야경도 넘 예뻤습니다 근처에 시장과 카페도 있기때문에 맛집도 즐길수 있는 식도락 여행이었습니다 푸른 잔디와 나무 사이로 난 길을 따라 산책하기 안성맞춤인 곳입니다. 선선한 바람이 부는 날 울산 중구의 전경을 조망할 수 있는 병영성을 방문할 것을 추천합니다. 탁 트인 하늘과 마을을 조망할 수 있는 병영성! 인근에는 공항이 있어 운 좋은 시간대에는 비행기가 날아다니는 장면도 쉽게 마주할 수 있답니다. 성곽 주변에서는 예쁜 사진도 남길 수 있으니 방문해보시는 걸 추천드려요!,,,,,,,,무료,,,,,,,,,,,,,,,,,,,,,,,,,,,,,,,,,,,,,,
수운최제우유허지 동학관,"수운최제우유허지 동학관은 울산광역시 중구 원유곡길에 위치한 사적지이다. 주변 산세가 좋고 주차시설도 잘 갖추고 있다. 건물 앞에 최제우유허지의 자음을 따서 만든 의자를 볼 수 있고, 규모는 지상 1층이며 연면적은 428㎡로 관리사무소, 회의실, 전시공간으로 이뤄져 있다. 동학관 주변으로는 수운샘물, 소규모 테마공원, 최제우유허지 비석, 잔디밭, 생가 2동, 주차장이 있다. 아이들과 실내에서 유익한 시간을 보낼 수 있는 곳으로 가족 단위 관광객들이 많이 찾는다.",,,울산광역시 중구 원유곡길 106-1 (유곡동),09:00~18:00,매주 월요일 / 공휴일,가능,,장애인용 화장실 있음(1층 입구에서 왼쪽),,,무료,,주출입구에 휠체어가 통과 가능함(수동문),장애인 전용 별도 주차칸 있음(2칸),,,,,,,,,,,,,,,,,,,,,,,,무료,,,,,,,,,,,,,,,,,,
약사동 제방유적전시관,"약사동 제방유적 전시관에 들어서면 거대한 제방의 단면인 사다리꼴의 성토층이 전시장 한쪽 면을 가득 채우고 있다. 약사동 제방은 삼국시대 말에서 통일신라시대 초(6~7세기)에 축조된 수리시설로 다른 고대 수리 유적들과 달리 발굴을 통해 축조시기와 기법이 밝혀진 유적이라는 점에서 그 의미가 남다르다. 2년여에 걸친 발굴조사에서 축조방법을 확인한 결과 제방은 단순히 흙을 쌓아 만든 것이 아니라 현대의 댐처럼 매우 복잡한 구조로 되어있다. 가공된 기초지반 위에 점성이 높은 실트층과 패각류를 깔고, 잎이 달린 가는 나뭇가지를 이용한 부엽공법(敷葉工法) 등 고대토목기법이 사용돼 중요한 학술적 가치를 가진 것으로 평가된다. 태화강 하류에서 채집한 굴 껍데기의 탄산칼슘이 수분과 만나 흙을 더욱 단단히 잡을 수 있다는 것을 신라인들이 알고 있었다는 사실이 놀랍고 흥미롭다. 전시관에는 제방 유적 외에도 당시 지역민들의 생활상을 알 수 있는 농기구, 토기 등 출토품들이 전시되어 있으며, 다양한 영상자료를 통해 흥미로운 역사 공부의 기회를 제공한다.",,https://www.ulsan.go.kr/s/,울산광역시 중구 종가14길 22-28 (약사동),09:00~18:00,매주 주말,가능,,장애인 화장실 있음(1층),,,무료,출입구까지 경사로가 설치되어 있음(수동문),주출입구는 경사로가 있어 휠체어 접근 가능함,장애인 주차장 있음(1대)_무장애 편의시설,엘리베이터 있음,,,,,,,,,,,,,,,,,,,,,,,무료,,,,,,,,,,,,,,,,,,
화동못수변공원,"화동못 수변공원은 농업용지로 사용되던 화동못이 주변 개발로 인해 활용성이 없어지자 울산시가 주민들을 위한 휴식공간으로 탈바꿈시켜 수변공원을 만든 곳이다. 총 9,824㎡ 면적에 산책로와 전망대, 생태습지, 물레방아, 간단한 운동을 즐길 수 있는 체육시설, 전기차 충전시설을 구비한 주차장, 그리고 저수지 중앙에 분수 시설을 조성하였다. 자연을 온전히 담은 친환경 산책로를 걸으며 힐링할 수 있다. 화동못 수변공원은 아름다운 휴식공간이자 문화공간으로 주민들의 사랑을 받고 있다.",,https://www.bukgu.ulsan.kr/,울산광역시 북구 화봉동 324,상시 개방,연중무휴,"가능
요금 (무료)",,있음,,,,,,,,,산책로 / 생태습지 / 팔각정 / 버들다리 등,무료,,,,,,,,,,,,,,,,,,,,,,,,,,,,,,,,,,,,,,
세대공감창의놀이터,"세대공감 창의놀이터는 자신의 삶과 마음을 들여다보는 창, 세대와 세대를 열어놓는 창, 놀이를 통해 삶의 의지를 키워가는 공간, 삶의 의미를 지어가는 놀이터이다. 지하 1층에서 지상 1층으로 연결되는 그물놀이터와 지상 1층 나무놀이터는 영유아, 아동이 놀 수 있는 실내놀이터가 있으며, 2층과 창의놀이터 일대 자연공간을 활용하여 상설, 기획프로그램이 상시 운영되고 있는 복합문화공간이다.",,https://www.ubnori.kr,울산광역시 북구 중보1길 25 (중산동),"- 화요일~일요일 09:00~18:00
- 수요일 09:00~21:00 (달빛놀이터 18:30~20:50)","매주 월요일 / 공휴일 (단, 어린이날 제외)",가능 (약 80대),,,,예약하고 그물놀이터 이용했어요 ^^ 아이들도 신나게 놀고 같이 계신 지도해주시는 분들이 잘 놀아주시네요 ^^ 아이들이 놀 수있는공간이 있어서 좋아요 !! 예약하고 참여하면 되요 ^^ 6살부터 그물놀이터 이용가능해요 ^^,무료,,,,,,,,,,,,,,,,,,,,,,,,,,,무료,,,,,,,,,,,,,,,,,,그물놀이터 / 나무놀이터 / 꼼지락공방 / 생태인문놀이 / 펀펀커피 / 꼬마목수 / 여자들의 힐링 향기 등
화암추 등대,"1961년 이후 울산에 공업단지가 조성되면서부터 산업의 대동맥인 석유화학제품들이 쏟아졌고, 울산항에는 이를 실어 나르는배들의 왕래가 잦아지게 되었다. 이에 따라 해양 오염사고 방지 및 선박의 안전항해를 위한 항로표지 설치가 절실히 요구되어져 울산항 관문에 위치한 꽃방마을 끝단에 천년동안 안전하게 항해하기를 기원하는거북이 모양의 화암추 등대가 세워졌다. 현대중공업 울산공업단지 안에 1994년 12월 동양최대 규모로 건립되어 머나먼 여정을 헤쳐온 선박들을 안전하게 울산항으로 인도하게 되었으며 엘리베이터를 이용하여 전망대에 오르면 생동감 넘치는 울산항과 24시간 불빛을 내뿜는 산업단지의 역동성을 한 몸에 느낄 수 있다. 또한, 화암추 등대 데크길은 야경명소가 되어 가족단위 관광객들이 많이들 찾고 있다.",,울산광역시 동구 문화관광축제 https://www.donggu.ulsan.kr/tour,울산광역시 동구 화암등대길 50 (방어동),09:00~17:00,매주 월요일,가능,,있음,,,,출입구까지 경사로가 설치되어 있음,주출입구는 단차가 없어 휠체어 접근 가능함,장애인 전용 주차구역 있음_무장애 편의시설,엘리베이터 있음,,,무료,,,,,,,,,,,,,,,,,,,,,,,,,,,,,,,,,,,,,,
중구문화의전당,"울산의 진산 함월산 자락의 중구혁신도시에 위치한 문화의전당은 울산시민의 다양한 문화 수요를 담당하고 있다. 지하 1층, 지상 3층 규모로 2014년 개관하였으며 지하 1층은 소공연장 겸 리허설룸인 어울마루, 지상 1층은 별빛마루, 소리마루, 지상 2층은 함월홀, 달빛마루, 분장실이 있다. 지상 3층은 문화센터, 레스토랑, 하늘마당이다. 지상 2층의 함월홀은 499석 규모의 대공연장으로 외부와 분리된 이중구조, 전 객석 개별 냉난방, 전 대역 음향 가변장치, 공연에 맞는 자유로운 무대전환, 전 좌석 엇갈림배치로 무대중앙을 조망할 수 있는 특별한 구조를 갖추었다. 별빛마루와 달빛마루는 체육시설 및 각종 공연, 전시, 행사가 가능하며 소리마루는 다이내믹하면서도 섬세한 사운드를 부각한 음악, 영상 감상을 위한 최적화된 공간이며, 어울마루는 소규모 발표회가 가능한 소공연장이다. 레스토랑은 3층 옥상의 하늘마당과 연결되어 있으며 울산 원도심의 야경을 한눈에 감상할 수 있다.",,중구문화의전당 https://artscenter.junggu.ulsan.kr/,울산광역시 중구 종가로 405 (성안동),09:00~18:00 (휴게시간 12:00~13:00),매주 토요일~일요일 / 1월 1일 / 설·추석 연휴,가능,,,,,※ 공연 별로 상이함으로 홈페이지 참조,,,,,,,,,,,,,,,,,,,,,,,,,,,,,,,,,,,,,,,,,,,,,
장생포 문화창고,"한국 경제 발전사에서 울산공업센터 기공식은 빼놓을 수 없는 중요한 장면이기에 이를 기념하는 울산공업센터 기공식 기념관이 설립되었다. 울산공업센터 기공식 기념관은 2021년 6월 26일에 개관된 울산 장생포 문화창고에 위치하고 있었다. 장생포 문화창고는 오랫동안 방치되어 있던 냉동창고를 울산 남구청이 매입한 후 리모델링 작업을 진행하여, 전문가들의 의견 수렴과 설계 변경 등을 거쳐 약 5년 만에 공식 개관된 곳으로, 장생포의 공장과 바다 그리고 사람 3요소가 모인 장생포 중심지에 형성된 복합문화공간이다. 장생포문화창고의 이름은 세창 냉동창고에서 열려던 2차 테스트배드에서 시민들의 투표를 통해 선정되었다. 장생포문화창고의 의미는 ‘장생포의 지역명과 새로운 문화의 보물창고’라는 의미를 지니고 있으며 관람객에게 다양한 문화의 향연을 선보이며 울산 남구 9경에 선정되었다. 총 6층의 건물로 청춘마당, 울산공업센터 기공식 기념관, 갤러리B, 갤러리C, 공유작업실, 북카페, 루프탑으로 층마다 다른 주제의 공간으로 구성되어 있다. 1층에는 청춘마당과 어울림마당이, 2층에는 울산공업센터 기공식 기념관과 냉동창고가 탈바꿈한 체험존이, 3층 갤러리 B는 장생포의 옛 바다의 기운이 담겨진 세창의 옛모습을 간직한 전시장이다. 4층 갤러리 C는 전시 및 워크숍 등 다양한 활용이 가능한 공간이고, 5층 공유작업실은 회의, 강연 및 행사를 진행 할 수 있는 공유공간으로 대관이 가능하다. 6층은 지관서가 2호점 북카페로 공장이 어우러진 장생포 바다뷰를 편하게 관람 할 수 있고, 루프탑은 옥상정원 별빛마당이 있어 장생포의 확 트인 뷰가 특징인 공간으로 다양한 배들과 공장들이 생동감 있게 움직이고 있는 모습을 가까이서 볼 수 있는 공간이다.",,http://www.uwcf.or.kr,울산광역시 남구 장생포고래로 110 (장생포동),10:00~21:00,매주 월요일 / 1월 1일 / 설·추석 당일,가능,,,,여기 전시랑 미디어아트 보고 맨 윗층에 북카페도 있어서 커피마시면서 유리창너머 바다구경도 하고 책읽고 하며 쉬기도 좋았습니다! 옛날 냉동창고를 이런식으로 새로 공간을 디자인한 점이 정말 멋졌습니다! 모노레일로 고래문화마을까지 돌아본후 가까운곳에 미디어아트를 무료로 볼수있다는곳이 있다고해서 가보았다 차는 무료 주차장에 주차하고 4층으로올라가 클로드 모네 미디어아트전을 관람하고왔다 지금은 폴고갱전을 하고있는데 끝나기전에보러가야지 옛날 냉동창고를 리모델링 하여 만든 곳으로 내부에 체험시설과 전시물이 있습니다. 잘 보았습니다. 여라가지 체험과 전시를 같이 즐길수 있어서 좋았어요,전시·공연 별로 상이함,,,,,,,,,,,,,,,,,,,,,,,,,,,,,,,,,,,,,,,,,,,,,
슬도해안둘레길,"갯바람과 파도가 바위에 부딪칠 때 거문고 소리가 난다고 하여 이름 지어진 슬도에서, 대왕암 공원까지 해안선을 따라 이어지는 바닷길 코스이다. 몽돌 해변과 전망대 등이 있으며 탁 트인 동해와 시원한 파도 소리를 벗 삼아 걸을 수 있는 최고의 해안산책로이다. 힐링쉼터가 곳곳에서 마련되어 쉬어가기 좋으며 봄에는 유채꽃과 바다, 돌담이 모두 있어서 제주도에 온 것 같은 느낌을 주는 곳이다. 슬도 해상소공원에는 43m 길이의 경관 교량과 새끼 고래를 업은 어미 고래를 형상화 한 11m 높이의 고래조형물 등이 설치되어 있고, 육지에서 슬도를 연결하는 경관 교량 입구에는 바닷가로 내려갈 수 있는 계단 형태의 친수공간도 조성되어 있다. 슬도해안둘레길 트레킹 소요 시간은 약 40분이다.",,울산광역시 동구 문화관광축제 https://www.donggu.ulsan.kr/tour,울산광역시 동구 성끝길 105-1 (방어동),상시 개방,연중무휴,가능,,,,대왕암공원에서 슬도까지 해안길을 따라 산책을 하면 파란 동해바다를 바라보고 가슴이 뻥 터이네요. 아름다운 길입니다. 이쁜 해안 산책로입니다 탁 트인 바다 부분부터 울산 시내까지 볼 수 있는 넓게 구성된 곳이라 다양한 경치를 즐기기도 좋습니다 여긴 보는 즉시 힐링되는 곳♡ 바다 수심이 얕아 내려 가보고 싶더라구요~~^^물론 내려가진 않았어요ㅎㅎ 주변에 등대도 있고~ 소리박물관도 있고 둘러보기 좋은 곳♡,,,,,,,,,,,,,,,,,,,,,,,,,,,,,,,,,,,,,,,,,,,,,,
